videoId,comment,channelId,channelName
ct3OwOTyZ5o,Love the vids hutch! hit me up if you ever want to play duos  I think it would be fun :) Here are my stats for the last 7 days if you need some credibility https://fortnitetracker.com/profile/pc/yahfilthyanimal (10.48 KD and a 39% win rate),Hutch,shaun0728
ct3OwOTyZ5o,Your a beautiful human being Mr. Hutch. I appreciate the videos Sir. Thank you.,Hutch,shaun0728
ct3OwOTyZ5o,I agree 100% that's why I'm enjoying fortnite so much because I can actually improve instead of just coast like in cod,Hutch,shaun0728
ct3OwOTyZ5o,Quality commentary  quality gameplay  quality guy hutch.,Hutch,shaun0728
ct3OwOTyZ5o,Last time I came this early  I disappointed a woman...,Hutch,shaun0728
ct3OwOTyZ5o,Git Gud  Hutch.,Hutch,shaun0728
ct3OwOTyZ5o,Hutch carry me to victory in Fortnite,Hutch,shaun0728
ct3OwOTyZ5o,You booty cheeks hutch. Git gud,Hutch,shaun0728
AsQsX1uYFV8,Chess is the reason why I started playing Starcraft way back when.,Hutch,shaun0728
AsQsX1uYFV8,Is it just coincedence that i got a chess commercial at the start of this video?,Hutch,shaun0728
AsQsX1uYFV8,Ahah I'm all for corny skits tbh,Hutch,shaun0728
AsQsX1uYFV8,That intro literally had me in stitches,Hutch,shaun0728
AsQsX1uYFV8,With that acting it's more like Brazz Tactics lmfao,Hutch,shaun0728
AsQsX1uYFV8,what the fuck is this,Hutch,shaun0728
AsQsX1uYFV8,This kind of awkward humor is probably why I've been subscribed to hutch for so long tbh,Hutch,shaun0728
AsQsX1uYFV8,Please get back to chess Hutch.  I miss it.  And you have no friend  ;-),Hutch,shaun0728
AsQsX1uYFV8,you guys are damn cute,Hutch,shaun0728
AsQsX1uYFV8,lmao amazing intro. got my hopes up that it was a chess vid though :(,Hutch,shaun0728
AsQsX1uYFV8,Game looks sick!,Hutch,shaun0728
AsQsX1uYFV8,oscar worthy:),Hutch,shaun0728
AsQsX1uYFV8,this is the hutch i remember,Hutch,shaun0728
AsQsX1uYFV8,Please more sponsor videos like this lol.,Hutch,shaun0728
AsQsX1uYFV8,I love ad videos like this because I love hutch and videos like this means that hutch is being paid <3,Hutch,shaun0728
AsQsX1uYFV8,I don't pay top down strat games  but they could do some really cool shit with the avatars in the multiplayer aspect of this game if the idea takes off... imagine being able to like float by your opponent as they're doin their own shit on their side of the map,Hutch,shaun0728
AsQsX1uYFV8,I hear "lead designer of Age of Empires 2" and i was sold,Hutch,shaun0728
AsQsX1uYFV8,The joke landed :p,Hutch,shaun0728
AsQsX1uYFV8,"intro was supposed to be awkward." ...you guys nailed it.,Hutch,shaun0728
AsQsX1uYFV8,"I'm not really a very intelligent guy" - yeah nice try being humble there Hutchy,Hutch,shaun0728
AsQsX1uYFV8,Lol the intro Academy Awards here comes Hutch,Hutch,shaun0728
AsQsX1uYFV8,I've watched this intro like 5 times. It's so funny.,Hutch,shaun0728
AsQsX1uYFV8,The intro was made funny and cute and loveable by the self-aware nod in the commentary afterward. It's making me smile imagining you guys fumbling through doing the filming of it - I would to see the fails xD,Hutch,shaun0728
AsQsX1uYFV8,The acting is CRINGE,Hutch,shaun0728
AsQsX1uYFV8,Hehehe I love your intros like these XD,Hutch,shaun0728
AsQsX1uYFV8,Am I the only one who heard "Breasts Tactics"?,Hutch,shaun0728
AsQsX1uYFV8,This game looks fucking amazing,Hutch,shaun0728
AsQsX1uYFV8,"makes sense" fucking savage af lol i love it,Hutch,shaun0728
AsQsX1uYFV8,This was great LOL,Hutch,shaun0728
AsQsX1uYFV8,Did u ever play age of empires 2 hutch ?,Hutch,shaun0728
AsQsX1uYFV8,loved this video dude :D got me laughing quite a bit :D :),Hutch,shaun0728
AsQsX1uYFV8,Do more of these hutch  awesome work. Had a very clean respawn vibe to it.,Hutch,shaun0728
AsQsX1uYFV8,This was the cringiest video ever. I love it.,Hutch,shaun0728
AsQsX1uYFV8,This intro is fucking. Genius. Love the cringe,Hutch,shaun0728
AsQsX1uYFV8,Lol had a whiff of some respawn flair in it. I like it :),Hutch,shaun0728
AsQsX1uYFV8,The intro/outro WAS very awkward  man........ I loved it! :D,Hutch,shaun0728
AsQsX1uYFV8,Great ad video actually  props Hutch.,Hutch,shaun0728
AsQsX1uYFV8,That intro. Consider my pickle  tickled.,Hutch,shaun0728
AsQsX1uYFV8,Loved the intro. More awkward sketches please,Hutch,shaun0728
AsQsX1uYFV8,you have some DUMBASS tattoos lmao,Hutch,shaun0728
AsQsX1uYFV8,Loved it!!,Hutch,shaun0728
AsQsX1uYFV8,This hurt my neck just watching :/,Hutch,shaun0728
AsQsX1uYFV8,Jokes made me laugh.,Hutch,shaun0728
AsQsX1uYFV8,That was really funny! believe in yourself hutch come on!,Hutch,shaun0728
AsQsX1uYFV8,the intro was just perfect!,Hutch,shaun0728
AsQsX1uYFV8,MORE! HUTCH! SKITS!!!,Hutch,shaun0728
AsQsX1uYFV8,That intro actually was pretty amusing  the awkwardness I think was spot on and perfect. Now where the hell are the actual chess videos?,Hutch,shaun0728
AsQsX1uYFV8,Hilarious..... but yeah was awkward. But that's part of makes it funny. (:,Hutch,shaun0728
AsQsX1uYFV8,Intro/outro was the best part xD,Hutch,shaun0728
AsQsX1uYFV8,You and esme are super dope  y'all need to do more little stuff like this!!,Hutch,shaun0728
AsQsX1uYFV8,Hutches comedy  aka my favorite comedy. I missed the sketches!!!,Hutch,shaun0728
AsQsX1uYFV8,Not akward enough you have lost your edge hutch :P,Hutch,shaun0728
AsQsX1uYFV8,I was so hopeful when I saw you and chess.. But nope. So hopeful when I saw chess and oculus..  BUT NOPE!,Hutch,shaun0728
AsQsX1uYFV8,your beard looks like shit,Hutch,shaun0728
AsQsX1uYFV8,Love your videos man been around since 300 subs. I think you have grown up a lot (so have I) and just keep up the good work. Btw love the beard.   Also you should try and make more vids with Mr. Sark   Ps love the beard bro,Hutch,shaun0728
AsQsX1uYFV8,Nice to see some sketches from you two  Hutch! Quick tip  the shots in the beginning broke the 180 degree rule in film - both people are looking in the same direction off-screen which sometimes makes it confusing who's looking at whom (it's obvious in this case though). That and Esme's shot was a little crooked...but yeah keep making these types of vids to get more practice!,Hutch,shaun0728
AsQsX1uYFV8,Does nobody else see how fake and money hungry Hutch has become?,Hutch,shaun0728
AsQsX1uYFV8,LOLOLOLOLOLOLOL,Hutch,shaun0728
AsQsX1uYFV8,wait Hutch  playing chess :O,Hutch,shaun0728
AsQsX1uYFV8,Hahaha this is super awesome man!!!,Hutch,shaun0728
AsQsX1uYFV8,Greaat acting Hutchy  thus deserves an Oscar domination,Hutch,shaun0728
AsQsX1uYFV8,hutchEsme hutchEsme hutchEsme hutchEsme hutchEsme hutchEsme hutchEsme hutchEsme,Hutch,shaun0728
AsQsX1uYFV8,Love your awkward skits Huuutch!!,Hutch,shaun0728
AsQsX1uYFV8,Yes I have been waiting for more Chess videos!!!!!!!!  Edit: nvm it's not Chess,Hutch,shaun0728
AsQsX1uYFV8,damn it thought this was a chess vid!,Hutch,shaun0728
AsQsX1uYFV8,I thought "The Awkward Genie" was a new opener you were going to teach my at first,Hutch,shaun0728
AsQsX1uYFV8,Wouldn't your neck hurt from looking down for such a long period of time? Especially with the weight of a VR headset on your head.,Hutch,shaun0728
AsQsX1uYFV8,You just reminded of the old respawn days where you Adam and Sark and Hollywood would screw around with stupid skits  you're so good at making them funny  I'd love to see you do more.,Hutch,shaun0728
AsQsX1uYFV8,I am having some respawn vibes from this,Hutch,shaun0728
AsQsX1uYFV8,That intro! Lmfao. Need more skits Hutch. You are fucking hilarious,Hutch,shaun0728
AsQsX1uYFV8,I love how awkward it was and how it seemed like it was edited and taped by a crew of high schoolers. Loved it. Hope thats what you were going for,Hutch,shaun0728
AsQsX1uYFV8,Finally  a non-fortnite video,Hutch,shaun0728
AsQsX1uYFV8,More skit videos hutch!,Hutch,shaun0728
AsQsX1uYFV8,I see awkward hutch sketch. I click like.,Hutch,shaun0728
AsQsX1uYFV8,Damn.. I thought it was gonna be VR chess..,Hutch,shaun0728
AsQsX1uYFV8,I love Esme :),Hutch,shaun0728
AsQsX1uYFV8,Yes chess!!!,Hutch,shaun0728
AsQsX1uYFV8,So much motion,Hutch,shaun0728
AsQsX1uYFV8,More chess tips dammit boy,Hutch,shaun0728
AsQsX1uYFV8,The intro works man,Hutch,shaun0728
AsQsX1uYFV8,Can we get more weird intros like that? I love it!,Hutch,shaun0728
AsQsX1uYFV8,hutch take any sponsor you want as long as you sell it like this! reminds me of the old respawn days  great work,Hutch,shaun0728
AsQsX1uYFV8,I WAS SO EXCITED FOR CHESS!,Hutch,shaun0728
AsQsX1uYFV8,Is this really just a four and a half minute ad?,Hutch,shaun0728
AsQsX1uYFV8,Yep it landed,Hutch,shaun0728
AsQsX1uYFV8,You really have to quit with the background music. It seems like that's often a problem in your videos. Or it's to loud or it doesn't fit the video. I'm not trying to be negative. I've been a fan for a long time! Love you hutch.,Hutch,shaun0728
AsQsX1uYFV8,no bloopers?,Hutch,shaun0728
AsQsX1uYFV8,I'll be honest. From the title  I thought this was the first in a series of mini-chess tutorials that he was going to call "Brass Tactics" (As in  "Let's get down to brass tax(tics)")  and his first lesson was going to be about an opening called the Awkward Genie.  Damn do I miss those chess videos.,Hutch,shaun0728
AsQsX1uYFV8,The intro was weird but it made me feel nice  9/10,Hutch,shaun0728
AsQsX1uYFV8,those horrorfilmworthy dead eyes.. nightmare fuel,Hutch,shaun0728
AsQsX1uYFV8,only you can make a promoted video so much fun :D,Hutch,shaun0728
AsQsX1uYFV8,I like these type of videos Hutch. Here is some feedback for you. Follow the 180 rule and make sure you have matching eye lines with your actors. Besides that it looks good.,Hutch,shaun0728
AsQsX1uYFV8,Hutch is the next Denzel confirmed,Hutch,shaun0728
AsQsX1uYFV8,Intro was So corny it was amazing!,Hutch,shaun0728
AsQsX1uYFV8,That intro was just right Hutch!,Hutch,shaun0728
q7o7mcLMzfc,You ever think of trying fantasy football?,Hutch,shaun0728
q7o7mcLMzfc,someone is afraid and affected personally  idrk just saying,Hutch,shaun0728
q7o7mcLMzfc,Enjoyed the rant hutch,Hutch,shaun0728
q7o7mcLMzfc,Just get to the point  bash Trump already  we get it. All this underlying bullshit just to try and jam your views into it to get people to vote differently in your favor and opinion. Trump won  its almost 2018  get the fuck over it  man up. Quit crying like a bitch. This undying support you have for a criminal (Hillary) is absolutely fucking disgusting behavior from a grown ass man. I mean you literally cried in that one video cause she didnt win. How anyone takes you seriously after that is astonishing. You must have some kind of psychological ability to manipulate people to think the way you do  cause I have no clue as to why you continue to try to jam your opinions down your subscribers throats even though its met with backlash almost every fucking time. Just shut the fuck up and play the game  we didnt subscribe to hear you bitch and moan about how UNCHANGED your life is because the person you wanted to win didnt win.,Hutch,shaun0728
q7o7mcLMzfc,What headset is Hutch wearing?,Hutch,shaun0728
q7o7mcLMzfc,Hey Hutch did you know you can put Wax  the thc concentrate  on the coils of your vape?! i just tested it for you,Hutch,shaun0728
q7o7mcLMzfc,Wth hutch leave politics out of video games  your opinion is exactly that  and all your doing is what teachers do which is spread their political agenda because their in a influential position with a large audience. I could easily preach on how democrats have upheld any progress in passing laws when they had the majority in congress and how they've now changed there position on passing anything that trump wants passed. My political opinion is the polar opposite of yours  it's not any more valid than yours because it is only that... an opinion. So play video games and stop preaching your issue with the division in this country when your causing more of it.,Hutch,shaun0728
q7o7mcLMzfc,commie faggot,Hutch,shaun0728
q7o7mcLMzfc,In other words  net neutrality is gone. So all YouTubers are gone and those who rely on gaming or some sort of web income.,Hutch,shaun0728
q7o7mcLMzfc,Yo hutch on one of your last streams you were talking about how trump wouldnt condemn the white nationalists and ive been thinking about it. In alot of peoples minds he didnt condemn them by saying there was violence on both sides. The antifa are a part of the extreme left that focus on violence against people with different opinions or "punching nazis"  the only difference between either sides is the politics they are fighting over  and they have violence in common. "There was violence on both sides" is a statement that condemns both sides  but it pissed off people who are on antifas side because he didnt condemn the nazis more than he did antifa. Does it really matter which opinion youre attacking people over? If antifa killed millions to make a progressive utopia or if hitler did it for race purity the reason for either doesnt matter its your actions that matter. Infact hitler thought he was doing good just like antifa does.   Just food for thought love ya man hit me back up,Hutch,shaun0728
q7o7mcLMzfc,This game sucks.,Hutch,shaun0728
q7o7mcLMzfc,Its a two year seat which was won in a narrow margin to a alleged attempted child molester. Alabama is not going to turn blue.   Also  there are multiple news interviews with Doug Jones supporters where they are discussing frankly how they voted multiple times  or cast votes even though they reside out of state.  Say what you want but the only people organizing out of state field trips to place illegal votes are Democrats. The desperation is honestly pathetic.,Hutch,shaun0728
q7o7mcLMzfc,Hutch  I love your content and truly enjoy watching your gameplays  but I hate having to skip through half your video because you talk over it about something else. As a consumer  I purely watch your content for the content  nothing else. You're a great guy and if you do a vlog video I'll usually peruse it  but when it's a gameplay video about Fortnite or OMOO I want to watch you play the game and your in-game reaction. I'm sure you don't care   but I wanted you to know that it's how I feel and you deserve proper feedback and constructive criticism. I love you :),Hutch,shaun0728
q7o7mcLMzfc,Ben Shapiro 2020,Hutch,shaun0728
q7o7mcLMzfc,I think that people don't realize that this isn't as much a political talk as it is a life talk.  All people who are here to "not listen to politics and watch gaming videos" are in denial of what they need to hear.  Even if you disagree with hutch  it is important to be informed of multiple sides of topics.  Keep up the great content @Hutch !!,Hutch,shaun0728
q7o7mcLMzfc,More of this man ..,Hutch,shaun0728
q7o7mcLMzfc,maybe its just because trumps viewpoints are so far out of wack and to the right... but i find it difficult to respect someone who supports this particular republican president,Hutch,shaun0728
q7o7mcLMzfc,HUTCH is just too much. so pro.,Hutch,shaun0728
q7o7mcLMzfc,Ask if you can be a guest on PKA,Hutch,shaun0728
q7o7mcLMzfc,I just wish America didnt make it so complicated so it was easier for the rest of the world ( or at least me ) to understand whats going on over there.,Hutch,shaun0728
q7o7mcLMzfc,I fucks w the rant,Hutch,shaun0728
q7o7mcLMzfc,Thanks for the knowledge bro,Hutch,shaun0728
q7o7mcLMzfc,Jesus please put a politics warning or something so I don't have to watch these.,Hutch,shaun0728
q7o7mcLMzfc,8 years dem  8 years repub. trust the process,Hutch,shaun0728
q7o7mcLMzfc,I encourage rants from time to time. I just like it when creators are themselves and do what they want. Always the best content when the creators themselves enjoy it.,Hutch,shaun0728
q7o7mcLMzfc,I really liked the talk at the first half of this video. It made me realize that I have been standing at the top of a slippery slope of ultimately demonizing the people on the opposite wing  and that's the last thing the world needs right now. We're all human  and we need to unite to do something about this mess.,Hutch,shaun0728
q7o7mcLMzfc,Such a great message  man. My best friend and I have entirely different political opinions on almost everything.. Lots of respect  Hutch.,Hutch,shaun0728
q7o7mcLMzfc,Democrats won in Alabama because they launched a full media smear campaign against Roy Moore. All you have to do right now is accuse somebody of sexual assault and your reputation is smeared for good. Democrats realize they aren't going to win any seats based on their message  because they don't have one other than "STOP TRUMP". Ted Cruz is the next republican up for re-election soon in Texas  mark my words the media will all the sudden start accusing him of being a sexual predator next. It's probably the nastiest time in politics right now.,Hutch,shaun0728
q7o7mcLMzfc,Great video  man. You and H2O Delirious should collab on fortnite. He's in love with it as much as you are  and you'd be a power team like none other.,Hutch,shaun0728
q7o7mcLMzfc,Someone once told me if you are in your 20's and not liberal you don't have a heart. and if you are in your late 30's and aren't conservative you don't have a brain. GL,Hutch,shaun0728
q7o7mcLMzfc,entirely off topic to this vid  but I used to watch hutch like 8 fucken years ago when he used to play MW2 and shit  during the "Hutchisyodaddy" and machinima days. Didn't even know he was still making vids till youtube recommended me. I'm impressed you're still kicking along bro  much love from an old fan.,Hutch,shaun0728
q7o7mcLMzfc,Not sure how you can say it's the most interesting political climate right after you admit that you've never paid attention to politics before. I do agree that most countries work like pendulums though  and that's why I expect a couple more Republican presidential terms before the Democrats are able to elect a leader. I think you're greatly mistaken as to why the Democrats have lost their foothold in the houses; it has more to do with their social agenda (what they consider political correctness) than their fiscal policy.,Hutch,shaun0728
q7o7mcLMzfc,What it really boils down to is that you can use your platform to spread your thoughts and people can agree or disagree with that approach. Personally I do not mind. I don't just watch your channel for gameplay. Your thoughts are part of it too.,Hutch,shaun0728
q7o7mcLMzfc,Just spent 10 minutes bragging to my girlfriend about my favorite YouTuber since I was a teenager. We do have different political views  but that doesn't stop me at all from enjoying every video  Hutch. Thanks for the Content :),Hutch,shaun0728
q7o7mcLMzfc,We love the rants,Hutch,shaun0728
q7o7mcLMzfc,Something like a politics podcast or separate videos for politics talk would be a good idea. I know a lot of people enjoy your discussions about politics  myself included most of the times  even though since I live in Austria and we are currently dealing with a vastly excessive right wing shift  I honestly don't really care about a rant about U.S. politics on your channel... There seems to be a big part of your community who comes to relax and free their heads from worries and its not so great to see a video with the title "WHAT A TIME TO BE ALIVE" and instantly hear a political rant. Maybe you could take it into consideration in the future...,Hutch,shaun0728
q7o7mcLMzfc,Alabama elected a demand because the alternative was an accused child rapist.  Democrats will pick up some seats  but the Republicans won't lose their majority because they don't have enough vulnerable seats for that.  Interesting times for sure though.,Hutch,shaun0728
q7o7mcLMzfc,Love fortnite  it would be sweet if they announced a new map,Hutch,shaun0728
q7o7mcLMzfc,I'm so glad I didn't get into football in particular as a kid. The amount of brain damage they sustain is incredibly massive,Hutch,shaun0728
q7o7mcLMzfc,Tip: Get your pickaxe out when picking up bandages and you won't go over 15 and trade your weapon.,Hutch,shaun0728
q7o7mcLMzfc,Shut the FUCK up Tai "the bookcase lover" Lopez,Hutch,shaun0728
q7o7mcLMzfc,usually I hate when you talk about politics  mainly because our views are different. I understand that people have different views and can express that  thats what makes america awesome  but that doesn't mean I want to watch a youtube video where those opposing views are the topic. this was a very nonpartial video and was very interesting. enjoyed it.,Hutch,shaun0728
q7o7mcLMzfc,I'm still salty that you blocked me on twitter a year ago because I said something about Hillary on your tweet. Please unblock me lol...,Hutch,shaun0728
q7o7mcLMzfc,Hutch i'd love to know your opinion on the gun laws in the US atm  as in my opinion i think some restrictions should be applied to obtaining a gun and ammunition due to the shootings which have happened. Also much love from the UK bro  keep doing what your doing.,Hutch,shaun0728
q7o7mcLMzfc,tbh i think one of the most unhealthy and damaging aspects of politics is the idea its like a spectator sport or something to be interested in. it leads to things like the understanding people dislike the Republicans simply because they're the other team or whatever. its an incredibly damaging narative which i think turns most people off engaging in politics as it completely ignores how people's lives are materially bettered or worsened depending on whos in power. its not a game. its not interesting. politics is a life or death. literally. If journalists spent time actually presenting politics about how certain policies will kill people or materially be worse off/in poverty - i.e. genuinely representing  peoples' interests - more people would be engaged. Making it into a race or a game is a massive diservice to the people who suffer as a result of politics and further disengages people from something already pretty monotinous and anal.,Hutch,shaun0728
q7o7mcLMzfc,Just to touch on your sports piece at the beginning hutch... have a look at a video titled "ultras our way of life" .. its based on european ultras (hard core supporters/fanatics) supporting their team in football mainly (soccer to you) ..but also basketball handball or any other sport...be interesting to hear you opinions on this.. ultras are super fanatical and sometimes even die at the hands of other ultras or police supporting their teams.,Hutch,shaun0728
q7o7mcLMzfc,Money  money is the reason why there's drama in sports,Hutch,shaun0728
q7o7mcLMzfc,PLAY CHESS AGAIN,Hutch,shaun0728
q7o7mcLMzfc,love and appreciate stuff like this brother. keep it up.,Hutch,shaun0728
q7o7mcLMzfc,I love the political discussions. There should be no place where people can hide from it. And you're right it is the most interesting it's been in a while. With that said  what are your thoughts on 3rd parties and independents?,Hutch,shaun0728
q7o7mcLMzfc,Why does Hutch consistently either forget about  or omit  the New Jersey gubernatorial election this year?  It was the same day as the Virginia election  and just as big as Virginia's in my opinion.  Defeating Guadagno was akin to saying no to Trump and Chris Christie both  and a huge push towards the left for the state of New Jersey.,Hutch,shaun0728
q7o7mcLMzfc,Hutch I have to agree. Which is funny considering I'm Canadian. America is like a giant fishbowl right now. Some strange stuff going on down there.,Hutch,shaun0728
q7o7mcLMzfc,Seems a little hyperbolic to say this is the most interesting time in U.S. History. I would say the Civil War or Revolutionary War times were undoubtedly the most important times we will ever have as a nation. I agree that the political climate today is a strange one but do not oversell the need to talk about politics. In some families  it is very difficult to bring that discussion up. Many people are very sensitive towards these topics and it is more important to feel the love of your family that to cause an argument  especially during the holidays.,Hutch,shaun0728
q7o7mcLMzfc,Sean Idk if you really understand the full picture of what's going on. Democrats are not going to "sweep" elections.,Hutch,shaun0728
q7o7mcLMzfc,I personally don't like the politics talk. I don't come to watch video games to hear about politics. I watch things like this to escape reality hutchy,Hutch,shaun0728
q7o7mcLMzfc,Love it when you rant,Hutch,shaun0728
q7o7mcLMzfc,I kinda agree  but I always ask myself a question - what is the point of knowing something  if you're not planning to use that knowledge? If it's just interesting to you - no problem. But like the sports example  if it's not interesting to me and I don't plan to have a career in sports - whats the point of spending time on it?,Hutch,shaun0728
q7o7mcLMzfc,A fumbled match can still light a fire.  Democrats winning in Alabama I think is less a symptom of people fed up with Republican legislature and more that he was a pedophile. It still may have a cascading effect though.,Hutch,shaun0728
q7o7mcLMzfc,I usually only say this when hutch brings up politics. If you are dissatisfied with the current political climate  regardless of which way it leans  get involved in your local politics  state  county  city level. They impact you far more on a day to day basis  and you actually do have a voice on this small a scale,Hutch,shaun0728
q7o7mcLMzfc,Hutch is bae,Hutch,shaun0728
q7o7mcLMzfc,listen to Chapo Trap House,Hutch,shaun0728
q7o7mcLMzfc,Competitive sports are a very important part of society  especially to children and teenagers. Teaching kids how to win or except loss is crucial in their development.,Hutch,shaun0728
q7o7mcLMzfc,Hutch i dont know if you listen to podcast but if you do you should check out "More Perfect" its about famous supreme court cases and the stories behind them  its made by the people that make RadioLab,Hutch,shaun0728
q7o7mcLMzfc,Plz stop ranting,Hutch,shaun0728
q7o7mcLMzfc,I WILL GO TO VALHALLA SHINEY AND CHROME!!!,Hutch,shaun0728
q7o7mcLMzfc,really liked the sports and politics connection,Hutch,shaun0728
