videoId,comment,channelId,channelName
4S8w134FTSg,this is the worst ive ever seen the servers for a COD game itself is great though,Hutch,shaun0728
4S8w134FTSg,only complaint I have is having to run prime on everything when there's so many other options. Unpredictable flinch is killing consistency in this game.,Hutch,shaun0728
4S8w134FTSg,Black ops 3 is better than this,Hutch,shaun0728
4S8w134FTSg,Great game,Hutch,shaun0728
4S8w134FTSg,Ww2 is a poor call of duty maps are terrible people just camp or head glitch  servers are bad  something is wrong with aim assist or hit detection and the weapons are boring already,Hutch,shaun0728
4S8w134FTSg,My biggest gripe is the maps. They just don't flow very well. Gun balance is decent  considering what it usually is. Yes  shotguns and some semi-autos are useless but they can be used.  Overall  it seems like it will be a good year and a bounce back performance of Call of Duty.,Hutch,shaun0728
vS8W5ip_xAY,Love these personal minutes u do before a vid starts! Keep em coming :) *kicks feet up*,Hutch,shaun0728
vS8W5ip_xAY,People think streaming is the dream but a lot of streamers get don't take care of themselves and get depressed and suffer. Even things like just the streaming itself can have downsides.,Hutch,shaun0728
vS8W5ip_xAY,Let me preface my comment by saying I've been subbed for a couple of years  and always enjoyed your content  including Fortnite. But for this video  what the fuck is this man? I see a 15 minute video where you don't get a kill for 4 and a half minutes. I think not editing that was pretty lazy by your part. Maybe your audience really wants to have these 4 minutes of basically nothing happening  and if this is the case  forget about my comment. Personally I don't like skimming through a 15 minute vid to find the "fun" parts. And it's not like there was banter with your friends or you were saying something relatively important. Just my opinion  I'll still be happy to see one of your videos in my sub box in the future.,Hutch,shaun0728
vS8W5ip_xAY,Hutch I've watched you since day!  When game battles cod4 was your scene. My favorite streamer!,Hutch,shaun0728
vS8W5ip_xAY,I really like these commentary + stream style videos that have become a consistent thing for you. Glad you had some time off  keep up the great work!,Hutch,shaun0728
vS8W5ip_xAY,Great game Hutch!!,Hutch,shaun0728
vS8W5ip_xAY,Self care yooo  keep the depressions at bay.,Hutch,shaun0728
vS8W5ip_xAY,why would people give you shit for taking a break?  It's okay man   take a break.  people want to watch healthy Hutch.  Not this zombie who's been playing day after day.,Hutch,shaun0728
vS8W5ip_xAY,Yea Hutch  having fun outside of youtube and streaming is just not allowed. As a matter of fact  I think all of us would appreciate if you broke up with Esme. She's too much of a distraction. I hope you understand ;),Hutch,shaun0728
vS8W5ip_xAY,TRADE THE FUCKING GREEN PUMP! C'mon Hutch you do this way too many times...,Hutch,shaun0728
vS8W5ip_xAY,god damn it you're good. I used ot be god in games always  but now at 27 I cannot be good at video games. My reaction time is really bad  aim terrible  and even creativity is gone. I envy you dude. It's been 9 years since  I watched you i think. God even if I dig up my old videos i was sick back then  and now I feel so bad everytime I play games. It seems liek you havn't lost any bit of skill,Hutch,shaun0728
vS8W5ip_xAY,Hutch is a multi-millionaire he owes everyone nothing.,Hutch,shaun0728
vS8W5ip_xAY,If you're happy we're happy!,Hutch,shaun0728
vS8W5ip_xAY,i really hate the endgame in solos... I try to play it like my mans here but I'm not good enough to pull it off,Hutch,shaun0728
vS8W5ip_xAY,You killed me in anarchy when I landed with a pistol and you had that purple scar :'(,Hutch,shaun0728
vS8W5ip_xAY,Man  I will be so fucking happy when he is bored of this game. I am so fucking tired of this Battle Royale game craze  especially this one  because it looks like it was made to cash in on the Minecraft age appropriate 13-15 demographic. Give me something MILDLY fucking competitive  not this sandbox bullshit where you get hyped over killing a few tweens.,Hutch,shaun0728
vS8W5ip_xAY,You should check out 22 Kings cover of Freedom hutch,Hutch,shaun0728
vS8W5ip_xAY,Hutch  I've been following for almost 7 years now. I was finally able to subscribe to your Twitch yesterday morning when you were "intoxicated" XD  you accidentally shouted out my name (McFootLong) to whom you were playing with and then called me a "Good Man" so i couldn't of asked for a better recognition from you ahah.   Anyway i just wanted to let you know that you're a fucking legend and you make great content. Glad you found passion in Fortnite  because Hutch isn't Hutch without passion. Wish you and Esme well brother.,Hutch,shaun0728
vS8W5ip_xAY,Ayy what was the name of the song at the end?,Hutch,shaun0728
vS8W5ip_xAY,Adopt me hutch.  Please like so he sees,Hutch,shaun0728
vS8W5ip_xAY,I need time to do leisurely things......getting drunk and playing videos games (for money) every night is really taxing on ones soul.  While I sit at my 9-5 with constant deadlines that I have no choice but to meet.  Before anyone comments "life is what you make it  you could be a streamer too"....save your words....life is about risk and luck.  I am not ABLE to risk the life I have built for myself  I have a family to support.  Maybe if I was waiting tables like Hutch was then I would be willing to take more risk. I just get salty when I hear people who literally live on their own schedule talking about the importance of relaxing and spending time away from work.  Yes streaming is a form of work in the sense that you can provide for yourself but it is not a JOB and it is only as stressful as you make it.  Be thankful for your lucky circumstances.  As Barack Obama put it on the new Letterman show  there are plenty of talented people in this world  your fortunate situation is because of luck not talent.,Hutch,shaun0728
vS8W5ip_xAY,I wish you did more GB's with OMOO,Hutch,shaun0728
vS8W5ip_xAY,I store snacks in my 4skn,Hutch,shaun0728
vS8W5ip_xAY,Just started playing this game myself and its made me realise just how good you are,Hutch,shaun0728
vS8W5ip_xAY,voice of an angel,Hutch,shaun0728
vS8W5ip_xAY,Wait i thought you were severely  balding??? What happened,Hutch,shaun0728
vS8W5ip_xAY,GG,Hutch,shaun0728
vS8W5ip_xAY,Beastly,Hutch,shaun0728
vS8W5ip_xAY,Wish I had the money to follow you kn twitch Hutch but I've been here for almost 7 years now met you while working the cod xp paintball scrapyard. And I still till this Day enjoy your content,Hutch,shaun0728
vS8W5ip_xAY,Good rant - work/life balance is super important,Hutch,shaun0728
vS8W5ip_xAY,Amazing vocals,Hutch,shaun0728
vS8W5ip_xAY,Loved that song in Django Unchained,Hutch,shaun0728
vS8W5ip_xAY,I was waiting for Hutch to tell me to grab a beer but he didn't tell me to so now I'm just sitting here sober,Hutch,shaun0728
vS8W5ip_xAY,Thanks for all you do man!  It's unfair for anyone who spends time relaxing watching your videos to expect you to not also be able to kick your feet up and grab a beer.,Hutch,shaun0728
vS8W5ip_xAY,I was really into WW2 stuff and was hoping for old men of optic  did you give up on the idea of playing WW2? To be honest if Fornight makes you happier i'm all for you don't forcing yourself just curious.,Hutch,shaun0728
vS8W5ip_xAY,Looking for freedom~,Hutch,shaun0728
vS8W5ip_xAY,It's your channel hutch. If you want to take a break from content to have time for yourself  you go ahead and take a break and have time for yourself. Stay healthy man. Love the vid :),Hutch,shaun0728
vS8W5ip_xAY,Take care of yourself hutch. Been here since MW2 man  always love ya,Hutch,shaun0728
vS8W5ip_xAY,Can't wait for you to hit a mill man,Hutch,shaun0728
vS8W5ip_xAY,You build too much and put yourself in dumb situations. The first base you built was really dumb  super easy to shoot a rocket or nade in and you're dead,Hutch,shaun0728
vS8W5ip_xAY,Some Youtuber's post monthly some weekly so when the daily ones stop for awhile or post irregularly I ain't complaining about free content,Hutch,shaun0728
vS8W5ip_xAY,You're only human Hutch  we've come to expect some private R & R sessions once in awhile.    Hell  it gives us gameplays like these.,Hutch,shaun0728
vS8W5ip_xAY,Who are you and what do you do?,Hutch,shaun0728
vS8W5ip_xAY,Work when you want take a break when you want most of us know when something needs a break : )  Love you,Hutch,shaun0728
vS8W5ip_xAY,Jamaican black castor oil for hair hutch  might help.,Hutch,shaun0728
vS8W5ip_xAY,Thank you Hutch for considering the name change for the title of the video before this. Wish you the best in everything!!,Hutch,shaun0728
vS8W5ip_xAY,most entertaining man i know!,Hutch,shaun0728
vS8W5ip_xAY,Just because I think about you when I jack off doesn't mean I'm your "friendo"  Hutch.,Hutch,shaun0728
vS8W5ip_xAY,getting sick of this game,Hutch,shaun0728
vS8W5ip_xAY,LOL talking about leisure and taking time off work  my dude you play video games for a living so don't try to act like what you do is work.,Hutch,shaun0728
vS8W5ip_xAY,Gg,Hutch,shaun0728
vS8W5ip_xAY,Always important to have time for family and friends  and I think we all can understand that! Been trying to watch your stream as much as I can manage during the week. I appreciate and enjoy the content!,Hutch,shaun0728
vS8W5ip_xAY,Why is this game ao addictive?,Hutch,shaun0728
vS8W5ip_xAY,The song much like Hutch is quite dope actually,Hutch,shaun0728
vS8W5ip_xAY,Keep it up man,Hutch,shaun0728
vS8W5ip_xAY,Gotta have hutch time urself,Hutch,shaun0728
vS8W5ip_xAY,I appreciate you  Hutch!  Time to kick back and enjoy the show.,Hutch,shaun0728
vS8W5ip_xAY,Nice,Hutch,shaun0728
vS8W5ip_xAY,Wait  I'll get a beer and kick my feet up!,Hutch,shaun0728
Fd3tAmwNvgc,I come for the Hutch talks in the beginning of the videos  so edit em however ya want.,Hutch,shaun0728
Fd3tAmwNvgc,Full Gameplay would be hella appreciated,Hutch,shaun0728
Fd3tAmwNvgc,Full gameplay please,Hutch,shaun0728
Fd3tAmwNvgc,edited  25min+ videos are way to time consuming,Hutch,shaun0728
Fd3tAmwNvgc,I dont mind full games. I would prefer both.,Hutch,shaun0728
Fd3tAmwNvgc,If the entire game is interesting then post the entire game  if only parts are interesting then edit it down. I think some should be edited and some should not.,Hutch,shaun0728
Fd3tAmwNvgc,I like to see full videos Hutch. A once a week highlight video of all the best clips and parts would be a great addition to the full matches.,Hutch,shaun0728
Fd3tAmwNvgc,I'm game for a full video but I'm also okay with a 10min video. Anything is fine really.,Hutch,shaun0728
Fd3tAmwNvgc,10 minute videos are better  if you have the time to watch a full match  watch a past broadcast on twitch.,Hutch,shaun0728
Fd3tAmwNvgc,Maybe what you could consider doing is posting a full video  for those of us who want it  and then put a comment with the times where you would have edited it to for those who want to skip past the 'uneventful' moments. Not perfect but is a compromise.,Hutch,shaun0728
Fd3tAmwNvgc,The more hutch the better. Full vids  short vids  all good,Hutch,shaun0728
Fd3tAmwNvgc,If you can swing a mix of both I'd do that  seems like what the people want  cousin.,Hutch,shaun0728
Fd3tAmwNvgc,I like the full videos. I only watch when I have time to kill and I want to get the full story when I have said time to kill. Give me all 20 minutes!,Hutch,shaun0728
Fd3tAmwNvgc,Full length please,Hutch,shaun0728
Fd3tAmwNvgc,seeing the full footage would be mint but do what you feel is the right dude if that means shortening the vids then fairo,Hutch,shaun0728
Fd3tAmwNvgc,I like raw footage/gameplay upload it all!! We can always fast forward/rewind,Hutch,shaun0728
Fd3tAmwNvgc,Full gameplay would be awesome! We love the banter!,Hutch,shaun0728
Fd3tAmwNvgc,I think for squads/duos you should post the entire match  because of the coms and stuff. That being said for solos the cut down version works better,Hutch,shaun0728
Fd3tAmwNvgc,I prefer full-length gameplays.,Hutch,shaun0728
Fd3tAmwNvgc,Post the whole video  because you already make highlights videos of your games. I also enjoy watching full games  no matter their length.,Hutch,shaun0728
Fd3tAmwNvgc,I like this shorter length video but I would also like a longer video with a longer voiceover intro during the slower parts,Hutch,shaun0728
Fd3tAmwNvgc,I like to see the Full video Take the stress off the day,Hutch,shaun0728
Fd3tAmwNvgc,I like these short videos but I wouldnt mind the odd long one (20 min) once a week.,Hutch,shaun0728
Fd3tAmwNvgc,I'd prefer the full video  as I cant watch them streams with my odd hour job  and I'd love to listen to more of your commentary,Hutch,shaun0728
Fd3tAmwNvgc,naaa keep it as 10 minutes otherwise the video is too long. if there is any funny banter keep it in but otherwise I have little desire to watch a 25 minute video of people running around,Hutch,shaun0728
Fd3tAmwNvgc,I'm a huge fan of the stream highlights honestly. They're hilarious and contain some high quality laughs and game play,Hutch,shaun0728
Fd3tAmwNvgc,I enjoy seeing the whole gameplay mostly because it helps me learn what to focus on early game to set myself up for success. Plus it means more time listening to you and your friends chit chat  goof off  etc.,Hutch,shaun0728
Fd3tAmwNvgc,i had a game end in tilted towers. there was 8 people left in the last circle before it closes all the way in,Hutch,shaun0728
Fd3tAmwNvgc,Full gameplay definetely  just put a timestamp where you would have cut it  saves you work and makes everybody happy.,Hutch,shaun0728
Fd3tAmwNvgc,Full length video,Hutch,shaun0728
Fd3tAmwNvgc,ANSWER TO HUTCH'S QUESTION:  I'd prefer the whole gameplay  but either way could you PLEASE set up a playlist for your Fortnite videos (and update it moving forward)?,Hutch,shaun0728
Fd3tAmwNvgc,I like the full game play personally,Hutch,shaun0728
Fd3tAmwNvgc,lol diesel is being such a dork,Hutch,shaun0728
Fd3tAmwNvgc,Full vids please.,Hutch,shaun0728
Fd3tAmwNvgc,Nice video  not gunna lie cant watch your live streams anymore the political banter is just too over whelming most of the time. Still appreciate the content though dude.,Hutch,shaun0728
Fd3tAmwNvgc,It really depends on how exciting a full gameplay video is  Hutch. If you have commentary that fills the void of 4 or 5 minute runs  then post a full video. Otherwise if the void is a void then editing may be the way to go. I will watch you whether you post a 7 minutes video  or a 1 and a half hour marathon. If you  yourself are being you  then I will be here every time. And if I'm being honest  you do what you are comfortable doing  you beautiful son of a bitch.,Hutch,shaun0728
Fd3tAmwNvgc,Has he said why he's stopped playing cod? I don't mind fortnite but it'd be nice to have a mix.,Hutch,shaun0728
Fd3tAmwNvgc,Full vid please.  Also  please unban from twitch chat.  Was banned for GoT spoilers that weren't actually spoilers earlier this year when I referenced things from season 5 and 6.  Thx,Hutch,shaun0728
Fd3tAmwNvgc,I would like full gameplays  and also the highlights are great. So if you just upload a video such as this as the full gameplay 10/10 would watch.,Hutch,shaun0728
Fd3tAmwNvgc,I wouldn't mind the full games. I really like this game and want to get better.,Hutch,shaun0728
Fd3tAmwNvgc,I enjoy the cut down videos. Anyone who wants to watch the whole match can just watch it on twitch. Maybe link the VOD in the description for those interested.,Hutch,shaun0728
Fd3tAmwNvgc,I don't mind the full video so long as they're not 40 minute matches. But 15-20-25 is fine. :),Hutch,shaun0728
Fd3tAmwNvgc,I rather the more action,Hutch,shaun0728
Fd3tAmwNvgc,Yeah. Post the full games man and keep those jeans high and tight,Hutch,shaun0728
Fd3tAmwNvgc,full length videos! Also I'm a huge fan of the fact that you don't spoil whether you win the game. Keeps the anticipation tight. I wish other youtubers would do the same,Hutch,shaun0728
Fd3tAmwNvgc,full gameplays we want more hutch!!!!!,Hutch,shaun0728
Fd3tAmwNvgc,I would like to see some videos with full gameplay and some without.,Hutch,shaun0728
Fd3tAmwNvgc,i think its great that they offer very different environments  to allow for preferences in landing etc. each city shouldnt feel the same also i personally prefer shorter videos but i dont mind skipping the longer ones so everybody gets their favorite.,Hutch,shaun0728
Fd3tAmwNvgc,10 mins is good,Hutch,shaun0728
Fd3tAmwNvgc,i honestly started watching again because it wasn't the whole game. shit gets boring,Hutch,shaun0728
Fd3tAmwNvgc,shave it down to 10 minutes,Hutch,shaun0728
Fd3tAmwNvgc,I like both full gameplay and highlights  so either is fine by meeee.,Hutch,shaun0728
Fd3tAmwNvgc,Mixture of trimmed and full length. Definitely want to see what you guys go from start to finish.,Hutch,shaun0728
Fd3tAmwNvgc,Full videos. Also try to upload with better quality.,Hutch,shaun0728
Fd3tAmwNvgc,Can agree tilted towers is full of bullshit. Good place to be a little shit with traps tho,Hutch,shaun0728
Fd3tAmwNvgc,The longer the better! ;),Hutch,shaun0728
Fd3tAmwNvgc,I think both would be cool  I like to watch more action but since you got me interested in this game I started playing it and I would like to just watch the whole process of a game so I can learn something :p,Hutch,shaun0728
Fd3tAmwNvgc,That is notepad worth! :D,Hutch,shaun0728
Fd3tAmwNvgc,I think both but I would love some full lenght,Hutch,shaun0728
Fd3tAmwNvgc,My only suggestion is trying to keep uploads from streams that happened relatively recently. I know that might mean a little more work but it's sort of odd watching/playing the new updated map and then coming on here and you're still in the old map. It's not a big issue but it gives the impression of being behind the curve. And again that in of itself doesn't mean anything  just an observation.,Hutch,shaun0728
Fd3tAmwNvgc,I just want something other than fortnite,Hutch,shaun0728
Fd3tAmwNvgc,Definitely prefer the edited down but might like a longer every now and then  but I prefer ~10 min videos.,Hutch,shaun0728
Fd3tAmwNvgc,Can someone explain rotation to me? I always just say hey guys let's go to retail row. Or whatever. Are you saying there's an actual system with right and wrong places to go?,Hutch,shaun0728
Fd3tAmwNvgc,Full videos are what I enjoy the most  get to see how it all plays out for you,Hutch,shaun0728
Fd3tAmwNvgc,That was amazeballs,Hutch,shaun0728
Fd3tAmwNvgc,I prefer the 10 mins videos with highlights  be it gunfights or some funny moments with your friends. Easier to watch really. If you want to make more instructive videos on how you play thats ok too. Do what you feel like man :),Hutch,shaun0728
Fd3tAmwNvgc,I like watching entire unedited videos  but if there are periods of downtime  maybe include a timestamp or two in the description to points in the video after bits of downtime  specifically for those people who prefer the shorter version.,Hutch,shaun0728
Fd3tAmwNvgc,I prefer the 10min videos personally,Hutch,shaun0728
Fd3tAmwNvgc,Every fortnight (pun intended) upload a full length video Hutch!,Hutch,shaun0728
Fd3tAmwNvgc,id love to see the full gameplay because of the reason you said.  Keep on pumping out great stuff!,Hutch,shaun0728
Fd3tAmwNvgc,IDK if this helps much but I like both types of videos and prefer when you switch it back and forth from highlights to full gameplay! Thanks for the videos hutch  youre awesome,Hutch,shaun0728
Fd3tAmwNvgc,Yes longer please daddy.,Hutch,shaun0728
Fd3tAmwNvgc,Even though I watched this on stream  watching here because I support you that much bro.,Hutch,shaun0728
Fd3tAmwNvgc,lets see full,Hutch,shaun0728
Fd3tAmwNvgc,Hecz and J sound really different in this video,Hutch,shaun0728
Fd3tAmwNvgc,The full length gameplay you did with Sark is the best entertainment of this game I've seen. More of that please.,Hutch,shaun0728
Fd3tAmwNvgc,I think both types of gameplay would be great. I'd like to see longer ones to see your squads strategies  but shorter ones tend to be more entertaining and action packed.,Hutch,shaun0728
Fd3tAmwNvgc,Yep  post full game!,Hutch,shaun0728
Fd3tAmwNvgc,full gameplays!!,Hutch,shaun0728
Fd3tAmwNvgc,I think both have there benefits  10min edits show the hype and most action packed moments while full game can show flow  map movement and more decisions being made that can help viewers improve. Do you think you could do some commentary in one of your upcoming videos on what types of decisions you make at the start of a game? I usually have no idea what kinda moves to make based on where the bus enters each game  when or where to drop and how to make the most out of the first few mins of each game,Hutch,shaun0728
Fd3tAmwNvgc,I would rather you only be uploading your very good games and can decide whether to show the full length or not based on how entertaining it is. A little bit after you started uploading games on here you were only uploading crazy gameplay where you shit on people and now I feel like the quality has trailed off quite a bit and you upload any wins..,Hutch,shaun0728
Fd3tAmwNvgc,Full gameplays!,Hutch,shaun0728
Fd3tAmwNvgc,Diesel is a piece of shit.,Hutch,shaun0728
Fd3tAmwNvgc,Same i dont really like tilted towers... doesnt fell like the kind of gameplay that fits fortnite style :) But the rest of the update is awsome,Hutch,shaun0728
Fd3tAmwNvgc,I like the videos the way they are for the most part  but I'd watch some full length vids too.,Hutch,shaun0728
Fd3tAmwNvgc,Nooo why are we down to 926k subs? The 927 curse must live on!,Hutch,shaun0728
Fd3tAmwNvgc,I think the full gameplays are so much fun to watch for precisely the reasons you outlined. Watching how you guys decide where to go and what do to makes it fun. Especially when you play with such funny people,Hutch,shaun0728
Fd3tAmwNvgc,full games!,Hutch,shaun0728
Fd3tAmwNvgc,Full length matches fa sho,Hutch,shaun0728
X8vp1pol_Gw,what is with these 2 minute long unskipable ads- this is bullplop,Hutch,shaun0728
X8vp1pol_Gw,If people think the double pump takes skill to use and isn't overpowered  you're either 12 years old or younger or partially retarded,Hutch,shaun0728
X8vp1pol_Gw,DP?,Hutch,shaun0728
X8vp1pol_Gw,Thought you were going to stop double pumping?!?!?!?!?!?,Hutch,shaun0728
X8vp1pol_Gw,You must be a nightmare to play with. No communication at all still love the video  but seriously poor hecz.,Hutch,shaun0728
X8vp1pol_Gw,Hutch  do not keep your beer on the floor. Even if its a disgusting ipa.,Hutch,shaun0728
X8vp1pol_Gw,Throwing it out there... But I'd love to watch Hutch play Sea of Thieves with Sark and Seananners  perfect game for their chemistry,Hutch,shaun0728
X8vp1pol_Gw,Its good to see you and hector getting along so well  great video!,Hutch,shaun0728
X8vp1pol_Gw,You have YouTube's too long to not a have a million,Hutch,shaun0728
X8vp1pol_Gw,that double pump is fuckin' dirty,Hutch,shaun0728
X8vp1pol_Gw,Whos the chick? She sounds hot,Hutch,shaun0728
X8vp1pol_Gw,EMBRACE THE PUMP!!!!!,Hutch,shaun0728
X8vp1pol_Gw,even when the damn drop is in his way he refuses to open it  why? ( 2:20 ),Hutch,shaun0728
X8vp1pol_Gw,it's your fault Club Penguin no longer exists  fuck you Hutch,Hutch,shaun0728
X8vp1pol_Gw,0:06 nice pun,Hutch,shaun0728
X8vp1pol_Gw,Lol @ Hector saying Hutch's shots were too loud to hear anything else when Hutch wasn't even shooting,Hutch,shaun0728
X8vp1pol_Gw,I always have room in my inventory for rockets and/or grenade launchers for any game type.,Hutch,shaun0728
X8vp1pol_Gw,Double pump faggggiiit,Hutch,shaun0728
X8vp1pol_Gw,hutch i swear you were at 970k subs like a week ago and now youre at 926k? did youtube remove a bunch of subs again or something?,Hutch,shaun0728
X8vp1pol_Gw,GET THE NOTEPAD!!,Hutch,shaun0728
X8vp1pol_Gw,9:28 "Nothin personnel  kid",Hutch,shaun0728
X8vp1pol_Gw,I play on console which plays slower by nature (usually) and in my case I like to build up and fortify in the end game in which case rockets are incredible. Having height and being just a little careful not to nuke yourself could guarantee you the win in almost any situation. In my experience,Hutch,shaun0728
X8vp1pol_Gw,That 4:20 duo kill is one of the best things ive ever seen Hutch do,Hutch,shaun0728
X8vp1pol_Gw,9:29 what kind of weird fucking stairs are those?,Hutch,shaun0728
X8vp1pol_Gw,Open bottle by the warm computer? Cat's gonna kick that shit down :D,Hutch,shaun0728
X8vp1pol_Gw,That shot was spicy!! I actually said wow out loud,Hutch,shaun0728
X8vp1pol_Gw,Does ur back hurt? H3cz doesn't look small and with all the carrying you should make sure you're icing your back and stretching.,Hutch,shaun0728
X8vp1pol_Gw,1638 paying subs yesterday. If the lowest donated was $1  that would mean hutch could make $597 870 before taxes if he played and averaged that every day before taxes!,Hutch,shaun0728
X8vp1pol_Gw,sounds like hutch just sucks with the rockets... doesnt seem to be holding him back too much tho,Hutch,shaun0728
X8vp1pol_Gw,6:29 lol,Hutch,shaun0728
X8vp1pol_Gw,fuckin great video Hutch!!! deserve all the support Sir!,Hutch,shaun0728
X8vp1pol_Gw,Shocked hecz hear hutch shooting when he called out numbers and hutch wasn't even shooting....,Hutch,shaun0728
X8vp1pol_Gw,I gotta say I think the opposite about rockets. I find them much better suited for solo games  if you're a decent builder you can easily avoid killing yourself and the rockets work well for def. and off. strikes. Grenade launchers are way better for squads because you can shoot so many at once to destroy bases and blitzkrieg people pretty hard,Hutch,shaun0728
