videoId,comment,channelId,channelName
MmMq5-1ZnwI,your amazing!!!! I watch you every morning before I go to bed I love you!!!,Jaclyn Hill,Jaclynhill1
MmMq5-1ZnwI,Awwwww omfg when Jon hugged her it was adorable omfg,Jaclyn Hill,Jaclynhill1
MmMq5-1ZnwI,Legit 100x's prettier than Amrezy!,Jaclyn Hill,Jaclynhill1
MmMq5-1ZnwI,That eye look tho beautiful,Jaclyn Hill,Jaclynhill1
MmMq5-1ZnwI,You have horrific taste in music.,Jaclyn Hill,Jaclynhill1
MmMq5-1ZnwI,PTV fans anyone?,Jaclyn Hill,Jaclynhill1
MmMq5-1ZnwI,aww jac love and support you so much babe!,Jaclyn Hill,Jaclynhill1
MmMq5-1ZnwI,I was just looking through some of your older videos  and I think you look healthier and prettier these days !,Jaclyn Hill,Jaclynhill1
MmMq5-1ZnwI,to this day  seeing the end when she's dancing to Money on my Mind and jon comes in makes me cry i love them so much,Jaclyn Hill,Jaclynhill1
MmMq5-1ZnwI,Loved the grooving dance moves lol!!,Jaclyn Hill,Jaclynhill1
MmMq5-1ZnwI,Just found you. I think you have a great personality. That was such a fun video :-) Thanks,Jaclyn Hill,Jaclynhill1
MmMq5-1ZnwI,Hey guys sub to my brothers channel garrettdoesgames thk,Jaclyn Hill,Jaclynhill1
MmMq5-1ZnwI,Jaclyn I cannot get enough of your dogs! they are so so adorable.,Jaclyn Hill,Jaclynhill1
MmMq5-1ZnwI,Lox - ee - tan :),Jaclyn Hill,Jaclynhill1
MmMq5-1ZnwI,I've been watching your old and new video's back and forth and I've got to say I love how more bubbly you are now. You can tell in your old ones how nervous you were and I love the fact that you are so more comfortable in your skin now! You can tell you'e grown so much and I'm glad you hurdled those scares! Love your videos they are my go to when I wake up and drink my coffee and feed my newborn.,Jaclyn Hill,Jaclynhill1
MmMq5-1ZnwI,Does anybody know where this top is from? It's gorgeous!,Jaclyn Hill,Jaclynhill1
MmMq5-1ZnwI,im sensitive about my feet too haha,Jaclyn Hill,Jaclynhill1
MmMq5-1ZnwI,Where is your tank top from???!,Jaclyn Hill,Jaclynhill1
MmMq5-1ZnwI,I literally started crying at the end when Jon came up and hugged you and swung you around because it reminded me so much of my boyfriend and I know exactly what that kind of love and happiness feels like and it just made me so happy seeing someone (especially someone I love and respect as much as you) feel that happiness :)  all the love and support in the world for you  your career  and your family xoxo,Jaclyn Hill,Jaclynhill1
MmMq5-1ZnwI,I love how you radiate happiness your so beautiful xxx,Jaclyn Hill,Jaclynhill1
MmMq5-1ZnwI,This video just came on after your most recent video of 2016 October favorites. at first  I thought who is this girl  and then I realized it was you. You have changed so much  BUT HAS BEEN FOR THE BETTER!!!  you look so much healthier and happier. Im so happy for you. Ive been a silent subscriber for years  I follow you on snap and the gram and always like things but never comment.  JUSt wanted to say that you look great now and I hope you are in a better place in your life than you were when this video was made. LOVE LOVE LOVE you,Jaclyn Hill,Jaclynhill1
MmMq5-1ZnwI,LOX-I-TANN,Jaclyn Hill,Jaclynhill1
MmMq5-1ZnwI,Hey Jacklyn  I am french andI can 100% assure you that you would pronounce LO-XI-TA-NE . Voila!,Jaclyn Hill,Jaclynhill1
MmMq5-1ZnwI,Please do a hair color video!! Love you!!!,Jaclyn Hill,Jaclynhill1
MmMq5-1ZnwI,I would love a tutorial on this look or already a list of the shadows used,Jaclyn Hill,Jaclynhill1
MmMq5-1ZnwI,does anyone know if she did this look she is wearing her lid color is soooopp gorgeous.I need tutorial on this look please @Jaclynhill,Jaclyn Hill,Jaclynhill1
MmMq5-1ZnwI,what breed are your dog's?,Jaclyn Hill,Jaclynhill1
MmMq5-1ZnwI,please try IT cosmetics. i would really like to see a video where you use that company.,Jaclyn Hill,Jaclynhill1
MmMq5-1ZnwI,I watch this almost everyday*** I love everything about it***,Jaclyn Hill,Jaclynhill1
MmMq5-1ZnwI,you are so pretty..now you inspired for red hair can you please tell me where to buy your top,Jaclyn Hill,Jaclynhill1
MmMq5-1ZnwI,You look so pretty in this video!!!!,Jaclyn Hill,Jaclynhill1
MmMq5-1ZnwI,hhahaha " my friend jackie is an oily beast GOD BLESS HER"..lmao,Jaclyn Hill,Jaclynhill1
MmMq5-1ZnwI,This is one of my favorite videos of yours because 1.) you look so beautiful! For real! Even though your makeup is minimal  it looks so feminine and natural.--- 2.) your spunky and fun personality is on full display and nothing seems rehearsed or glamorized if that makes sense ---3.) Jon and your pups make an appearance! It is so fun to see them in videos!   Love you Jaclyn and I hope to meet you some day!!,Jaclyn Hill,Jaclynhill1
MmMq5-1ZnwI,Your a stunning bright spirit  LOVE AND look up to you all the time,Jaclyn Hill,Jaclynhill1
MmMq5-1ZnwI,That topp,Jaclyn Hill,Jaclynhill1
MmMq5-1ZnwI,THIS IS ALREADY A YEAR OLD?!,Jaclyn Hill,Jaclynhill1
MmMq5-1ZnwI,I just want you to know that I am absolutely IN LOVE with your top,Jaclyn Hill,Jaclynhill1
MmMq5-1ZnwI,I love this vid and how sure of yourself you are!  I can see how relaxed you are and how carefree you are. Lately all the vids are filled with you making sure your viewers are happy. You do you girl!,Jaclyn Hill,Jaclynhill1
MmMq5-1ZnwI,# relationshipgoals,Jaclyn Hill,Jaclynhill1
MmMq5-1ZnwI,She looked so pretty and fresh before all those fillers =(,Jaclyn Hill,Jaclynhill1
MmMq5-1ZnwI,What products do you use on your fur babies?,Jaclyn Hill,Jaclynhill1
MmMq5-1ZnwI,Yall should have a reality show!,Jaclyn Hill,Jaclynhill1
MmMq5-1ZnwI,Aaaaaaaaaawwwwwwwwww! I just want to stick your dog in my pocket and take em' home!!!,Jaclyn Hill,Jaclynhill1
MmMq5-1ZnwI,Funny cause all three limited addition things in the champagne glow palette are now permanent,Jaclyn Hill,Jaclynhill1
MmMq5-1ZnwI,Occitane is pronounced "oxitan" :),Jaclyn Hill,Jaclynhill1
MmMq5-1ZnwI,Jon coming in the video and holding her and her beaming smile showing adoration just got me. Favorite part of the video!,Jaclyn Hill,Jaclynhill1
MmMq5-1ZnwI,I wish I had the courage to mix my foundations  I feel like I'll break out more though,Jaclyn Hill,Jaclynhill1
MmMq5-1ZnwI,Girl those sweatpants with that fancy shirt. SLAY HUNNY,Jaclyn Hill,Jaclynhill1
MmMq5-1ZnwI,hehe  i dont know why i had this idea with this video.. but i think it would be SO interesting and So cool if beauty youtubers  such as yourself did a video kind of dealio where you would pick products that were products as if you could only have that one in that catagory for example like "if i was stranded or cast away and i could only pick one blush to take with me it would be.... NARS blush in the shade "madly" and then you tell us why. lol just a thought.. it made more sense in my head but it i guess is kind of like an ALLL TIME FAVORITES VIDEO  with a more unique title  im sure you could volve the idea into something grea  if you even see this comment... ANYWAYS i love you jaclyn  you are beautiful and the best!!! xoxoxo,Jaclyn Hill,Jaclynhill1
MmMq5-1ZnwI,PIERCE THE VEIL,Jaclyn Hill,Jaclynhill1
MmMq5-1ZnwI,YOUR MAKEUP IN THIS VIDEO IS PERFECTION I love you <3 <3 <3,Jaclyn Hill,Jaclynhill1
MmMq5-1ZnwI,loved the doll  too cute!,Jaclyn Hill,Jaclynhill1
MmMq5-1ZnwI,I absolutely LOVE that dog. What breed? so adorable..how cute your honey came and hugged you  more vids with him...,Jaclyn Hill,Jaclynhill1
MmMq5-1ZnwI,I am watching this in april '16  but I rematch this favorites video because you seem so real and I love how you and John are so in love.,Jaclyn Hill,Jaclynhill1
MmMq5-1ZnwI,Okay girl you've help me style my eyes ...so here u go. In my research water yes water is a culprit in weighing our hair down unfiltered that is.1)shower head filter 2)Carrot Shampoo or Honey. Natural shampoo or add the raw...all natural honey to ur shampoo. 3)Organic apple cider vinegar..you'll have to research which 1 is best due to ur hair dye the honey kept making my hair lighter.Don't worry girl the day I formulate/create the perfect shampoo n conditioner.....I'll keep u in mind.Every woman has issues with her hair too dry too oily too Straight  too curly...etc Just praise God u have it  and work with it=)Take care Gorgeous.,Jaclyn Hill,Jaclynhill1
MmMq5-1ZnwI,shes so happy with her husband  it actually brought a tear to my eye! beautiful genuine couple. :) xxx,Jaclyn Hill,Jaclynhill1
MmMq5-1ZnwI,CURRENTLY FREAKING OUT BECAUSE YOUR HUSBAND WAS WEARING A PIERCE THE VEIL SHIRT. I just fell in love with you even more omg,Jaclyn Hill,Jaclynhill1
MmMq5-1ZnwI,I just love you girl.. :) <3,Jaclyn Hill,Jaclynhill1
MmMq5-1ZnwI,uncanny. when I heard Money on my Mind  I literally thought of Jaclyn !!!!,Jaclyn Hill,Jaclynhill1
MmMq5-1ZnwI,literally obsessed with you.,Jaclyn Hill,Jaclynhill1
MmMq5-1ZnwI,Your makeup in this vid is seriously my favorite <3,Jaclyn Hill,Jaclynhill1
MmMq5-1ZnwI,I CAN'T TAKE IT ANYMORE. I WANT YOUR AND KATHLEEN'S DOGS.,Jaclyn Hill,Jaclynhill1
MmMq5-1ZnwI,I think you should add more of your fav songs into your fav videos!! Love you boo!!,Jaclyn Hill,Jaclynhill1
h0hR_KKjNuk,none,Jaclyn Hill,Jaclynhill1
SnfqlRi2ntI,can you do a furnished house tour !!!,Jaclyn Hill,Jaclynhill1
SnfqlRi2ntI,congratulations. I have read a few comments. I did not find them bitchy or salty. Most people are genuinely happy that their favorite youtuber has been able to get her dream home. Congratulations. This is what one works for...a nice comfortable home one day.,Jaclyn Hill,Jaclynhill1
SnfqlRi2ntI,where is the black lacker wall from,Jaclyn Hill,Jaclynhill1
SnfqlRi2ntI,How sad new house and she kicks John to the curb. Guess you find out who people really are when they start getting rich,Jaclyn Hill,Jaclynhill1
SnfqlRi2ntI,Wish I was rich.....,Jaclyn Hill,Jaclynhill1
SnfqlRi2ntI,MAKE A HOUSE TOUR ALREADY DAMN IT!,Jaclyn Hill,Jaclynhill1
SnfqlRi2ntI,Hi  where did you purchase the sonic ice machine??? Thanks.,Jaclyn Hill,Jaclynhill1
SnfqlRi2ntI,Looks a bit small for me...not big enough,Jaclyn Hill,Jaclynhill1
SnfqlRi2ntI,I'm waiting on my house to finish being built ... I literally watch this video once a month! Our styles are SOOO similar! Post more room tours  updates  etc!,Jaclyn Hill,Jaclynhill1
SnfqlRi2ntI,SONIC ICE OMG YESS,Jaclyn Hill,Jaclynhill1
SnfqlRi2ntI,Tacky ass walls....she can't even make the time to read or answer ANY of the well wishes and praise she's always getting...why does everyone drool over her??  It's just fcking make-up...,Jaclyn Hill,Jaclynhill1
SnfqlRi2ntI,Please can you do a completed house tour! I would absolutely love to see what it all looks like now x,Jaclyn Hill,Jaclynhill1
SnfqlRi2ntI,I love your videos they are amazing. I turned I. Your post nonfiction bell and subscribed,Jaclyn Hill,Jaclynhill1
SnfqlRi2ntI,CAN WE PLEASE GET ANOTHER UPDATED HOUSE TOUR PLEASEEE,Jaclyn Hill,Jaclynhill1
SnfqlRi2ntI,Show your fans the finish product. I bet after everything is in place and set  it's soooo gorgeous. I can't wait to see a video of your complete masterpiece.,Jaclyn Hill,Jaclynhill1
SnfqlRi2ntI,I have a little boy shih tzu & OMG they are just the cutest! P.S love your home style!,Jaclyn Hill,Jaclynhill1
SnfqlRi2ntI,https://www.youtube.com/watch?v=6j82gwO2Zg8,Jaclyn Hill,Jaclynhill1
SnfqlRi2ntI,Congratulations on all your accomplishments! You deserve all this more! Im one of your loyal subscribers! I bought all your makeup that you have came over out with!,Jaclyn Hill,Jaclynhill1
SnfqlRi2ntI,need updates on house tour,Jaclyn Hill,Jaclynhill1
SnfqlRi2ntI,Please do an updated tour now all the furniture and decorating is done xxx,Jaclyn Hill,Jaclynhill1
SnfqlRi2ntI,honeatly I like your house,Jaclyn Hill,Jaclynhill1
SnfqlRi2ntI,That pool was the best part lol,Jaclyn Hill,Jaclynhill1
SnfqlRi2ntI,So nobody asked and im a new subscriber so i would like to ask how did u afford this beautiful home (so happy for you guys),Jaclyn Hill,Jaclynhill1
SnfqlRi2ntI,REAL LIFE GOALS! CONGRATS!!!!!! YOU DESERVE IT LOVE!,Jaclyn Hill,Jaclynhill1
SnfqlRi2ntI,Please do an updated house tour !!!,Jaclyn Hill,Jaclynhill1
SnfqlRi2ntI,Can you please make an current house tour,Jaclyn Hill,Jaclynhill1
SnfqlRi2ntI,i love it! Do another video with all the updates. PLEASEEE!!,Jaclyn Hill,Jaclynhill1
SnfqlRi2ntI,He is so hot...get it girl,Jaclyn Hill,Jaclynhill1
SnfqlRi2ntI,I love you I'm so proud of you!!! I feel so inspired by you  if you can live your dreams we all can too!,Jaclyn Hill,Jaclynhill1
SnfqlRi2ntI,PLEASE DO A FURNISHED HOUSE TOUR,Jaclyn Hill,Jaclynhill1
SnfqlRi2ntI,is your house done yet? Finished house tour pleaseeeeeeeee,Jaclyn Hill,Jaclynhill1
SnfqlRi2ntI,Where did they buy that sign ????,Jaclyn Hill,Jaclynhill1
SnfqlRi2ntI,House tour furnished,Jaclyn Hill,Jaclynhill1
SnfqlRi2ntI,DO AN UPDATED HOUSE TOUR!!,Jaclyn Hill,Jaclynhill1
SnfqlRi2ntI,@jaclynhill is there going to another Complete House Tour?,Jaclyn Hill,Jaclynhill1
SnfqlRi2ntI,Where's the full house tour????????,Jaclyn Hill,Jaclynhill1
SnfqlRi2ntI,Please do a video on your beauty room closet,Jaclyn Hill,Jaclynhill1
SnfqlRi2ntI,Full house tour!!!,Jaclyn Hill,Jaclynhill1
SnfqlRi2ntI,Omg u should call mr Kate if you need help decorating your beauty room!!,Jaclyn Hill,Jaclynhill1
SnfqlRi2ntI,the toilet isn't boujee  it's poojee,Jaclyn Hill,Jaclynhill1
SnfqlRi2ntI,fully furnished tour please!!!!,Jaclyn Hill,Jaclynhill1
SnfqlRi2ntI,Can you do like a tour of your house now that is done pleaseeeee,Jaclyn Hill,Jaclynhill1
SnfqlRi2ntI,Falling in love with you as a YouTuber! Stay wonderful and shine on these haters!,Jaclyn Hill,Jaclynhill1
SnfqlRi2ntI,An office with a huge closet..a makeup room with a huge closet... and a bedroom with a ginormous closet...mmhmmm.,Jaclyn Hill,Jaclynhill1
SnfqlRi2ntI,SO READY FOR THE UPDATED HOUSE TOUR,Jaclyn Hill,Jaclynhill1
SnfqlRi2ntI,Do an updated tour!,Jaclyn Hill,Jaclynhill1
SnfqlRi2ntI,Please tell me I'm not the only one who notices her husband looks like li'L pump?,Jaclyn Hill,Jaclynhill1
SnfqlRi2ntI,That closet is the shit,Jaclyn Hill,Jaclynhill1
SnfqlRi2ntI,Your home is sooooo beautiful!!!  Totally Pinterest worthy!,Jaclyn Hill,Jaclynhill1
SnfqlRi2ntI,I love this so much! Please do a finished video! I bet your house will be so pretty once it's full and decorated!,Jaclyn Hill,Jaclynhill1
SnfqlRi2ntI,This is pure motivation for me,Jaclyn Hill,Jaclynhill1
SnfqlRi2ntI,I can remember watching you do make up in your kitchen years ago  you should be really proud of yourself! Your house is beautiful and you deserve it!!,Jaclyn Hill,Jaclynhill1
SnfqlRi2ntI,Beautiful house. I will never be able to buy even a small 1 br apartment for myself even tho I work hard but live month by month :(,Jaclyn Hill,Jaclynhill1
SnfqlRi2ntI,Incredible!!!,Jaclyn Hill,Jaclynhill1
SnfqlRi2ntI,Your house is so cool,Jaclyn Hill,Jaclynhill1
SnfqlRi2ntI,I just watched your closet tour  and I'M STILL WAITING FOR THE UPDATED HOUSE TOUR!!! *high-pitched screaming*,Jaclyn Hill,Jaclynhill1
SnfqlRi2ntI,You should do a tour on your house now with everything in it,Jaclyn Hill,Jaclynhill1
SnfqlRi2ntI,a doctor can't even afford this type wtf,Jaclyn Hill,Jaclynhill1
SnfqlRi2ntI,What part of Florida does this girl lives,Jaclyn Hill,Jaclynhill1
SnfqlRi2ntI,I assume this girl make makeup videos... Sh I need to start making make up videos,Jaclyn Hill,Jaclynhill1
SnfqlRi2ntI,I bet this girl is a Virgo... This is my first time watching,Jaclyn Hill,Jaclynhill1
SnfqlRi2ntI,Beautiful.,Jaclyn Hill,Jaclynhill1
SnfqlRi2ntI,Do a house tour now xx,Jaclyn Hill,Jaclynhill1
SnfqlRi2ntI,Hard work and dedication,Jaclyn Hill,Jaclynhill1
SnfqlRi2ntI,Updated house tour when its furnished? So dreamy!,Jaclyn Hill,Jaclynhill1
SnfqlRi2ntI,Can you please do an updated house tour  I love seeing it on Snapchat but would love a video :)   P.S. You are amazing and an inspiration. Don't ever change!,Jaclyn Hill,Jaclynhill1
SnfqlRi2ntI,Congrats well deserved!! Its so beautiful!!,Jaclyn Hill,Jaclynhill1
SnfqlRi2ntI,Goodmorning Bindi the other,Jaclyn Hill,Jaclynhill1
SnfqlRi2ntI,Damn girl! Your house is gorgeous!,Jaclyn Hill,Jaclynhill1
SnfqlRi2ntI,In Kansas City.  Those sitting rooms in masters bed rooms is a first year baby nursery.  The sink is for bottles.,Jaclyn Hill,Jaclynhill1
RX7IeGQCpJY,Hahahaha eye crack!,Jaclyn Hill,Jaclynhill1
RX7IeGQCpJY,Apply it under the eyes...heavy! Eye crack. Awesome Peter Griffin!,Jaclyn Hill,Jaclynhill1
RX7IeGQCpJY,What mascara did you use for the bottom lashes?,Jaclyn Hill,Jaclynhill1
RX7IeGQCpJY,This is legit the funniest shit ive ever seen,Jaclyn Hill,Jaclynhill1
RX7IeGQCpJY,So funny!!,Jaclyn Hill,Jaclynhill1
RX7IeGQCpJY,What is that spray u use before the concealer,Jaclyn Hill,Jaclynhill1
RX7IeGQCpJY,He's got a great voice,Jaclyn Hill,Jaclynhill1
RX7IeGQCpJY,Teletubbie ball lmaooo,Jaclyn Hill,Jaclynhill1
RX7IeGQCpJY,HIGHLIGHT ON FREAKING FLEEK DUH I FREAKING TOOK A BATH ON THIS  SHIT ! HIGHLIGHT GOAL AF AF AF HIGHLIGHT GOAL HIGHLIGHT GOALS LMFAOOOOOIVE WATCH THIS VIDEO 15434839 TIMES AND IM STILL LAUGHING,Jaclyn Hill,Jaclynhill1
RX7IeGQCpJY,CAN I JUST SAY HIS PETER GRIFFING VOICE IS ON POINT !,Jaclyn Hill,Jaclynhill1
RX7IeGQCpJY,UNIBROWS BEEN GROWING OUT FOR 10 YEARS BITCHES !! LMFAOO OH LORD I LOVE THIS,Jaclyn Hill,Jaclynhill1
RX7IeGQCpJY,I am screaming.,Jaclyn Hill,Jaclynhill1
RX7IeGQCpJY,You 2 are so adorable! Love you both! Peter Griffin on fleek!! Yeeeesss!,Jaclyn Hill,Jaclynhill1
RX7IeGQCpJY,His sound fx. lol,Jaclyn Hill,Jaclynhill1
RX7IeGQCpJY,22 seconds in and i am already in tears,Jaclyn Hill,Jaclynhill1
RX7IeGQCpJY,Peter Griffin voice on fleek haha,Jaclyn Hill,Jaclynhill1
RX7IeGQCpJY,LOL too funny!,Jaclyn Hill,Jaclynhill1
RX7IeGQCpJY,so funny hahaahahha,Jaclyn Hill,Jaclynhill1
RX7IeGQCpJY,I love how he has a pretty good idea whats going on.  You can tell he loves you!,Jaclyn Hill,Jaclynhill1
RX7IeGQCpJY,"I have to go grab that tellie-tubby ball and rub my ear with it." S C R E A M I N G,Jaclyn Hill,Jaclynhill1
RX7IeGQCpJY,so funny,Jaclyn Hill,Jaclynhill1
RX7IeGQCpJY,lol funny as hell,Jaclyn Hill,Jaclynhill1
RX7IeGQCpJY,that slurping sound lmaooo omg I can't and the little giggles/sound effects lol I can't,Jaclyn Hill,Jaclynhill1
RX7IeGQCpJY,The peter griffin impression: I am DYING,Jaclyn Hill,Jaclynhill1
RX7IeGQCpJY,I freaking love this! This has made my day hahaha <3,Jaclyn Hill,Jaclynhill1
RX7IeGQCpJY,lolll,Jaclyn Hill,Jaclynhill1
RX7IeGQCpJY,Highlight on fleeking fleek. Lolololol,Jaclyn Hill,Jaclynhill1
RX7IeGQCpJY,Sweetest video ever,Jaclyn Hill,Jaclynhill1
RX7IeGQCpJY,Eye crack. Tellytubby Sponge. Lord Jon is crackin me up lol,Jaclyn Hill,Jaclynhill1
RX7IeGQCpJY,Hahahhahaha i died hahahahaa,Jaclyn Hill,Jaclynhill1
RX7IeGQCpJY,This is now my most favorite makeup tutorial ever,Jaclyn Hill,Jaclynhill1
RX7IeGQCpJY,Funny,Jaclyn Hill,Jaclynhill1
RX7IeGQCpJY,omg john did so well! :D,Jaclyn Hill,Jaclynhill1
RX7IeGQCpJY,do you have dry skin Jaclyn? <3,Jaclyn Hill,Jaclynhill1
RX7IeGQCpJY,what bottom mascara do you use?,Jaclyn Hill,Jaclynhill1
RX7IeGQCpJY,does anyone know which highlighter she used?,Jaclyn Hill,Jaclynhill1
RX7IeGQCpJY,Concealer is foundation now a days,Jaclyn Hill,Jaclynhill1
RX7IeGQCpJY,Hahahah!,Jaclyn Hill,Jaclynhill1
RX7IeGQCpJY,lmfao!! Jon - "highlight on freaking fleek! goals AF goals AF! highlight goals highlight goalssss!!",Jaclyn Hill,Jaclynhill1
RX7IeGQCpJY,Lmfaaaoooooooo omg u to are the best couple!! Blessings to u both!! You guys have the same sense of humor!!,Jaclyn Hill,Jaclynhill1
RX7IeGQCpJY,eye crak,Jaclyn Hill,Jaclynhill1
RX7IeGQCpJY,What highlight is that,Jaclyn Hill,Jaclynhill1
RX7IeGQCpJY,Omg I love u both. Jajajajajajajajjajajajaj,Jaclyn Hill,Jaclynhill1
RX7IeGQCpJY,What contour stick & brush did she use???,Jaclyn Hill,Jaclynhill1
RX7IeGQCpJY,Your husband is way too cute/hilarious! =),Jaclyn Hill,Jaclynhill1
RX7IeGQCpJY,"Nice deep in dat crack",Jaclyn Hill,Jaclynhill1
RX7IeGQCpJY,Your husbands voiceover is 10/10,Jaclyn Hill,Jaclynhill1
RX7IeGQCpJY,The sound effect are sooo funny,Jaclyn Hill,Jaclynhill1
RX7IeGQCpJY,Lmaoooooo too good!!!,Jaclyn Hill,Jaclynhill1
RX7IeGQCpJY,does anyone know what lashes these are?!,Jaclyn Hill,Jaclynhill1
RX7IeGQCpJY,bouncy bouncy telly tubby.... im done XDDD,Jaclyn Hill,Jaclynhill1
RX7IeGQCpJY,I literally have been cry laughing tears bc of his voiceover!,Jaclyn Hill,Jaclynhill1
RX7IeGQCpJY,Hilarious,Jaclyn Hill,Jaclynhill1
RX7IeGQCpJY,Perfection.... smear it!,Jaclyn Hill,Jaclynhill1
RX7IeGQCpJY,could you please tell me where you got the gold and white curtains in the background,Jaclyn Hill,Jaclynhill1
RX7IeGQCpJY,His voice over is hilarious,Jaclyn Hill,Jaclynhill1
RX7IeGQCpJY,loving this vid! <3,Jaclyn Hill,Jaclynhill1
jiuqe-C5bnY,Love your video it was super helpful!! I'm OBSESSED with your watch!! Where is it from?!,Jaclyn Hill,Jaclynhill1
jiuqe-C5bnY,Does anyone know where she got her top??!!,Jaclyn Hill,Jaclynhill1
jiuqe-C5bnY,What eyeshadow are you wearing in this video??,Jaclyn Hill,Jaclynhill1
jiuqe-C5bnY,KKW makeup colors are not authentic.. sorry.,Jaclyn Hill,Jaclynhill1
jiuqe-C5bnY,KKW DO NOT ALLOW RETURN OR EXCHANGES  THEIR COLORS DON'T MATCH AND I BOUGHT CONTOUR KIT AND TOSSED IT OUT.  PLEASE GO OUT GET QUALITY MAKEUP AT MAC OR CHANEL OR YVES SAINT LAURENT.,Jaclyn Hill,Jaclynhill1
jiuqe-C5bnY,My ears are going crazy because I'm hearing bs&t,Jaclyn Hill,Jaclynhill1
jiuqe-C5bnY,What other cream contour sticks would you recommend?,Jaclyn Hill,Jaclynhill1
jiuqe-C5bnY,*GASP You are the prettiest makeup guru on YouTube! I just started following you yesterday and you are absolutely gorgeous! I expecially like your hairstyle in this video  after binge watching all night!,Jaclyn Hill,Jaclynhill1
jiuqe-C5bnY,Plop,Jaclyn Hill,Jaclynhill1
jiuqe-C5bnY,Does anyone know where her shirt is from?,Jaclyn Hill,Jaclynhill1
jiuqe-C5bnY,Daaamn Gina  I neeed her lip shades!!!!! Sooo Gorge!!!!!!,Jaclyn Hill,Jaclynhill1
jiuqe-C5bnY,Kim is definately everyones inspiration to us all with her flawless glowy snatched looks she has us all dying to get and you Jaclyn Hill have helped me get to what i want for my look   your the best Beautuber!! lol Love you! xx :),Jaclyn Hill,Jaclynhill1
jiuqe-C5bnY,Kristal Rivera YouTube makes a great,Jaclyn Hill,Jaclynhill1
jiuqe-C5bnY,looks cheap,Jaclyn Hill,Jaclynhill1
jiuqe-C5bnY,I am tan and it looks HORRIBLE,Jaclyn Hill,Jaclynhill1
jiuqe-C5bnY,you look best with this darker colour,Jaclyn Hill,Jaclynhill1
jiuqe-C5bnY,I still accidently call her Kim K. too. I try to be respectful but its a habit.,Jaclyn Hill,Jaclynhill1
jiuqe-C5bnY,Your natural lip color is so pretty.  All the nude shades wash out your lips the before is better. You can save money and just wear chapstick with spf,Jaclyn Hill,Jaclynhill1
jiuqe-C5bnY,I would love a tutorial for your eye look. It would be perfect for NYE!!!,Jaclyn Hill,Jaclynhill1
jiuqe-C5bnY,Ok I know this is an older video  but I wanted to come back and get a list of what you're currently wearing!!! that eyeshadow look with eyelashes with the highlight and the blush! just all of you! I wanted to do this look for Christmas shopping at the Christmas markets in Germany! if anyone knows hit me with a reply and let me know <3,Jaclyn Hill,Jaclynhill1
jiuqe-C5bnY,http://JobZipo.com/?refer=30477  Work from home! No sign up fee. And it really works!,Jaclyn Hill,Jaclynhill1
jiuqe-C5bnY,Love your hair here!,Jaclyn Hill,Jaclynhill1
jiuqe-C5bnY,You look so beautiful I hope to be as successful as you one day Beauty is an amazing passion... Beauty is power and with it you can do anything xoxo love you girl,Jaclyn Hill,Jaclynhill1
jiuqe-C5bnY,WISH YOU COULD DO MY MAKEUP.....,Jaclyn Hill,Jaclynhill1
jiuqe-C5bnY,Um  WHERE did you get your top? LOVEEE,Jaclyn Hill,Jaclynhill1
jiuqe-C5bnY,Thiis bitch is annoying af ..is she a transgender? ...what drug is she taking? I cant....,Jaclyn Hill,Jaclynhill1
jiuqe-C5bnY,What highlighter do you use?!,Jaclyn Hill,Jaclynhill1
jiuqe-C5bnY,To much highlighter omggg,Jaclyn Hill,Jaclynhill1
jiuqe-C5bnY,Jacs what is on your eyes? Its flawless!!!! What is the flawless eyeshadow?,Jaclyn Hill,Jaclynhill1
jiuqe-C5bnY,Are they mate?,Jaclyn Hill,Jaclynhill1
jiuqe-C5bnY,it is noticed that the products of public relations are not of the same quality of the ones that are for sale. all the dreads of normal girls who bought them were very negative.,Jaclyn Hill,Jaclynhill1
jiuqe-C5bnY,"Nothing is going to be unflattering on any skin tones"... Yeah that's a lie! lol,Jaclyn Hill,Jaclynhill1
jiuqe-C5bnY,Bitch if u use to work at Mac      wtf are u doing wasting your time on youtube?!?!!,Jaclyn Hill,Jaclynhill1
jiuqe-C5bnY,What eye shadow are you wearing in this video,Jaclyn Hill,Jaclynhill1
jiuqe-C5bnY,Any youtubers want to help each other out?,Jaclyn Hill,Jaclynhill1
jiuqe-C5bnY,i am responding to your collab with Kim K.  Do not listen to the ridic comments. the  vid  was great !!!! I am happy for you,Jaclyn Hill,Jaclynhill1
jiuqe-C5bnY,HI  i Have most likely watched every video ouve ever made   bought all your products which has been alot of hours spent watching them and spending money on them.  Out of love i say this   you really need to start plugging back into you tube .  Its because of us following you on all your platforms and supporting you subscribing to you us because of us not to take away from your hard work for sure  that have aided you to get where you are   live where your living and enjoying the life you are enjoying.  I feel abaandoned by you and im sure i am not alone only brave enough to say so.  we all look forward to tutorials a couple times a week and all the things you used to do and dont .  Please honor the life you have been blessed with by honoring the people who helped you get there and start putting out videos again.  I know you have a life but figure out how to do it  .   i dont think i want to unsubscribe at all  i just think you can do whats right by your viewers .  thanks,Jaclyn Hill,Jaclynhill1
jiuqe-C5bnY,can you put subtitles in Italian on youtube?,Jaclyn Hill,Jaclynhill1
