videoId,comment,channelId,channelName
Nk5yOFCsNeE,The give away is probably not going on anymore but I'm from Canada  12 years old and I wanna be a professional makeup artist when I'm older but I DON'T WANT PEOPLE TO THINK THEY'RE ONLY BEAUTIFUL BECAUSE OF MAKEUP I used to think that about myself but now I realized EVERYONE is beautiful just the way they are. Your beauty comes from the inside you could be a very pretty person but a totally bad person. Inner beauty is all that matters.,Manny Mua,MannyMua733
Nk5yOFCsNeE,Why the fuck arent people suprised on the foundation color,Manny Mua,MannyMua733
Nk5yOFCsNeE,The price is RIDICULOUS and reflects her over inflated ego.  Great review  thank you!,Manny Mua,MannyMua733
Nk5yOFCsNeE,Keep these kids from being scammed... as a father I thank you for being truthful.,Manny Mua,MannyMua733
Nk5yOFCsNeE,Texas San Antonio  cause I freaking love makeup and it inspires me to be very creative and it allows me to express myself to others. Insta Gabe.spins_,Manny Mua,MannyMua733
Nk5yOFCsNeE,THEY LOOK CHEAPPPPPP!!!! that packaging is soooo baddddd. Drugstore had better packaging LOL,Manny Mua,MannyMua733
Nk5yOFCsNeE,My morgage is less than 360 a month!!! By the way I just came across your channel recently (while I was in the hospital) and I already love you!!!!,Manny Mua,MannyMua733
Nk5yOFCsNeE,Would never buy. Looks cheap AF,Manny Mua,MannyMua733
Nk5yOFCsNeE,I mean like elf's brushes..... But I guess I'm just cheap,Manny Mua,MannyMua733
Nk5yOFCsNeE,Ur little moon necklace is so cute,Manny Mua,MannyMua733
Nk5yOFCsNeE,RIGHT BITCHHHH,Manny Mua,MannyMua733
Nk5yOFCsNeE,And people praise Kylie. Fucking pathetic.,Manny Mua,MannyMua733
Nk5yOFCsNeE,$360 ?? my ass!! they better be fucking gold if im payin that shit hell nah,Manny Mua,MannyMua733
Nk5yOFCsNeE,434,Manny Mua,MannyMua733
Nk5yOFCsNeE,Lmaoooo how he got pissed while using the blending brushes at first,Manny Mua,MannyMua733
Nk5yOFCsNeE,He is obviously gay!,Manny Mua,MannyMua733
Nk5yOFCsNeE,What I learned from this video-he likes morphie,Manny Mua,MannyMua733
Nk5yOFCsNeE,Gays,Manny Mua,MannyMua733
Nk5yOFCsNeE,I would rather spend my money on Morphe or Sleek stuff any day. Can't believe this price point and it doesn't even contain a LIP BRUSH. FOH,Manny Mua,MannyMua733
Nk5yOFCsNeE,the foundation at the beginning looked too white but @mannymua youre review was honest af,Manny Mua,MannyMua733
Nk5yOFCsNeE,Am I gonna gonna buy these brushes? Helll no. Am I still gonna watch this video? Hell yes,Manny Mua,MannyMua733
Nk5yOFCsNeE,Manny you are hilarious!! I think the brushes should sing to you and feed you grapes as well!!! Lol,Manny Mua,MannyMua733
Nk5yOFCsNeE,Fromm Sunny Floridaa . I'm in cosmetology school and I'm so in love with make up it would help me but I'm pretty sure someone won already lol.,Manny Mua,MannyMua733
Nk5yOFCsNeE,for 360$ Kylie herself better come to my house and do my makeup for me haha,Manny Mua,MannyMua733
Nk5yOFCsNeE,damnnnn i love you,Manny Mua,MannyMua733
Nk5yOFCsNeE,Ajax  Ontario  Canada,Manny Mua,MannyMua733
Nk5yOFCsNeE,Manny is so cute,Manny Mua,MannyMua733
Nk5yOFCsNeE,Manny looks like Lord Farquad,Manny Mua,MannyMua733
Nk5yOFCsNeE,San Diego resident!!love all of your videos,Manny Mua,MannyMua733
bzlsUt2inR4,COME ON DRUGSTORE TRANSFORMATION! :D Who else loves when Laura and I collab?!,Manny Mua,MannyMua733
bzlsUt2inR4,MHMMMM,Manny Mua,MannyMua733
bzlsUt2inR4,Oh  she has never looked so beautiful. You should do her makeup every day  Manny.,Manny Mua,MannyMua733
bzlsUt2inR4,Many are you Spanish?!? Bc u rlly have a hispanic accent ( I would know bc I am Hispanic),Manny Mua,MannyMua733
bzlsUt2inR4,Nice brows!!!!,Manny Mua,MannyMua733
bzlsUt2inR4,Love you Manny,Manny Mua,MannyMua733
bzlsUt2inR4,I'm sorry but Manny does better make up on other people! Laura looked bomb!,Manny Mua,MannyMua733
bzlsUt2inR4,LOOOOOOOOLLLLLL,Manny Mua,MannyMua733
bzlsUt2inR4,Damn Manny is so gentle and sweet!,Manny Mua,MannyMua733
bzlsUt2inR4,2 minutes info the video and my abs already hurt from laughing... tf,Manny Mua,MannyMua733
bzlsUt2inR4,'' carliiiii '',Manny Mua,MannyMua733
bzlsUt2inR4,Manny- Rite Aid now has the Wet n Wild gold highlight bar in stock- just thought you might want to snatch one up!,Manny Mua,MannyMua733
bzlsUt2inR4,BROWS LOOK AMAZING OH MY LAWD,Manny Mua,MannyMua733
bzlsUt2inR4,Daaaaaaaaaaaamn,Manny Mua,MannyMua733
bzlsUt2inR4,Laura's giggle in the beginning has me crying,Manny Mua,MannyMua733
bzlsUt2inR4,I so need you to do my make up  Manny.  Laura's make up turned out so beautifully.,Manny Mua,MannyMua733
bzlsUt2inR4,Did Manny said 'Ang ganda' when he was applying the highlighter?,Manny Mua,MannyMua733
bzlsUt2inR4,damn manny did amazing on laura . shes never looked better !!,Manny Mua,MannyMua733
bzlsUt2inR4,laura's eyelashes were bothering me cx,Manny Mua,MannyMua733
bzlsUt2inR4,when you've never seen this video  and did the exact same eye look from it  with the same exact palette. lmao So crazy,Manny Mua,MannyMua733
bzlsUt2inR4,Beautiful job you did on her makeup,Manny Mua,MannyMua733
bzlsUt2inR4,broooo you gotta list the products come onnnnn,Manny Mua,MannyMua733
bzlsUt2inR4,I want Manny to do makeup on me!,Manny Mua,MannyMua733
bzlsUt2inR4,Sexy,Manny Mua,MannyMua733
bzlsUt2inR4,I love y'all so much my BABIES,Manny Mua,MannyMua733
bzlsUt2inR4,Wow pretty,Manny Mua,MannyMua733
bzlsUt2inR4,She let him touch her nose!!!!,Manny Mua,MannyMua733
bzlsUt2inR4,Your friendship makes me laugh so much,Manny Mua,MannyMua733
bzlsUt2inR4,All I use is drugstore makeup because that's all I can afford,Manny Mua,MannyMua733
bzlsUt2inR4,lol y'all funny as hell,Manny Mua,MannyMua733
bzlsUt2inR4,She's annoying,Manny Mua,MannyMua733
bzlsUt2inR4,fuck all these gay fags,Manny Mua,MannyMua733
bzlsUt2inR4,holy i wish he could do my make up!,Manny Mua,MannyMua733
bzlsUt2inR4,manny fucking killed it wow,Manny Mua,MannyMua733
bzlsUt2inR4,The beginning got me man,Manny Mua,MannyMua733
bzlsUt2inR4,Freaking loved the bloopers,Manny Mua,MannyMua733
bzlsUt2inR4,When you tubers say that they are doing a "drug store" makeup look  I'm expecting a dollar store  5 below  or the dollar tree. NOT FREAKING ULTA THAT I CAN BARELY AFFORD,Manny Mua,MannyMua733
bzlsUt2inR4,she's so pretty omg,Manny Mua,MannyMua733
bzlsUt2inR4,Soooo I noticed that in one of Laura's videos she was talking about the Pyhsicians formula butter bronzer and how much she did not like the smell of it... and then when she's with manny she just happens to love the smell of it now?? Girl I love you and all but which one is it!!?,Manny Mua,MannyMua733
bzlsUt2inR4,you need to glam Gabriel next.,Manny Mua,MannyMua733
bzlsUt2inR4,Am I the only one who heard Manny say Maganda which means beautiful in Filipino,Manny Mua,MannyMua733
bzlsUt2inR4,If manny was straight  they would honestly be so cute together.,Manny Mua,MannyMua733
bzlsUt2inR4,MANNY I just wanna kiss u,Manny Mua,MannyMua733
bzlsUt2inR4,I love when you guys collab  I always pee myself I laugh so hard,Manny Mua,MannyMua733
bzlsUt2inR4,OMG yall crack me up!!,Manny Mua,MannyMua733
bzlsUt2inR4,I fucking live for manny and Laura's bloopers !,Manny Mua,MannyMua733
bzlsUt2inR4,I feel like everyone on Manny's channel has a good time,Manny Mua,MannyMua733
bzlsUt2inR4,bold liner looks so good on her,Manny Mua,MannyMua733
bzlsUt2inR4,I wish Manny would do my makeup! You're so talented!,Manny Mua,MannyMua733
bzlsUt2inR4,love you all,Manny Mua,MannyMua733
bzlsUt2inR4,Omg the bloopers were hilarious!! Loved!,Manny Mua,MannyMua733
bzlsUt2inR4,I love that eyeshadow pallette! I bought near Christmas at ULTA and it's my absolute favorite pallette!,Manny Mua,MannyMua733
bzlsUt2inR4,any small youtubers looking to support eachother? we sub back:) xx,Manny Mua,MannyMua733
bzlsUt2inR4,LMAO MANNY STARTED TO CHEW IN THE BLOOPERS?,Manny Mua,MannyMua733
bzlsUt2inR4,Okay  you guys are too cute. You should have a contest and the prize is Manny  Laura and Jeffree do the winners makeup. Each of you do a different part of the face then we go to Hawaii. Okay  the last part is a joke. Think about it! I'd give to a charity. Buy any product!,Manny Mua,MannyMua733
bzlsUt2inR4,Manny can seriously BEAT a mug  holy FUCK.,Manny Mua,MannyMua733
bzlsUt2inR4,LOVE this video Manny! I am obsessed with watching your channel. You truely are an amazing makeup artist. I really like this video because for 1 you did an excellent job on Laura Lee[her makeup is poppin' giiirrrlll] but why I ESPECIALLY LOVE THIS VIDEO is because I really cant afford to get makeup @ Ulta or Sephora or even Mac so watching your videos on doing glams w/all drugstore products has really helped me to get products I LOVE n thanks to you because you turned me onto them :D anyways love you Manny & keep doing what you do! Thank you soo much for being a big inspiration to me & of course helping me through those times when Im doing my makeup and need tips or helpful hacks on making my makeup look gorg. YOUR THE SHIT BAE! Much Love <33,Manny Mua,MannyMua733
bzlsUt2inR4,Yay love your collabs !!!!,Manny Mua,MannyMua733
bzlsUt2inR4,I fuck with manny's shirt so hard,Manny Mua,MannyMua733
bzlsUt2inR4,fricking HILARIOUS. i choked on my food yo,Manny Mua,MannyMua733
bzlsUt2inR4,I love you so much and I hope you'll consider me for the giveaway. I never win this stuff and it would mean so much to me. Keep doing what you do. My snap is lizbeth.sophia and my insta is lizbeth__sophia with two underscores,Manny Mua,MannyMua733
bzlsUt2inR4,You guys are hilarious!! Loved the eye look!!,Manny Mua,MannyMua733
4QjNlj1mk1A,Why was this video actually SOOOO FUN!!!!!! It literally felt like a science experiment!  Also... who liked the full glam at the end ;),Manny Mua,MannyMua733
4QjNlj1mk1A,manny's laugh is iconic <33  love your videos btw. I'm a long time subscriber!,Manny Mua,MannyMua733
4QjNlj1mk1A,Do mixing all your highlights,Manny Mua,MannyMua733
4QjNlj1mk1A,Manny how hard is it to put on foundation with a beard,Manny Mua,MannyMua733
4QjNlj1mk1A,Safija Nydaard started this mixing shit.,Manny Mua,MannyMua733
4QjNlj1mk1A,Who watches edward avila,Manny Mua,MannyMua733
4QjNlj1mk1A,Today I saw a cat chasing two squirrels and I swear to god I heard the squirrels laughing at the cat but then the cat caught them and cat their head off,Manny Mua,MannyMua733
4QjNlj1mk1A,I always use MANNYMUA code on Morphe and love you for it!!! awesome video:),Manny Mua,MannyMua733
4QjNlj1mk1A,Thank you for being you! You always make me laugh. Your the best!,Manny Mua,MannyMua733
4QjNlj1mk1A,Name a more iconic laugh,Manny Mua,MannyMua733
4QjNlj1mk1A,Manny can you do this eye look? I love i am gagged!!! Need to see how you did it!!,Manny Mua,MannyMua733
4QjNlj1mk1A,i dont know what kpop form is but i guess i relate to Nikita more now..,Manny Mua,MannyMua733
4QjNlj1mk1A,Wooooo how the hell are you doing that with Your fingers,Manny Mua,MannyMua733
4QjNlj1mk1A,So... I didn't know MUA meant makeup artist... I thought Mua was your last name so... I called you Manny mwa....,Manny Mua,MannyMua733
4QjNlj1mk1A,Manny my muffin I am living! You are snatched to the Gods!!  Those eyes... I am dead!!  love you boo..,Manny Mua,MannyMua733
4QjNlj1mk1A,I die whenever you say "that's the gag" hahaa love you Manny,Manny Mua,MannyMua733
4QjNlj1mk1A,whats a pore b i t c h,Manny Mua,MannyMua733
4QjNlj1mk1A,Does anyone know where he got his necklace???,Manny Mua,MannyMua733
4QjNlj1mk1A,I LOVE your eye look! Video please!!!,Manny Mua,MannyMua733
4QjNlj1mk1A,does anyone know what foundation number 9 is,Manny Mua,MannyMua733
4QjNlj1mk1A,hi shishters,Manny Mua,MannyMua733
4QjNlj1mk1A,This is what I have to do on a daily basis. I can never find a foundation my shade so I literally mix 5 different shades (1 warm light  1 warm dark  1 cool light  1 cool dark  1 white colour corrector) just so it matches.,Manny Mua,MannyMua733
4QjNlj1mk1A,Your eyes are AMAZING,Manny Mua,MannyMua733
4QjNlj1mk1A,I only have 25 foundations,Manny Mua,MannyMua733
4QjNlj1mk1A,Only you can pull off an extreme makeup look. Slay my life Queen,Manny Mua,MannyMua733
4QjNlj1mk1A,so satisfied.,Manny Mua,MannyMua733
4QjNlj1mk1A,Hi guys welcome back to my channel  HEHHEHEHEHHEHEHHEHE,Manny Mua,MannyMua733
4QjNlj1mk1A,Your language is ferral,Manny Mua,MannyMua733
4QjNlj1mk1A,So nice,Manny Mua,MannyMua733
4QjNlj1mk1A,This had me gaging gurl,Manny Mua,MannyMua733
4QjNlj1mk1A,any armys?,Manny Mua,MannyMua733
4QjNlj1mk1A,lolz  that is alot of foundations,Manny Mua,MannyMua733
4QjNlj1mk1A,I love you,Manny Mua,MannyMua733
4QjNlj1mk1A,The bloopers had me DYING especially on the 7-day part oml!! Hahahaha,Manny Mua,MannyMua733
4QjNlj1mk1A,Hehuheuhuheu,Manny Mua,MannyMua733
4QjNlj1mk1A,love to see safiya starting a trend i'm so proud of her,Manny Mua,MannyMua733
4QjNlj1mk1A,You look better without makeup,Manny Mua,MannyMua733
4QjNlj1mk1A,I LOVE SAFIYA,Manny Mua,MannyMua733
4QjNlj1mk1A,you should do all your primers and then all your foundations and then all your concealers then powder and your whole makeup products you know what i mean,Manny Mua,MannyMua733
4QjNlj1mk1A,*he has 30 foundations and i have one that's too dark*,Manny Mua,MannyMua733
4QjNlj1mk1A,you are so handsome man...,Manny Mua,MannyMua733
4QjNlj1mk1A,i get it a bitch is pale,Manny Mua,MannyMua733
4QjNlj1mk1A,when you first put it on  it was like war paint,Manny Mua,MannyMua733
4QjNlj1mk1A,Looks great! Love the eye look too!,Manny Mua,MannyMua733
4QjNlj1mk1A,Color pop makes the Kale makeup,Manny Mua,MannyMua733
4QjNlj1mk1A,WHAT AN EYE LOOK OH MY LORD,Manny Mua,MannyMua733
4QjNlj1mk1A,Christine from simplynailogical did it first,Manny Mua,MannyMua733
4QjNlj1mk1A,Mix your eyeshadows,Manny Mua,MannyMua733
4QjNlj1mk1A,omg he should mix all his concealers  highlighters  contours  blushes  etc til he can make a full face and see how turns out!,Manny Mua,MannyMua733
4QjNlj1mk1A,**hi**,Manny Mua,MannyMua733
4QjNlj1mk1A,***hi***,Manny Mua,MannyMua733
4QjNlj1mk1A,Anybody who says they are so shook needs an ass kicking. Its so annoying. You sound retarded.,Manny Mua,MannyMua733
4QjNlj1mk1A,I own that same exact mug!,Manny Mua,MannyMua733
4QjNlj1mk1A,A VIDEO ON THAT EYELOOOOOK,Manny Mua,MannyMua733
4QjNlj1mk1A,I got three pimples watching this,Manny Mua,MannyMua733
4QjNlj1mk1A,Can we get a tutorial for that eyeshadow!! It's amazing,Manny Mua,MannyMua733
4QjNlj1mk1A,omggggg your eye shadow is soooo beautiful! i love it!,Manny Mua,MannyMua733
4QjNlj1mk1A,i love u,Manny Mua,MannyMua733
4QjNlj1mk1A,manny cured my hangover,Manny Mua,MannyMua733
4QjNlj1mk1A,Omg! Manny is sooo funny! Especially when he makes the little voices,Manny Mua,MannyMua733
rE8-uXYbZXA,"You look like you're coming for blood" "From who?"  lol Mykie's totally glam and gore  love it!!,Manny Mua,MannyMua733
rE8-uXYbZXA,Does she have diamonds on her teeth?,Manny Mua,MannyMua733
rE8-uXYbZXA,HOLY SHIT THATS MYKIE???,Manny Mua,MannyMua733
rE8-uXYbZXA,You made mykie look beautiful! Not that she doesn't look beautiful anyway   she is always beautiful. Dream to have you do my make up one day,Manny Mua,MannyMua733
rE8-uXYbZXA,this makeup is amazing!!!!!! love it so much,Manny Mua,MannyMua733
rE8-uXYbZXA,I never realied how fxxx milky white her skin is wow!,Manny Mua,MannyMua733
rE8-uXYbZXA,She's so pretty without make up too!!,Manny Mua,MannyMua733
rE8-uXYbZXA,She looks so good with makeup and she is transforming a model. But I really like her without makeup  she looks unique,Manny Mua,MannyMua733
rE8-uXYbZXA,Does she have albinism?,Manny Mua,MannyMua733
rE8-uXYbZXA,She looks like Madonna,Manny Mua,MannyMua733
rE8-uXYbZXA,*I just ate Colgate*,Manny Mua,MannyMua733
rE8-uXYbZXA,Looks so beautiful!,Manny Mua,MannyMua733
rE8-uXYbZXA,Wow.. someone who has invisible eyebrows and eyelashes like I do! Yaaa! Hahah. Awesome.,Manny Mua,MannyMua733
rE8-uXYbZXA,She looks like Mia from Family fizz,Manny Mua,MannyMua733
rE8-uXYbZXA,Wig ruined it.,Manny Mua,MannyMua733
rE8-uXYbZXA,She looks so good omg,Manny Mua,MannyMua733
rE8-uXYbZXA,Whoooaaaaaa.....too much eyebrow...,Manny Mua,MannyMua733
rE8-uXYbZXA,She looks like madonna,Manny Mua,MannyMua733
rE8-uXYbZXA,Glam & Gore: i'm gonna murder you  Many: oh cool,Manny Mua,MannyMua733
rE8-uXYbZXA,She looked like cara when she got them eyebrows,Manny Mua,MannyMua733
rE8-uXYbZXA,She looks like a corpse and i want that kind of skin im done with my tan skin y'all can have it,Manny Mua,MannyMua733
rE8-uXYbZXA,She's so pretty! But she looked better without the wig.,Manny Mua,MannyMua733
rE8-uXYbZXA,This is amazing,Manny Mua,MannyMua733
rE8-uXYbZXA,she looks like an albino dude without make up sorry but no  lol,Manny Mua,MannyMua733
rE8-uXYbZXA,literally the same reason why i have HALF of an eyebrow too LOL,Manny Mua,MannyMua733
rE8-uXYbZXA,She looks like a young Adelle or a Mary Kate,Manny Mua,MannyMua733
rE8-uXYbZXA,Wow that's a look sorry not sorry she looks great but DAT hair tho,Manny Mua,MannyMua733
rE8-uXYbZXA,That's a look,Manny Mua,MannyMua733
rE8-uXYbZXA,I actually thought she was most beautiful just after contour and blusher. She looked ethereal AF.,Manny Mua,MannyMua733
rE8-uXYbZXA,Holy shit girll...... She is SO PRETTY,Manny Mua,MannyMua733
rE8-uXYbZXA,She reminds me of Elizabeth Olsen at the end ...ish,Manny Mua,MannyMua733
rE8-uXYbZXA,i love this,Manny Mua,MannyMua733
rE8-uXYbZXA,I love that she's as pale as me,Manny Mua,MannyMua733
rE8-uXYbZXA,Manny and Mykie are Glam n Gore,Manny Mua,MannyMua733
rE8-uXYbZXA,holy shit she is stunning you did a great job! love both of you,Manny Mua,MannyMua733
rE8-uXYbZXA,W were goingr on a,Manny Mua,MannyMua733
rE8-uXYbZXA,I noticed glam & gore has on her teeth or faux gems. I forgot about that trend!,Manny Mua,MannyMua733
rE8-uXYbZXA,What bronzer/contour did you use? Love you !,Manny Mua,MannyMua733
rE8-uXYbZXA,Omg who is she,Manny Mua,MannyMua733
rE8-uXYbZXA,Jesus FUCK she is so cute,Manny Mua,MannyMua733
rE8-uXYbZXA,Just feel the brows wouldn't look so clownish in a lighter shade matching closer to her hair color. I'm a blonde with blonde eyebrows. It exists.,Manny Mua,MannyMua733
rE8-uXYbZXA,Is she an OCA2 Albino? because apart from eye color it's exactly what I have to deal with... "porcelain is never what it says..." PREACH!,Manny Mua,MannyMua733
rE8-uXYbZXA,Just a question what's the wisdom behind using very expensive and high end foundation brand with 1$ morphe sponge ? and you all splash the morphe sponge with fix plus and fixing sprays to help the sponge do the blending and u think people won't notice woww,Manny Mua,MannyMua733
rE8-uXYbZXA,Oml  I live in San Diego @-@,Manny Mua,MannyMua733
rE8-uXYbZXA,SHE IS SO CUTE,Manny Mua,MannyMua733
rE8-uXYbZXA,Honestly  I feel like if Mykie ever needed to hide at a convention or something  it'd be really hard to find her. She looks different in every single look  its so stunning to watch,Manny Mua,MannyMua733
rE8-uXYbZXA,Anybody else realize Mykie has the blondest eyelashes ever??,Manny Mua,MannyMua733
rE8-uXYbZXA,She looks scary without makeup,Manny Mua,MannyMua733
rE8-uXYbZXA,Woooow,Manny Mua,MannyMua733
rE8-uXYbZXA,awww these two are such a pure and genuine youtube friendship. i love them both,Manny Mua,MannyMua733
rE8-uXYbZXA,Once Mykie put in that wig  the whole thing came together with the jacket  lips  brows  her nose- I realized  this look make Mykie look like Madonna!,Manny Mua,MannyMua733
rE8-uXYbZXA,Okey  I love that makeup BUT HER JACKET!!! I LOVE IT,Manny Mua,MannyMua733
rE8-uXYbZXA,I so wish you could do my makeup for my wedding.,Manny Mua,MannyMua733
rE8-uXYbZXA,She`s the most lovely person I've seen in my lifeeeeee  she seems so nice haha,Manny Mua,MannyMua733
rE8-uXYbZXA,Dang manny should win an oscar for those brows!!!,Manny Mua,MannyMua733
rE8-uXYbZXA,SHES CUTE. YOU DID AN EXELLENT JOB!!!,Manny Mua,MannyMua733
rE8-uXYbZXA,Mykie is so genuine,Manny Mua,MannyMua733
rE8-uXYbZXA,What happened to her eyebrow?,Manny Mua,MannyMua733
rE8-uXYbZXA,My dental hygienist said that you can brush your teeth and then eat. It's just about getting the plaque off your teeth.,Manny Mua,MannyMua733
rE8-uXYbZXA,Better,Manny Mua,MannyMua733
rE8-uXYbZXA,i adore Mikie,Manny Mua,MannyMua733
rE8-uXYbZXA,I love mykie so much!,Manny Mua,MannyMua733
rE8-uXYbZXA,Very Mary-Kate when she was young and fresh and healthy!!!,Manny Mua,MannyMua733
rE8-uXYbZXA,You and ThunThun Skittles should collab,Manny Mua,MannyMua733
rE8-uXYbZXA,Can you glam Molly Burke next,Manny Mua,MannyMua733
rE8-uXYbZXA,This is the Many I love. The one that isn't trying super hard to be trash like the other people he hangs out with.,Manny Mua,MannyMua733
rE8-uXYbZXA,It's weird but I feel like she's giving off Fergie vibes??,Manny Mua,MannyMua733
d5kFaKRqPvQ,Who actually bought the collection before seeing my review.... be honest! lol,Manny Mua,MannyMua733
d5kFaKRqPvQ,Where are the holo sexuals!!!!!,Manny Mua,MannyMua733
d5kFaKRqPvQ,when he drops it hahahah I had to repeat so many times cause ded!,Manny Mua,MannyMua733
d5kFaKRqPvQ,I think the name of the looks should be the evil twin and the good twin if you actually think of it,Manny Mua,MannyMua733
d5kFaKRqPvQ,I liked it.  THE HIGHLIGHT HAS SPOKEN,Manny Mua,MannyMua733
d5kFaKRqPvQ,Can someone please compare Rad to Doll,Manny Mua,MannyMua733
d5kFaKRqPvQ,Those lips got me SHOOK. What a queen,Manny Mua,MannyMua733
d5kFaKRqPvQ,Manny you're literally the only reason I made a YouTube account so I could subscribe to your videos! You're amazing  by far my fave YouTuber,Manny Mua,MannyMua733
d5kFaKRqPvQ,Definitely wouldn't expect a make up collection with Kourtney. The rest I get  but Kourtney doesn't seem to do much of anything. Maybe that's just me.,Manny Mua,MannyMua733
d5kFaKRqPvQ,Love that nude lippie,Manny Mua,MannyMua733
d5kFaKRqPvQ,Manny!! What gloss/lip are you wearing?,Manny Mua,MannyMua733
d5kFaKRqPvQ,u talk and sound like a fucking pussy!,Manny Mua,MannyMua733
d5kFaKRqPvQ,Hey Manny Im really confused about how you should put on lipstick somepeople make like kind of wings and some dont help :),Manny Mua,MannyMua733
d5kFaKRqPvQ,You complain too much,Manny Mua,MannyMua733
d5kFaKRqPvQ,the blue one is amazing I'm wearing it rn in love,Manny Mua,MannyMua733
d5kFaKRqPvQ,I wouldn't spend 24 dollars on any of them cause like you said unless you have other palettes you won't be able to create that many looks at all.,Manny Mua,MannyMua733
d5kFaKRqPvQ,i like the blue palette the most... also your highlight is poppin,Manny Mua,MannyMua733
d5kFaKRqPvQ,that Nudie Patootie shout out - I CRY i love friendship,Manny Mua,MannyMua733
d5kFaKRqPvQ,Lmaoooooo yes!!!!!!! Your fucken hilarious I love you,Manny Mua,MannyMua733
d5kFaKRqPvQ,DO NOT LIKE ANYTHING,Manny Mua,MannyMua733
d5kFaKRqPvQ,DO NOT LIKE ANYTHING OF THEM SORRY,Manny Mua,MannyMua733
d5kFaKRqPvQ,Manny is out here acting like people are gonna spend $24 for a four shade palette of inner corner highlights LOL,Manny Mua,MannyMua733
d5kFaKRqPvQ,WHY ARE THEY SO DULL,Manny Mua,MannyMua733
d5kFaKRqPvQ,This packaging is NOTHING like kourtneys style it's like she let her kids design them..,Manny Mua,MannyMua733
d5kFaKRqPvQ,You couldn't even see the first set of swatches hahaha no thanks,Manny Mua,MannyMua733
d5kFaKRqPvQ,Agree that I wish it was all one palette,Manny Mua,MannyMua733
d5kFaKRqPvQ,Looks to me like it's the Naughty and Nice palettes but just repackaged,Manny Mua,MannyMua733
d5kFaKRqPvQ,I feel like Kourtney created each one based on her kids. 2 boys and 1 girl. That's probably why the packaging looks so kid-like.,Manny Mua,MannyMua733
d5kFaKRqPvQ,Hunni  went a head and clicked like!,Manny Mua,MannyMua733
d5kFaKRqPvQ,Is it me or does the red shade look pink..?,Manny Mua,MannyMua733
d5kFaKRqPvQ,Packaging B***** Hilarious!!,Manny Mua,MannyMua733
d5kFaKRqPvQ,so bitch  if they are magnetic  move the shadows around! put them were you want them  even in a different pallet,Manny Mua,MannyMua733
d5kFaKRqPvQ,u look really pop punk with this make up lol,Manny Mua,MannyMua733
d5kFaKRqPvQ,"Swatchability"....,Manny Mua,MannyMua733
d5kFaKRqPvQ,Bruh I'm a dancer and it's so hard to find a proper red eye shadow. Guess who wants that palette now.,Manny Mua,MannyMua733
d5kFaKRqPvQ,I  really enjoy your channel however  your language lately is too much. Constant use of the "f" word is getting aggravating. Please consider calming it down a bit? Makes you sound trashy..jus' sayin sweetie. Sorry just an observation.,Manny Mua,MannyMua733
d5kFaKRqPvQ,lmao the part when u show the eyeshadow aka HIGHLIGHT pallette an thought u busted it omg...thats pretty cool its magnetic but i agree kinda kiddyy,Manny Mua,MannyMua733
d5kFaKRqPvQ,I know that you have a new editor  but doesn't anyone else hate how choppy it is?! I feel like the little bits that are cut out make me nauseous  it seems so jerky and doesn't flow naturally at all,Manny Mua,MannyMua733
d5kFaKRqPvQ,Did anyone else think that Manny kinda looked like the mas hatter with that makeup? No? Just me? Okay.,Manny Mua,MannyMua733
d5kFaKRqPvQ,Your entire theatrical show putting on the lippies I died,Manny Mua,MannyMua733
d5kFaKRqPvQ,THE LIPSTICKS ARE SO FUCKING GORG,Manny Mua,MannyMua733
d5kFaKRqPvQ,i love love LOVE how he always does different eye looks when testing out new products so we can get an idea for how the product works as a whole and not just a few shades,Manny Mua,MannyMua733
d5kFaKRqPvQ,Why does the sound keep doing that??!!,Manny Mua,MannyMua733
d5kFaKRqPvQ,film a video of you doing a look with laura's palette!!! (:,Manny Mua,MannyMua733
d5kFaKRqPvQ,Liking because of the title,Manny Mua,MannyMua733
d5kFaKRqPvQ,fucking finally someone has done some finger swatches and used more than the yellow and brown palette! yes!,Manny Mua,MannyMua733
d5kFaKRqPvQ,I FUCKING LOVE YOU MANNY!!!! LOL,Manny Mua,MannyMua733
d5kFaKRqPvQ,The kourt makeup is sold all out,Manny Mua,MannyMua733
