videoId,comment,channelId,channelName
YqyTocwvDfk,but with some REALLY extravagant lashes this would look like some krazy rocker/punk makeup.,Manny Mua,MannyMua733
YqyTocwvDfk,A piece of my heart just died watching Joey dig into the pans like that,Manny Mua,MannyMua733
YqyTocwvDfk,That alarm gives me anxiety... ugh i HATE it,Manny Mua,MannyMua733
YqyTocwvDfk,Gorgeous,Manny Mua,MannyMua733
YqyTocwvDfk,I love how Manny is so patient with Joey  such a good baby sitter <3,Manny Mua,MannyMua733
YqyTocwvDfk,This is so messy i'm dying ahahaha,Manny Mua,MannyMua733
YqyTocwvDfk,Do a makeover for Joey!,Manny Mua,MannyMua733
YqyTocwvDfk,Joey: "Like  you kind of look like a superhero" Manny's reaction: Wtf did you do to me,Manny Mua,MannyMua733
YqyTocwvDfk,It kinda broke my heart when he went in on the Metal Crush palette D:,Manny Mua,MannyMua733
YqyTocwvDfk,that disrespect for the makeup actually hurts me. . that's expensive stuff,Manny Mua,MannyMua733
YqyTocwvDfk,Joey pisses me off in this video,Manny Mua,MannyMua733
YqyTocwvDfk,Manny's so forgiving TT__TT My blood was boiling and I kinda died a bit omg,Manny Mua,MannyMua733
gtT59yQ6qYI,Love it!,Manny Mua,MannyMua733
gtT59yQ6qYI,Manny my muffin...   I am addicted to your videos. You are divine. You could pick up a stick from your yard and say buy it cuz it is the shit and I would use your code and buy it ! I love you boo!,Manny Mua,MannyMua733
gtT59yQ6qYI,Im new to alot of beauty gurus  but when I cant sleep Manny is one that makes me laugh an I relax.,Manny Mua,MannyMua733
gtT59yQ6qYI,Why the heck is the naked heat so expensive! It seems overpriced to me. Does anyone agree,Manny Mua,MannyMua733
gtT59yQ6qYI,Omg! Loved the look! And the lil doggy at the end  what a lil fluff ball  so so adorable!,Manny Mua,MannyMua733
gtT59yQ6qYI,man  i wish i had oily skin. dry skin is terrible because the dryness peaks thru everything. dewy foundations don't work. help.,Manny Mua,MannyMua733
gtT59yQ6qYI,I'm so late to the party but god damn this is probably my favorite look of all the 485 videos I've watched of yours today. You're awesome.,Manny Mua,MannyMua733
gtT59yQ6qYI,Let's be real  Zaya is the real star of this show.,Manny Mua,MannyMua733
gtT59yQ6qYI,I love these fun looks you come up with! Looking good!,Manny Mua,MannyMua733
gtT59yQ6qYI,Mann's dog is SO CUTE AND FLUFFY!!! why  is it so adorable?!!!,Manny Mua,MannyMua733
gtT59yQ6qYI,I'm loving your pup!,Manny Mua,MannyMua733
gtT59yQ6qYI,I love love how you put your make-up on and I love watching your videos,Manny Mua,MannyMua733
gtT59yQ6qYI,I wanna wear this look every day,Manny Mua,MannyMua733
gtT59yQ6qYI,Can you please test Too Faced Best year ever palette,Manny Mua,MannyMua733
gtT59yQ6qYI,I fucking love love this makeup look Manny! Be-a-u-tiful!,Manny Mua,MannyMua733
gtT59yQ6qYI,YOUR DOG IS THE CUTEST TEDDY BEAR IVE EVER SEEN,Manny Mua,MannyMua733
gtT59yQ6qYI,OMG I am so glad to see a good review on the Naked Heat palette! I just ordered one for my daughter for the Holidays!,Manny Mua,MannyMua733
gtT59yQ6qYI,You literally have the most precious puppy ever!!,Manny Mua,MannyMua733
gtT59yQ6qYI,That dog is like a teddy bear!!! Cuteness over 9000!!!,Manny Mua,MannyMua733
gtT59yQ6qYI,Love this look manny!,Manny Mua,MannyMua733
gtT59yQ6qYI,Bomb as usual,Manny Mua,MannyMua733
gtT59yQ6qYI,I loveeeeee my heat pallette!,Manny Mua,MannyMua733
gtT59yQ6qYI,Hey brands that don wanna sponsee manny! Too bad for you I get ^babes advice on what to buy first! And also  wgaf that you got brushes for free? When I worked in healthcare I got vaccinated and gloves for free? lol it's your job  people seriously need to look for better tea!,Manny Mua,MannyMua733
gtT59yQ6qYI,OMG THIS VIDEO IS SOOOOOOO PIGMENTED,Manny Mua,MannyMua733
gtT59yQ6qYI,Your so perfect <3,Manny Mua,MannyMua733
gtT59yQ6qYI,I recently discovered your channel and I have to say I LOVE YOU! you are so honest and just natural at this... by far my favorite YT MUA...,Manny Mua,MannyMua733
gtT59yQ6qYI,I FUCKING LOVE YOU,Manny Mua,MannyMua733
gtT59yQ6qYI,Get out of that nude box  boy! lol.,Manny Mua,MannyMua733
gtT59yQ6qYI,your dog is the cutest thing alive.. after you of course :*,Manny Mua,MannyMua733
gtT59yQ6qYI,Yass slay,Manny Mua,MannyMua733
gtT59yQ6qYI,Wellllll it makes sense if your representing a brand it's only normal not to pay for product . If u were to say that u have to pay i would think that's so bizarre .. people need to calm down and invest into a hobby .. haters !,Manny Mua,MannyMua733
gtT59yQ6qYI,Anyone know the brush he uses to set his undereyes???,Manny Mua,MannyMua733
gtT59yQ6qYI,New subscriber! I love your BLOOPERS....freakin hilarious!!!,Manny Mua,MannyMua733
gtT59yQ6qYI,"Oh bitch I am feeling myself in this lip" was easily the best line lol,Manny Mua,MannyMua733
gtT59yQ6qYI,Anyone else start singing Lion Heart by SNSD??,Manny Mua,MannyMua733
gtT59yQ6qYI,I want that freaking colorful morphe palette every time I try to get it it's always sold out and I want it so bad,Manny Mua,MannyMua733
gtT59yQ6qYI,Zeya is the cutest little angel!,Manny Mua,MannyMua733
gtT59yQ6qYI,Omg I love you and your dog is cute as HELL,Manny Mua,MannyMua733
gtT59yQ6qYI,Love the eyes look and your dog!!,Manny Mua,MannyMua733
gtT59yQ6qYI,I LOVE THIS LOOK LATTERLY MY FAV,Manny Mua,MannyMua733
gtT59yQ6qYI,Omg! Freaking beautiful,Manny Mua,MannyMua733
gtT59yQ6qYI,Omg I love your videos so much manny side note your little pupper is supper adorable it's like a little brown cute bear. And his little bark. Makes me melt so much. But anyways your look today was supper inspiring to try to add a pop of color into my eye shadows I usually don't do that with my makeup.,Manny Mua,MannyMua733
gtT59yQ6qYI,Zayah is soooooo cute that little bark at the end nawww,Manny Mua,MannyMua733
gtT59yQ6qYI,Why would anyone care if the brushes were bought bs given? Seems a silly thing to get caught up on..,Manny Mua,MannyMua733
gtT59yQ6qYI,OMG cutest dog ever,Manny Mua,MannyMua733
gtT59yQ6qYI,passive aggressive much....,Manny Mua,MannyMua733
gtT59yQ6qYI,I love many and all but you say you want to be honest about there products but when you actually get sponsored you only say the good things about it.. legit when ever you're sponsored you do that,Manny Mua,MannyMua733
gtT59yQ6qYI,You are such a beautiful person.,Manny Mua,MannyMua733
gtT59yQ6qYI,I'm on morphine right now cuz I am sick so I decided to watch you lol love you manny,Manny Mua,MannyMua733
gtT59yQ6qYI,Which palette is best? ABH Modern Renaissance  VV holy grail or the UD heat palette??,Manny Mua,MannyMua733
gtT59yQ6qYI,Love you!!,Manny Mua,MannyMua733
gtT59yQ6qYI,Im dying for this look ugh I cant even!!! Fuck!!!!,Manny Mua,MannyMua733
vICJMS2PrHc,I'm shocked about the mascara  it stays up to 3 days without ruining my face or eyes  even with tears it doesn't move at all,Manny Mua,MannyMua733
vICJMS2PrHc,Luv u and ur videos,Manny Mua,MannyMua733
vICJMS2PrHc,I bought the white peach palette for the smell :P I'm so weird.,Manny Mua,MannyMua733
vICJMS2PrHc,I love my Nars Leguna bronzer BUT the outer layer of the product has a weird film so you don't start getting pigment until you've really dug in,Manny Mua,MannyMua733
vICJMS2PrHc,DONDE ESTAAAAA???? hahahahahaha I fucking died,Manny Mua,MannyMua733
vICJMS2PrHc,I love you,Manny Mua,MannyMua733
vICJMS2PrHc,Hottie,Manny Mua,MannyMua733
vICJMS2PrHc,Manny: *thinks about saying the word death* OMG SO DARK,Manny Mua,MannyMua733
vICJMS2PrHc,A little light baby,Manny Mua,MannyMua733
vICJMS2PrHc,Trouble by ABH is actually one of my favorite lipsticks! I also have Veronica and Trust Issues,Manny Mua,MannyMua733
vICJMS2PrHc,The way that the bronzer works  is if swirl your brush on the bronzer the less you get. To get more product follow the way of the divots! :),Manny Mua,MannyMua733
vICJMS2PrHc,Yes loved it!! Love your videos  you're so fun to watch!!,Manny Mua,MannyMua733
vICJMS2PrHc,rachloves started it,Manny Mua,MannyMua733
vICJMS2PrHc,for sure thought you were gonna say "den of dick" in the intro,Manny Mua,MannyMua733
vICJMS2PrHc,I f*cking love youu <3 I legit made a laptop sticker of your eye :) You are amazing and my idol/makeup guru/favourite bad bish/my fav friend... not to be creep I just wanted ya to know girlllll :)))),Manny Mua,MannyMua733
vICJMS2PrHc,I have the white peach palette and that mascara  I like them both.,Manny Mua,MannyMua733
vICJMS2PrHc,if you dont like me then dont freakin watch this video !! love him,Manny Mua,MannyMua733
vICJMS2PrHc,I wish he would have read some of the reviews instead of just saying idk why they are rated this low,Manny Mua,MannyMua733
vICJMS2PrHc,Drink every time he says actually,Manny Mua,MannyMua733
vICJMS2PrHc,Every single one of these products have a higher rating that my high school,Manny Mua,MannyMua733
vICJMS2PrHc,The cover Fx spray - you just need to pour it out in a cup and let the shimmer simmer down then just put it back in the bottle. I got it in my boxycharm box.,Manny Mua,MannyMua733
vICJMS2PrHc,This video was amazing. Yass Please do a lowest rated for ulta. I would love to see!,Manny Mua,MannyMua733
vICJMS2PrHc,i was hoping he would read a few reviews of each one  then say how he feels about the product(s) if he agrees or not,Manny Mua,MannyMua733
vICJMS2PrHc,Manny you are such a QUEEN <3 omgggg,Manny Mua,MannyMua733
vICJMS2PrHc,Sophie Louise started it x,Manny Mua,MannyMua733
vICJMS2PrHc,So many giggles in here that made me giggle :D  Thank you ... I need many giggles today <3,Manny Mua,MannyMua733
vICJMS2PrHc,i lost count on how many times he says "not gonna lie",Manny Mua,MannyMua733
vICJMS2PrHc,I swear shaaanxo started this trend,Manny Mua,MannyMua733
vICJMS2PrHc,i got the Bad Gal Bang mascara and i feel the same way. i separated my lashes rly well and made them look fairly good but it takes FOREVER to dry and sometimes spreads onto my lid,Manny Mua,MannyMua733
vICJMS2PrHc,tell me why I laughed your whole video  this was so entertaining to watch! The lip color and your bottom lashes I actually live for,Manny Mua,MannyMua733
vICJMS2PrHc,omg i used sash box and haaaaaated it!!!! it dried my under eye out sooo bad,Manny Mua,MannyMua733
vICJMS2PrHc,Manny ur so funny! I love watching ur videos.,Manny Mua,MannyMua733
vICJMS2PrHc,God I love you!!,Manny Mua,MannyMua733
vICJMS2PrHc,i think  rachhhloves  started it,Manny Mua,MannyMua733
vICJMS2PrHc,The cover fx would be perfect for theatre since they always sprinkle glitter all over us!!,Manny Mua,MannyMua733
vICJMS2PrHc,can you post some tips on how you keep matte liquid lip from drying out your lips / if you use any other products on your lips like exfoliators n such,Manny Mua,MannyMua733
vICJMS2PrHc,I personally really enjoy the benefit bad gal mascara and I was pretty shocked that it had such a low rating.,Manny Mua,MannyMua733
vICJMS2PrHc,Hahahahahahahahaha I love u so much!!,Manny Mua,MannyMua733
vICJMS2PrHc,I hate the bad gal bang mascara. Made my lashes clumpy as fuck.,Manny Mua,MannyMua733
vICJMS2PrHc,What brush did you use for the bronzer ?,Manny Mua,MannyMua733
vICJMS2PrHc,You can make things work... but not for that price tag!,Manny Mua,MannyMua733
vICJMS2PrHc,The thumbnail is meeeeeeeee,Manny Mua,MannyMua733
vICJMS2PrHc,1. You look gorgeous regardless of those product's ratings you made it work 2. I really would love to see you do Ulta  but you seemed so downtrodden by the end of this video trying out these products that don't work well.  So only do it if you really feel up to having products that don't apply/work as well on your face.,Manny Mua,MannyMua733
vICJMS2PrHc,Yaaaasssss!!!!! Do an Ulta version!!!,Manny Mua,MannyMua733
vICJMS2PrHc,But did the lashes dry??,Manny Mua,MannyMua733
vICJMS2PrHc,You still looked good in the end lol,Manny Mua,MannyMua733
vICJMS2PrHc,i loved the lips!,Manny Mua,MannyMua733
vICJMS2PrHc,The mascara u used in this video is my FAVE! It makes my lashes look like falsies  it's amazing!,Manny Mua,MannyMua733
vICJMS2PrHc,this is every time I do my make up,Manny Mua,MannyMua733
vICJMS2PrHc,I could never figure out how to use the makeup forever powder  but it was on sale when I got it,Manny Mua,MannyMua733
vICJMS2PrHc,Had to restart the video cuz I missed the giggle lol,Manny Mua,MannyMua733
vICJMS2PrHc,You should do a lowest rated Amazon make up,Manny Mua,MannyMua733
vICJMS2PrHc,I believe Rachloves started these kinds of videos.,Manny Mua,MannyMua733
vICJMS2PrHc,Lol Donde esta,Manny Mua,MannyMua733
vICJMS2PrHc,I really appreciate you trying the nars bronzer and white peach palette. I thought they would do better so your review was very helpful. Even though you used products that didn't perform well  you still look very cute! Thank you!,Manny Mua,MannyMua733
vICJMS2PrHc,You should do a full face of Neutrogena makeup.,Manny Mua,MannyMua733
vICJMS2PrHc,"who doesn't want full coVERAGE cOmE oNnNnN",Manny Mua,MannyMua733
vICJMS2PrHc,the eye shadow looks soft and feminine  which you on't really do.. you like bold colours,Manny Mua,MannyMua733
vICJMS2PrHc,im manny mua and i love water.,Manny Mua,MannyMua733
vICJMS2PrHc,@rachhloves i believe started this,Manny Mua,MannyMua733
vICJMS2PrHc,That liquid lipstick is my favorite color. Yaasss,Manny Mua,MannyMua733
vICJMS2PrHc,I just think the too faced palette is designed to be more natural. Not everyone wants to blind,Manny Mua,MannyMua733
vICJMS2PrHc,Zeadassssd,Manny Mua,MannyMua733
WdAiDKSva3U,WHY WAS THIS SO FUN! I love challenge videos! Which should I do next.....?,Manny Mua,MannyMua733
WdAiDKSva3U,manny x shane thatll come for our NECKS,Manny Mua,MannyMua733
WdAiDKSva3U,Yaaaaas you need shane,Manny Mua,MannyMua733
WdAiDKSva3U,If you are going to do it differently  at least choose the first one that google shows you. If not  what is the purpose of the 'challenge'  if you choose what is right for you?,Manny Mua,MannyMua733
WdAiDKSva3U,you talked fast af in this video jdfhlkasdjfhliqwehf lol,Manny Mua,MannyMua733
WdAiDKSva3U,whats up with these like 3 minutes ADs ?????,Manny Mua,MannyMua733
WdAiDKSva3U,you shoudve bought the essence mascara,Manny Mua,MannyMua733
WdAiDKSva3U,Yes!!!!!! Please do a Shane Callab!,Manny Mua,MannyMua733
WdAiDKSva3U,Anyone else google the items and find so etching different ?? Lol,Manny Mua,MannyMua733
WdAiDKSva3U,Do a dollar store makeup challenge.,Manny Mua,MannyMua733
WdAiDKSva3U,Manny AND Shane?!???? YESSS PLEASEEEE!!!,Manny Mua,MannyMua733
WdAiDKSva3U,Omg! When you said "OK Google" my phone stopped the video and my Google Assistant came on! Lol!,Manny Mua,MannyMua733
WdAiDKSva3U,FILM WITH SHANE,Manny Mua,MannyMua733
WdAiDKSva3U,DO A VIDEO WITH SHANE,Manny Mua,MannyMua733
WdAiDKSva3U,@shane,Manny Mua,MannyMua733
WdAiDKSva3U,"Just kidding  I like dick." sAME tHOUGH xD,Manny Mua,MannyMua733
WdAiDKSva3U,Yes u and Shane!,Manny Mua,MannyMua733
WdAiDKSva3U,Most expensive Google suggested full face,Manny Mua,MannyMua733
WdAiDKSva3U,omg do glossier review,Manny Mua,MannyMua733
WdAiDKSva3U,I fucking loveeee you,Manny Mua,MannyMua733
WdAiDKSva3U,SETTTTING SPRAY MANNNNYYYY,Manny Mua,MannyMua733
WdAiDKSva3U,I love your personality,Manny Mua,MannyMua733
WdAiDKSva3U,Who else thought manny was so fucking fun this video!? Like EXTRAAAAAA fun and I am LOVING IT!!!!!!!,Manny Mua,MannyMua733
WdAiDKSva3U,I swear I need Manny in my life!!!!! He cracks me up I love you so muchhh Manny!!!!!,Manny Mua,MannyMua733
WdAiDKSva3U,You NEED to do a video with Shane Dawson!!! It would be the best thing ever!,Manny Mua,MannyMua733
WdAiDKSva3U,SHANE DAWSON AND MANNY MUA YES.,Manny Mua,MannyMua733
WdAiDKSva3U,My Google on my phone opened up when you said okay google and I couldn't stop cracking up!!,Manny Mua,MannyMua733
WdAiDKSva3U,YES ! FILM WITH SHANE ! DO MAKEUP CONSPIRACIES !,Manny Mua,MannyMua733
WdAiDKSva3U,YASSSSSSSS SHANE AND YOU WOULD BE A GREAT VIDEOOOOO,Manny Mua,MannyMua733
WdAiDKSva3U,What about setting spray!!!!!!,Manny Mua,MannyMua733
WdAiDKSva3U,google is coming at me. i use hangover rx  fenty  shape tape. and then laura mercier.   lost me at bronzer tho,Manny Mua,MannyMua733
WdAiDKSva3U,You look skinny and cute in that shirt.,Manny Mua,MannyMua733
WdAiDKSva3U,Always warm eyes and nude lips.... I love but I know you're more than this.,Manny Mua,MannyMua733
WdAiDKSva3U,Manny if you get a skin tag again  tie it off with floss  it will shrivel and fall off and will hurt a hell of a lot less than goin in with nail clippers damn you bold,Manny Mua,MannyMua733
WdAiDKSva3U,When u said ok Google my Google app popped up,Manny Mua,MannyMua733
WdAiDKSva3U,Yesssss collab with Shane!!,Manny Mua,MannyMua733
WdAiDKSva3U,YOU SET MY GOOGLE HOME OFF,Manny Mua,MannyMua733
WdAiDKSva3U,oh please film with shane i might cry from joy,Manny Mua,MannyMua733
WdAiDKSva3U,F'n beautiful! (as always),Manny Mua,MannyMua733
WdAiDKSva3U,Manny honey  Google knows err'thing! ;),Manny Mua,MannyMua733
WdAiDKSva3U,Hey Manny. When is Baby Sleepy gonna film a video for us? Haven't seen her in ages.,Manny Mua,MannyMua733
WdAiDKSva3U,I NEEEEEEEEEEEEEEED YOU TO DO A VIDEO WITH SHANEE,Manny Mua,MannyMua733
WdAiDKSva3U,You are soooo funny. New subby here!,Manny Mua,MannyMua733
WdAiDKSva3U,YOU SHOUUUUULD FILM WITH SHAAAAANE!!!,Manny Mua,MannyMua733
WdAiDKSva3U,You're idea is better than nikkie's one,Manny Mua,MannyMua733
WdAiDKSva3U,When he said ok google my phone responded,Manny Mua,MannyMua733
WdAiDKSva3U,Manny I fucking loooooove this look on you!!!!! Also please collaborate with Shane I would cry tbh,Manny Mua,MannyMua733
WdAiDKSva3U,omg  every single time you said "ok google" my phone pulled up google siri uhhhhhhhh,Manny Mua,MannyMua733
WdAiDKSva3U,COLAB WITH SHANE PLEASE,Manny Mua,MannyMua733
WdAiDKSva3U,Manny & Shane conspiracy collab is honestly all I need in my life,Manny Mua,MannyMua733
WdAiDKSva3U,Mood,Manny Mua,MannyMua733
WdAiDKSva3U,you saying "okay google" made my phone turn on,Manny Mua,MannyMua733
WdAiDKSva3U,fala p caralhoooooooo,Manny Mua,MannyMua733
WdAiDKSva3U,Manny Mua oml haha and yea  Google takes what you've been searching in the past and saves it. That's why if you search up something like makeup  Instagram will show you more makeup ads. It's all connected DUN DUN DUN  THICK LIKE WHAT??,Manny Mua,MannyMua733
WdAiDKSva3U,YESSSSSSSSS. FILM WITH SHANE!,Manny Mua,MannyMua733
G4ye9KizXsM,SOooOoOOo PiGMentED!,Manny Mua,MannyMua733
G4ye9KizXsM,can you do a makeup eye shadow palette collection video?,Manny Mua,MannyMua733
G4ye9KizXsM,sexy bitch!,Manny Mua,MannyMua733
G4ye9KizXsM,MANNY STRAIGHT UP has the best intro  the sounds are so satisfying,Manny Mua,MannyMua733
G4ye9KizXsM,Loooved this look!!,Manny Mua,MannyMua733
G4ye9KizXsM,This look reminds me of a worn down carnaval or smt,Manny Mua,MannyMua733
G4ye9KizXsM,i have identical colors from coastal scents the hot pots and theyre more blendable and pigmented without the powdery mess  and each shadow was 99 cents,Manny Mua,MannyMua733
G4ye9KizXsM,I love the colours but I think the quality could have been a bit better,Manny Mua,MannyMua733
G4ye9KizXsM,It looks great on but  the fall out I just don't think it would be for me lol. Pretty but it's way powdery,Manny Mua,MannyMua733
G4ye9KizXsM,Don't call yourself a makeup artist if you don't know how to work with shadows like those. First of all you are using wrong brushes to pick up the product that's why yoh have way too much kick back.  And why the  colors start to get muddy? Because green and red mixing together is Brown.  DO NOT USE BLENDING BRUSH FOR EVERY SINGLE THING! That's so wrong,Manny Mua,MannyMua733
G4ye9KizXsM,I am OBSESSED w/ this eye look!!!,Manny Mua,MannyMua733
G4ye9KizXsM,Please do urban decay heavy metals review!!!!,Manny Mua,MannyMua733
G4ye9KizXsM,I'm actually living for this eye look,Manny Mua,MannyMua733
G4ye9KizXsM,this eye look tho.. living for it,Manny Mua,MannyMua733
G4ye9KizXsM,Oh idk because it OXIDIZES like Alyssa said they do! So I have a question. If Kylie did this would you have been this kind? HELL NO! My point is made. Makeup Gurus go in on Kylie extra hard for Clout. Because her name carries that much weight. Why fear ABH? Alyssa did her job. Truly. Period. She was here for the people. And the people should have her back.,Manny Mua,MannyMua733
G4ye9KizXsM,love you!! but you kinda mumble a lot!! not trying to be hateful :),Manny Mua,MannyMua733
G4ye9KizXsM,Bloopers! Xxx,Manny Mua,MannyMua733
G4ye9KizXsM,Hey manny whats the deal with the cresent moon necklace jw cause i have noticed u wear it in every single video so i didnt know if theres a special meaning to the necklace ?,Manny Mua,MannyMua733
G4ye9KizXsM,Honestly this palette is weird. I just bought it and I'm obsessed I'm pretty sure they redid cuz mine is perfect. But I have a friend who's is terrible. The pigment is freaking amazing and I'm living for the colours,Manny Mua,MannyMua733
G4ye9KizXsM,despite the fact that you didn't like the palette all that much  I LOVE the way the look came out! Oh my god so pretty,Manny Mua,MannyMua733
G4ye9KizXsM,I haven't really watched you for a while but I have watched so many of your videos but this is one of my most favorite eye looks I've seen you done out of the videos I have watched,Manny Mua,MannyMua733
G4ye9KizXsM,At least you are staying truthful even though you got It in PR I respect that,Manny Mua,MannyMua733
G4ye9KizXsM,it really shows that its hard to blend,Manny Mua,MannyMua733
G4ye9KizXsM,Loving that look on your eyes!,Manny Mua,MannyMua733
G4ye9KizXsM,Omg i love you sm <3,Manny Mua,MannyMua733
G4ye9KizXsM,ok but u made it look bomb,Manny Mua,MannyMua733
G4ye9KizXsM,When he giggles I giggle.,Manny Mua,MannyMua733
G4ye9KizXsM,swirls brush in shadow 12xs  complains about fallout ...,Manny Mua,MannyMua733
G4ye9KizXsM,Does nobody know that they're pure pigments. And all you have to do is touch them once? I'm not even a makeup artist and I know that.,Manny Mua,MannyMua733
G4ye9KizXsM,You should get dupes of these colors that you like and do the look you were actually trying to do lol,Manny Mua,MannyMua733
G4ye9KizXsM,omg I hate this palette  this is the worst lolol,Manny Mua,MannyMua733
G4ye9KizXsM,I love this look!!!,Manny Mua,MannyMua733
G4ye9KizXsM,Can you do a miinachi cosmetics review I have been seeing it all over Instagram,Manny Mua,MannyMua733
G4ye9KizXsM,*Pigmented*,Manny Mua,MannyMua733
G4ye9KizXsM,Love you! Ur personality rocks!,Manny Mua,MannyMua733
G4ye9KizXsM,So pretty but looked really hard to accomplish,Manny Mua,MannyMua733
G4ye9KizXsM,Its good to be open and very honest about your review because if we're going to spend our hard earned money on a high end eyeshadow palette. It should be worth the money. Thank u,Manny Mua,MannyMua733
G4ye9KizXsM,I loved their first pallet not this one tho,Manny Mua,MannyMua733
G4ye9KizXsM,Sell me your used make up. I'm broke,Manny Mua,MannyMua733
G4ye9KizXsM,Same,Manny Mua,MannyMua733
G4ye9KizXsM,his eyes r so beautiful,Manny Mua,MannyMua733
G4ye9KizXsM,This palette scares me a little but I loveeeee all of the other ABH palettes,Manny Mua,MannyMua733
G4ye9KizXsM,"BUT MANNY MUC MERCH" in description  LOVE YOU MANNY,Manny Mua,MannyMua733
G4ye9KizXsM,Stress because of the reviews but the colours are so gorgeous,Manny Mua,MannyMua733
G4ye9KizXsM,it makes sense that the colors would be blending together weirdly- you're using two complimentary colors. When red and green mix together  they always make grey..,Manny Mua,MannyMua733
G4ye9KizXsM,I personally thought this look was very beautiful and unique. I think he did an amazing job working around the kinks with this palette. It turned out lovely and I actually think I want to try it out myself.,Manny Mua,MannyMua733
G4ye9KizXsM,My first Manny Mua video and i sub'd of course. you are so adorbs,Manny Mua,MannyMua733
G4ye9KizXsM,Personally  I don't like how this ended up looking. I definitely think Manny could have done a way better job with different colours. I've seen him do looks similar to this before  but with different palettes and colours. I just don't like how the eyes ended up looking with the colour scheme. But it is a review  so of course it's not going to look the best if the product doesn't pull through.,Manny Mua,MannyMua733
G4ye9KizXsM,I'm pretty obsessed with the look you came up with though!,Manny Mua,MannyMua733
G4ye9KizXsM,Your look here reminds me of a sunset over the ocean.,Manny Mua,MannyMua733
G4ye9KizXsM,Foundation is definitely not a match,Manny Mua,MannyMua733
G4ye9KizXsM,I fucking love you Manny!,Manny Mua,MannyMua733
G4ye9KizXsM,I love this eye look.,Manny Mua,MannyMua733
G4ye9KizXsM,Do more makeup like this!!,Manny Mua,MannyMua733
G4ye9KizXsM,what if brands mae bad products on purpose so famous youtubers would have to buy it to review it,Manny Mua,MannyMua733
G4ye9KizXsM,Definitely a lot of fall out but I love the colors,Manny Mua,MannyMua733
G4ye9KizXsM,Damn! Like I just do my crease and it covers my whole eyelid... Manny uve got beautiful eyelids,Manny Mua,MannyMua733
G4ye9KizXsM,so is the modern renaissance pallet the summer pallet  this one the fall pallet  and the prism pallet the winter pallet?,Manny Mua,MannyMua733
G4ye9KizXsM,I LOVE IT! it looks like a mothafucking sunset!,Manny Mua,MannyMua733
G4ye9KizXsM,I really love the colors you chose. Looks beautiful,Manny Mua,MannyMua733
G4ye9KizXsM,Manny I don't want to annoy you but the foundation is a little bit too tan,Manny Mua,MannyMua733
G4ye9KizXsM,i cant believe you insinuated that ABH copied jeffreye's palette  thats kind of insulting,Manny Mua,MannyMua733
G4ye9KizXsM,IT: *giggles* Manny: yeah *giggles*,Manny Mua,MannyMua733
G4ye9KizXsM,you are making me laugh so hard.,Manny Mua,MannyMua733
G4ye9KizXsM,sooo pigmented haha. seriously love the review though! love your videos x,Manny Mua,MannyMua733
G4ye9KizXsM,I think its so weird  because I have this palette and I fucking love it.,Manny Mua,MannyMua733
G4ye9KizXsM,Totally agree!!! Hard to blend.. but i did like the pallet,Manny Mua,MannyMua733
