videoId,comment,channelId,channelName
RZxCG6jArdM,Need a christine shane dawson collab,Manny Mua,MannyMua733
RZxCG6jArdM,Call Aquaman  one of his wales escaped outta Atlantis,Manny Mua,MannyMua733
RZxCG6jArdM,Who called her love? I couldn't hear what she said,Manny Mua,MannyMua733
RZxCG6jArdM,"I do tentical porn .. in Japan",Manny Mua,MannyMua733
RZxCG6jArdM,SHE'S SO CUTE!!!!,Manny Mua,MannyMua733
RZxCG6jArdM,I''m THAMZI - Creator of THAMZITV (Feb 12  2018). THANKS Manny for the inspiration. Check out my creation. Have only six videos so far - but that's all I need to "prove" that I'm a great YouTuber. Thanks.,Manny Mua,MannyMua733
RZxCG6jArdM,Who called her love,Manny Mua,MannyMua733
RZxCG6jArdM,Diversity collector lovely energy tuck file account physically river.,Manny Mua,MannyMua733
RZxCG6jArdM,She pretty,Manny Mua,MannyMua733
RZxCG6jArdM,I neeeeeed more blooper vids!!!!,Manny Mua,MannyMua733
RZxCG6jArdM,Her about to sneeze made me sneeze,Manny Mua,MannyMua733
RZxCG6jArdM,She cracks me up,Manny Mua,MannyMua733
RZxCG6jArdM,The funniest video I've ever seen! I'm cry laughing! Love to see you guys doing a video together! Love you Manny!,Manny Mua,MannyMua733
RZxCG6jArdM,I've literally watched this a thousand time. NEVER. GETS. OLD.,Manny Mua,MannyMua733
RZxCG6jArdM,ha ha funny A.F :D,Manny Mua,MannyMua733
RZxCG6jArdM,Aw I love her laugh :) it warms my heart,Manny Mua,MannyMua733
RZxCG6jArdM,Who was that gorgeous guy (besides Manny) who was on the screen!?!?,Manny Mua,MannyMua733
RZxCG6jArdM,omg they are such a good duo,Manny Mua,MannyMua733
RZxCG6jArdM,Omg what I would do to hangout with Mannyy omg & Laura!! It would be sooooo fun! Next video she should give you a makeover!!,Manny Mua,MannyMua733
RZxCG6jArdM,Can she do your makeup next?  It would be so cute!,Manny Mua,MannyMua733
RZxCG6jArdM,Christine singing Good Charlotte..GOLD!!!,Manny Mua,MannyMua733
RZxCG6jArdM,She is so cute!!,Manny Mua,MannyMua733
RZxCG6jArdM,I thought I was going to wake my brothers up with all my laughing. There still sleeping and thanks for a good laugh.,Manny Mua,MannyMua733
RZxCG6jArdM,You two are my fucking favourite together! Please do more videos! You guys remind me of my best friend and I. Love it!!,Manny Mua,MannyMua733
RZxCG6jArdM,Ive watched this so many times i know every word in this exactly,Manny Mua,MannyMua733
RZxCG6jArdM,Never watched this chick before and this instantly made me love her!,Manny Mua,MannyMua733
RZxCG6jArdM,do you do pubes too?,Manny Mua,MannyMua733
RZxCG6jArdM,Where is her jawline?,Manny Mua,MannyMua733
RZxCG6jArdM,Absolutely love this.,Manny Mua,MannyMua733
RZxCG6jArdM,I want to see another collab,Manny Mua,MannyMua733
RZxCG6jArdM,more please,Manny Mua,MannyMua733
RZxCG6jArdM,Wuhahahahahahahahahahahahahahahahaa I love thisss wuhahahahahahaha  she so funny,Manny Mua,MannyMua733
RZxCG6jArdM,love 'em sooo much,Manny Mua,MannyMua733
RZxCG6jArdM,She's amazing,Manny Mua,MannyMua733
RZxCG6jArdM,your laugh manny is everything!! your absolutely adorable!! your my favorite youtuber especially you with Christine! you guys seem so Happy!!,Manny Mua,MannyMua733
RZxCG6jArdM,When the blooper video is better than the regular video,Manny Mua,MannyMua733
RZxCG6jArdM,i want him to do my makeup so bad,Manny Mua,MannyMua733
RZxCG6jArdM,IM DEAD,Manny Mua,MannyMua733
RZxCG6jArdM,This is seriously my favorite video i think I've ever watched by you! It was just down to earth and fun  but don't get me wrong i love all the others too.,Manny Mua,MannyMua733
RZxCG6jArdM,I cannot stop watching this it makes me so happy! :),Manny Mua,MannyMua733
RZxCG6jArdM,omg amazing HAHHAHAHAHAHAHAHAHAH do more videos together!!!!!,Manny Mua,MannyMua733
RZxCG6jArdM,I dont know but the more i looked at her the more she looks like kylie. I just dont know why.,Manny Mua,MannyMua733
RZxCG6jArdM,this was HILARIOUS thank you for posting Manny <3,Manny Mua,MannyMua733
RZxCG6jArdM,"did you flood your basement" omg,Manny Mua,MannyMua733
74pLyi5SEzY,Whos liking todays video?! Do we want more in depth like this? Or shorter... or mix of both?! Let me know!,Manny Mua,MannyMua733
74pLyi5SEzY,everyone loves this foundation but i hate it. For oily skin its a nightmare. Huge no,Manny Mua,MannyMua733
74pLyi5SEzY,I was missing these kind of tutorial vids from YouTube!!,Manny Mua,MannyMua733
74pLyi5SEzY,I love more in depth tutorials. Thank you for doing this!,Manny Mua,MannyMua733
74pLyi5SEzY,I get that guys are now putting makeup on there faces  but seriously they cant shave they look ridiculous. Disgusting...,Manny Mua,MannyMua733
74pLyi5SEzY,More videos like this are defs needed!!!! Love this,Manny Mua,MannyMua733
74pLyi5SEzY,Appreciate a longer video  Manny!,Manny Mua,MannyMua733
74pLyi5SEzY,Oh snap this was posted on my birthday AND it's sponsored by Clinique?? Best birthday ever love you Manny,Manny Mua,MannyMua733
74pLyi5SEzY,I LOVE YOU MANNY!! Thank you soooooo much for the in depth tutorial!! You just killed it!!,Manny Mua,MannyMua733
74pLyi5SEzY,I like how thorough he is in his explainations but Why did he use two different setting powders? And is the two faced setting powder better than Laura Mercier?,Manny Mua,MannyMua733
74pLyi5SEzY,I appreciate the information in this video,Manny Mua,MannyMua733
74pLyi5SEzY,*minimalist,Manny Mua,MannyMua733
74pLyi5SEzY,Love the tutorial! Please do more!!!,Manny Mua,MannyMua733
74pLyi5SEzY,i get why you did this and you did it very well BUT am I the only one who finds this type of video soo boring in comparison to your other videos?! I already feel like I'm learning so much from you even when youre being funny and goofy! You dont need to do this type of explaining videos  imo.,Manny Mua,MannyMua733
74pLyi5SEzY,You had to go buy the foundation and are surprised it works yet you title this 'MY EVERY DAY FULL..' haha (not in a mean way lol),Manny Mua,MannyMua733
74pLyi5SEzY,Honey I'm LIVING!!,Manny Mua,MannyMua733
74pLyi5SEzY,Piece of shit  you need to act like a human,Manny Mua,MannyMua733
74pLyi5SEzY,Yes please! More & more tutorials :),Manny Mua,MannyMua733
74pLyi5SEzY,Yeah I always use Clinique always have always will because I have skin issues and that brand is the only one that I never had problems with :),Manny Mua,MannyMua733
74pLyi5SEzY,you just SOLD me on this foundation!!,Manny Mua,MannyMua733
74pLyi5SEzY,OMG sucks that someone took your package! :( Package theft became an issue in my old neighborhood. Our neighbor finally caught video of someone on their Ring doorbell camera! It was a 20-something white girl just walking up  looking at the packages and taking what she wanted! Talk about entitlement! You should consider getting a Ring doorbell (they are motion activated and start recording as soon as someone walks up) so you have some evidence to turn over to the police or neighborhood patrol. You could also post the video on your neighborhood talk page or website if there is one for where you live. If someone in your neighborhood has caught on that you get a lot of packages  it might be someone local that other people in the neighborhood group can identify.,Manny Mua,MannyMua733
74pLyi5SEzY,You are the best! It is amazing that you saw something you could improve on and you actually did it. That's why I'll always be a fan,Manny Mua,MannyMua733
74pLyi5SEzY,I love this video!!!,Manny Mua,MannyMua733
74pLyi5SEzY,yes we love an informative king. u did that,Manny Mua,MannyMua733
74pLyi5SEzY,What brightening powder did you use? I don't see it listed.,Manny Mua,MannyMua733
74pLyi5SEzY,This was perfection  except   yeah  I would love to see how you do the lashes  and liner ... I'm new to your channel  so I'll just browse through the archives  and see what else there is to see. Thank you for such great explanations  though <3,Manny Mua,MannyMua733
74pLyi5SEzY,You didn't say anything about the price of Laura's first pallette and it was just as small for the same price lol...,Manny Mua,MannyMua733
74pLyi5SEzY,how to contour with my thick beard bro,Manny Mua,MannyMua733
74pLyi5SEzY,<33,Manny Mua,MannyMua733
74pLyi5SEzY,Manny please please do a review on the new nars longwear radiant foundation   or the makeup forever ultra HD foundation!  Would love to know what you think !,Manny Mua,MannyMua733
74pLyi5SEzY,I totally appreciate this video Thank you Manny!!,Manny Mua,MannyMua733
74pLyi5SEzY,First time on ur page and fell in love with you!!!!,Manny Mua,MannyMua733
74pLyi5SEzY,I really liked this video! Super informative but still fun!,Manny Mua,MannyMua733
74pLyi5SEzY,Most. Informative. Makeup. Video. Seriously I've been watching videos all week and I learned the most just now.,Manny Mua,MannyMua733
74pLyi5SEzY,So awesome you did this!! Way to expand!! I love it!,Manny Mua,MannyMua733
74pLyi5SEzY,More in depth please!!,Manny Mua,MannyMua733
74pLyi5SEzY,Yes. Love the depth!!!!! You should do a depth video on a cut crease. I have such a hard time doing a cut crease. They always look a little weird.,Manny Mua,MannyMua733
74pLyi5SEzY,The best everrr,Manny Mua,MannyMua733
74pLyi5SEzY,I just subscribed!!,Manny Mua,MannyMua733
74pLyi5SEzY,Anything you do will be loved,Manny Mua,MannyMua733
74pLyi5SEzY,What is this app everybody is using to get that cartoon self intro?? Plzzz someone let me know,Manny Mua,MannyMua733
74pLyi5SEzY,moon prism,Manny Mua,MannyMua733
74pLyi5SEzY,Thanks for doing a video and not cuss incessantly:) appreciate it!,Manny Mua,MannyMua733
74pLyi5SEzY,What is the difference between contour and bronzer,Manny Mua,MannyMua733
74pLyi5SEzY,You are my idol. Everything I do with my makeup  I have learned from you :) Love you so much,Manny Mua,MannyMua733
74pLyi5SEzY,THEY NEED MORE SHAAAADDDDDEEEEEESSSSSSSSSS,Manny Mua,MannyMua733
74pLyi5SEzY,Loved this video! Helps me do my own makeup much better! I always learn so much from you!,Manny Mua,MannyMua733
74pLyi5SEzY,I really liked this video. I like how you explained things. I really have trouble baking. The area always looks a bit darker even though it was a translucent powder. I have a couple of deeper lines on my forehead that collect foundation and looks horrible. Any suggestions? I'm only 41 and have decent skin but I scrunch my face alot. Hence the lines. Lol.,Manny Mua,MannyMua733
74pLyi5SEzY,Oh Manny I LOVE this,Manny Mua,MannyMua733
74pLyi5SEzY,Is the beauty beauty blender wet?,Manny Mua,MannyMua733
74pLyi5SEzY,Do you ever do any videos trying out different face masks,Manny Mua,MannyMua733
74pLyi5SEzY,Manny  you are so totally adorable  your videos are inspiring! Thank you for being here on YouTube!,Manny Mua,MannyMua733
74pLyi5SEzY,Love this in depth tutorial Manny!!,Manny Mua,MannyMua733
74pLyi5SEzY,Last week my father had a 15 hour emergency open heart surgery (he's doing great now) and the only thing that got me through the stress of that day was watching your videos. I can't tell you how comforting it was to be able to listen to your lighthearted tutorial during that nightmare of a day - even my mom was able to laugh! So Manny  if you happen to see this  THANK YOU and please keep doing what you're doing. Love from Vermont <3,Manny Mua,MannyMua733
74pLyi5SEzY,he should attempt drag make up lol,Manny Mua,MannyMua733
74pLyi5SEzY,I love this video!! It definitely helps me out!! I'm still learning a lot about my base! The hardest part for me is finding what type of skin I have when it comes to foundation. I say keep doing depth videos like this! It's so helpful and everyone could use more Manny talk!!!,Manny Mua,MannyMua733
74pLyi5SEzY,Manny this video is so good!! seriously feel like I learned more from this one video than I have from any in a long time. <3,Manny Mua,MannyMua733
74pLyi5SEzY,Love this video!! definitely a good idea doing  a really in depth tutorial <3,Manny Mua,MannyMua733
74pLyi5SEzY,how do i get morphe brushes in the states?? am i missing something somehow?,Manny Mua,MannyMua733
74pLyi5SEzY,Absolutely loved the more in depth video I learned so much!! Thank you Manny!,Manny Mua,MannyMua733
nW9HOW94-nU,Thank you guys so much for all the feedback!!! I def need to use a black light for a while and try it again!!!!,Manny Mua,MannyMua733
nW9HOW94-nU,What is your secret? How do you Glow so much!!!,Manny Mua,MannyMua733
nW9HOW94-nU,you do need a black light,Manny Mua,MannyMua733
nW9HOW94-nU,This is a rave clubbing highlighter,Manny Mua,MannyMua733
nW9HOW94-nU,you need a black light to make it work,Manny Mua,MannyMua733
nW9HOW94-nU,Yaaaassssss Nadi,Manny Mua,MannyMua733
nW9HOW94-nU,Made by Nadi  there's a PopLuxe YouTube channel and Nadi is HILARIOUS!! There's regular highlighters too  and they're really pretty!,Manny Mua,MannyMua733
nW9HOW94-nU,This has me shooked,Manny Mua,MannyMua733
nW9HOW94-nU,I love how there's always 1 "hey guys  welcome back to my channel.......no" in the bloopers lmao,Manny Mua,MannyMua733
nW9HOW94-nU,You should try the loose powder highlighters from Smolder Cosmetics! I think you'd love them!,Manny Mua,MannyMua733
nW9HOW94-nU,Did they really just say that highlighter is gluten free like ... what the fuck would gluten be doing in a highlighter. Fuck you.,Manny Mua,MannyMua733
nW9HOW94-nU,OMGGG,Manny Mua,MannyMua733
nW9HOW94-nU,You are amazing don't let anyone tell you otherwise!,Manny Mua,MannyMua733
nW9HOW94-nU,Would be the most perfect highlight for some maleficent Halloween makeup!!!,Manny Mua,MannyMua733
nW9HOW94-nU,Mannyyyy i loveyou so f much  you're sooo gorgeousss. You're my fuckin goalssss. All the love from India x,Manny Mua,MannyMua733
nW9HOW94-nU,try using a blacklight   see what it does,Manny Mua,MannyMua733
nW9HOW94-nU,cool highlight tho,Manny Mua,MannyMua733
nW9HOW94-nU,You are so adorable!!!! Thanks for all ya do!!!,Manny Mua,MannyMua733
nW9HOW94-nU,You should try with UV light!,Manny Mua,MannyMua733
nW9HOW94-nU,you need day light babe :),Manny Mua,MannyMua733
nW9HOW94-nU,IM LIVING WITH YOU WITHOUT FAUX LASHES,Manny Mua,MannyMua733
nW9HOW94-nU,tati tried it and it worked,Manny Mua,MannyMua733
nW9HOW94-nU,"The lights are now on".......,Manny Mua,MannyMua733
nW9HOW94-nU,Hey Manny I FUCKING LOVE YOU... i have this highlighter but the thing is that you have to use it in blacklights and its going to glow honey super fucking cute,Manny Mua,MannyMua733
nW9HOW94-nU,your little giggle makes me laugh every time lol,Manny Mua,MannyMua733
nW9HOW94-nU,I watched Tati's video and she used a black light to activate it,Manny Mua,MannyMua733
nW9HOW94-nU,Manny you neeed to charge it on the light,Manny Mua,MannyMua733
nW9HOW94-nU,Peeps  integrity Anyone  hear larger  this varidny?% ...,Manny Mua,MannyMua733
nW9HOW94-nU,Try A black light because some things say it's glow in the dark but you need a black light,Manny Mua,MannyMua733
nW9HOW94-nU,he says pigmented everytime.,Manny Mua,MannyMua733
nW9HOW94-nU,Maybe with the purple light,Manny Mua,MannyMua733
nW9HOW94-nU,WATCH TATI'S VID,Manny Mua,MannyMua733
nW9HOW94-nU,@MannyMua Mi cara de nino maybe if you were at a night club or a rave it will glow like a glow stick in someone private part . Those nightclubs have all those lights where everything picks up you can even see the ones that have jacked up make up or spills on their tops and the worst of worst you can tell who hasn't washed their hair in days or weeks with all that white crusty stuff ... Oh my god those are the ones you want to drop off at the carwash and pay them extra for a second wash .  Conyo Manny you know I'm right amor ... I love ya your the best you always have me laughing my ass off especially when I'm in the hospital I look forward to your videos Snapchat or IG and if I know I'm going to be at the hospital for a while I just watch your some of your older stuff . Keep doing what your doing and don't let anyone get in your way amor   I know for a fact your helping a lot of these young kids that are having a hard time being their true self bcuz their getting pushed around by mean kids and not being loved by their own parents . My daughter is 21 in college and when she was a bit younger she would say how kids in her school or friends of hers would look up to you . So please continue with being you and never change for no one or a make up brand that wouldn't pick u up unless you change or dialed it back . I know you don't know me or have ever read or looked at my IG but I just wanted to let you know how awesome you are and how amazing your parents did in raising you . Hopefully one day I get to meet you. Love always Michelle,Manny Mua,MannyMua733
nW9HOW94-nU,You should watch Tati's video she got it to glow in the dark maybe ask her how she did it.,Manny Mua,MannyMua733
nW9HOW94-nU,Can you do a drugstore makeup starter kit?,Manny Mua,MannyMua733
nW9HOW94-nU,can i jus say how flawless your skin is,Manny Mua,MannyMua733
nW9HOW94-nU,Too bad you dont have a black light,Manny Mua,MannyMua733
nW9HOW94-nU,how did you make your intro ? xx,Manny Mua,MannyMua733
nW9HOW94-nU,Pop lux is awesome! He's hilarious!,Manny Mua,MannyMua733
nW9HOW94-nU,for best effect you need to use a blacklight xx,Manny Mua,MannyMua733
nW9HOW94-nU,I LIVE WHEN MANNY SPEAKS SPANISH,Manny Mua,MannyMua733
nW9HOW94-nU,This isn't in my sub box yet. Damn it YouTube! Haha,Manny Mua,MannyMua733
nW9HOW94-nU,Wait what if you use a black light??,Manny Mua,MannyMua733
nW9HOW94-nU,I'm really liking the brows did you change anything?,Manny Mua,MannyMua733
nW9HOW94-nU,Love  love  love your channel Manny!!! Would love to see you do an "Avon" makeup challenge. Show us small town girls in Canada how to make this s$&@ work.,Manny Mua,MannyMua733
nW9HOW94-nU,halo.  Manny.     HARSHA.     I'm.  your.   big.   fan.,Manny Mua,MannyMua733
nW9HOW94-nU,Holy shit you look absolutely adorable in this video omg,Manny Mua,MannyMua733
nW9HOW94-nU,Lmao I love you,Manny Mua,MannyMua733
nW9HOW94-nU,Your face looks so slim! Gym results are definitely shining through,Manny Mua,MannyMua733
nW9HOW94-nU,Do peel off foundation!!,Manny Mua,MannyMua733
nW9HOW94-nU,Try the Face Halo! it's a new makeup remover tool thing and it looks really cool!,Manny Mua,MannyMua733
nW9HOW94-nU,you need to activate it by either shining a uv light on it or sit it open next to a sunny window for a few hours.,Manny Mua,MannyMua733
nW9HOW94-nU,who else was waiting for him to say pigmented ?,Manny Mua,MannyMua733
nW9HOW94-nU,It's already blinding  I'm shook,Manny Mua,MannyMua733
nW9HOW94-nU,You need a fucking black light omdsss,Manny Mua,MannyMua733
nW9HOW94-nU,Nadi aka pop luxe is awesome you guys should check out his videos,Manny Mua,MannyMua733
nW9HOW94-nU,Black lights charge faster than anything. Try using one of those,Manny Mua,MannyMua733
nW9HOW94-nU,that I DONT HAVE ANY PIMPLES RIGHT NOW ad pisses me off SO much,Manny Mua,MannyMua733
nW9HOW94-nU,Your skin looks amazing on this video mannyyyyyyyyyyyyyyyyyyyyy,Manny Mua,MannyMua733
nW9HOW94-nU,the younger youtuber Jordan Byers made it work as well. she did a second d video on it because her first one she said and did basically the same as Manny did here   second time  after she took so e advice from comments she got it to glow.  it isn't meant to last very long is the only thing I've seen that sorta sucks about it.  once charged it losses it pretty fast in the dark.  xoxoxo,Manny Mua,MannyMua733
nW9HOW94-nU,the younger youtuber Jordan Byers made it work as well. she did a second d video on it because her first one she said and did basically the same as Manny did here   second time  after she took so e advice from comments she got it to glow.  it isn't meant to last very long is the only thing I've seen that sorta sucks about it.  once charged it losses it pretty fast in the dark.  xoxoxo,Manny Mua,MannyMua733
nW9HOW94-nU,When you want to buy something from the manny merch but you're broke as a joke :'v,Manny Mua,MannyMua733
nW9HOW94-nU,When Tati did it she "charged" it with a black light instead of a regular flashlight.,Manny Mua,MannyMua733
nW9HOW94-nU,When Tati did it she "charged" it with a black light instead of a regular flashlight.,Manny Mua,MannyMua733
nW9HOW94-nU,You did it wroooong. When Tati reviewed it she used a UV Black light and it charged that shit right up where you could actually see it on camera,Manny Mua,MannyMua733
nW9HOW94-nU,Love love love,Manny Mua,MannyMua733
nW9HOW94-nU,Did you do something different with your face makeup? It looks soo good I love it!!!,Manny Mua,MannyMua733
nW9HOW94-nU,Does anybody know who's doing these intros?,Manny Mua,MannyMua733
nW9HOW94-nU,You'll need sun light  UV light  or a black light for it to absorb the light and work. LOVE YOU MANNY,Manny Mua,MannyMua733
nW9HOW94-nU,that thumbnail tho,Manny Mua,MannyMua733
nW9HOW94-nU,YASSS DADDYY!!!!11!!1!1!,Manny Mua,MannyMua733
nW9HOW94-nU,Jeffree would totally approve of this product too! Lol. I'd buy this anyways! It's gorgeous and looks BOMBBBB on you Manny!,Manny Mua,MannyMua733
nW9HOW94-nU,Make it wet and use a black light,Manny Mua,MannyMua733
nW9HOW94-nU,he is so beautiful,Manny Mua,MannyMua733
nW9HOW94-nU,Try it with a black light it will work,Manny Mua,MannyMua733
nW9HOW94-nU,You need a black light,Manny Mua,MannyMua733
nW9HOW94-nU,Manny watch tati's video she did it. See what she did,Manny Mua,MannyMua733
nW9HOW94-nU,How did you do ur intro,Manny Mua,MannyMua733
AXN0_eEo5-g,Love ya Manny,Manny Mua,MannyMua733
AXN0_eEo5-g,LMAO! That laugh tho! I live for it bitchhhhhhh ugh I love you  you make me feel young idk what I would do without you Loljk was copying mean girls.. But ughhh I love you!,Manny Mua,MannyMua733
AXN0_eEo5-g,I really really liked that you had other things to buy that were better deals,Manny Mua,MannyMua733
AXN0_eEo5-g,Love that you gave recommendations!,Manny Mua,MannyMua733
AXN0_eEo5-g,Why in the hell was this censored? New person to the subscribed. I have seen other videos. Actually got pulled in because of his honesty with the products. And that was never censored before.,Manny Mua,MannyMua733
AXN0_eEo5-g,Why is this one censored??,Manny Mua,MannyMua733
AXN0_eEo5-g,Yes pleeeeaseee!  More anti haul,Manny Mua,MannyMua733
AXN0_eEo5-g,legit th realist bitch out there<3,Manny Mua,MannyMua733
AXN0_eEo5-g,I really enjoyed how you showed other products of that brand that you loved.,Manny Mua,MannyMua733
AXN0_eEo5-g,you should've named this ANTI-HAULiday okay i hate myself goodbye lol,Manny Mua,MannyMua733
AXN0_eEo5-g,PLEASE do a tutorial on your eyeshadow !!!,Manny Mua,MannyMua733
AXN0_eEo5-g,YOU LOOK SO GOOD,Manny Mua,MannyMua733
AXN0_eEo5-g,I fucking love makeup gift sets,Manny Mua,MannyMua733
AXN0_eEo5-g,Anti-hauliday would have been such a good title lol,Manny Mua,MannyMua733
AXN0_eEo5-g,What lashes are you wearing tho,Manny Mua,MannyMua733
AXN0_eEo5-g,LOVE YOUR LIPSTICK COLOR!,Manny Mua,MannyMua733
AXN0_eEo5-g,I love you  Manny!!!,Manny Mua,MannyMua733
AXN0_eEo5-g,Says today's pallettes are boring then says fentys was too much. That made me laugh. And I couldn't agree more. Where's the in between exciting palletes?,Manny Mua,MannyMua733
AXN0_eEo5-g,Kimberly Clark did it first!,Manny Mua,MannyMua733
AXN0_eEo5-g,I died when he said he got laser hair removal on his ass cheeks,Manny Mua,MannyMua733
AXN0_eEo5-g,Hey Manny. Which lipstick brand and shade are you wearing in this video? I like it a lot :),Manny Mua,MannyMua733
AXN0_eEo5-g,I got the little duo and it was so worth the money !,Manny Mua,MannyMua733
AXN0_eEo5-g,I really like that you gave products you do like along side the ones you didn't. Please do more,Manny Mua,MannyMua733
AXN0_eEo5-g,Shout out to Kimberly Clark for the original idea of the anti-haul.,Manny Mua,MannyMua733
AXN0_eEo5-g,Can you do a tutorial on your makeup? Looks so pretty!,Manny Mua,MannyMua733
AXN0_eEo5-g,I love anti hauls always watch them!,Manny Mua,MannyMua733
AXN0_eEo5-g,leave it to manny to do a sponsored anti-haul,Manny Mua,MannyMua733
AXN0_eEo5-g,Well you are kinda saving my money. Yes i want this kind of videos!,Manny Mua,MannyMua733
AXN0_eEo5-g,I like you manny that's why I watch your vids.. But please dont ever do the middle finger again. Pls be mindful that you have younger audiences..,Manny Mua,MannyMua733
AXN0_eEo5-g,This was great anti haul. Love the get this instead of this within the same brand idea.,Manny Mua,MannyMua733
AXN0_eEo5-g,please do an eyebrow tutorial !,Manny Mua,MannyMua733
AXN0_eEo5-g,I can get very geeky about makeup too sometimes :) Can you maybe do a review on some ecotools brushes? I recently bought one of their sets and I love it  I still wanna know if the rest of their stuff is good too tho,Manny Mua,MannyMua733
AXN0_eEo5-g,What lashes is he wearing?,Manny Mua,MannyMua733
AXN0_eEo5-g,Hey Manny.. I'm a new fan of urs .. Would love to see u visit my country India once.. You ll love it here. :),Manny Mua,MannyMua733
AXN0_eEo5-g,No more beeps!!! I love your videos just the way u would do them,Manny Mua,MannyMua733
AXN0_eEo5-g,Manny saying "f*cking carita" made my day!!,Manny Mua,MannyMua733
AXN0_eEo5-g,I absolutely love the lip color! Gorgeous!!,Manny Mua,MannyMua733
AXN0_eEo5-g,What is the orange color lipstick you are wearing? Great color!,Manny Mua,MannyMua733
AXN0_eEo5-g,Me encantan tus videos y tu carita  eres un muneco ! Un beso de Sandra  desde Montreal  Canada,Manny Mua,MannyMua733
AXN0_eEo5-g,Lov these,Manny Mua,MannyMua733
AXN0_eEo5-g,I love how honest you are!,Manny Mua,MannyMua733
AXN0_eEo5-g,Do a video on your eye look pleaseee,Manny Mua,MannyMua733
AXN0_eEo5-g,@jambeauty89,Manny Mua,MannyMua733
AXN0_eEo5-g,HATE the beeps! No censors!,Manny Mua,MannyMua733
AXN0_eEo5-g,I really love these type of videos and how much more consist you've been!! plus I think its great how youre including subtitles it blends into the screen when you go into full screen! love ya,Manny Mua,MannyMua733
AXN0_eEo5-g,Beautiful makeup!,Manny Mua,MannyMua733
AXN0_eEo5-g,I like how you offered other suggestions!,Manny Mua,MannyMua733
AXN0_eEo5-g,YESS MANY DRAGGG THEMMMN,Manny Mua,MannyMua733
AXN0_eEo5-g,Love this,Manny Mua,MannyMua733
