videoId,comment,channelId,channelName
bLNEjiMEcxw,WHOS GONNA TRY THIS OUT!?!?!!??!,Manny Mua,MannyMua733
bLNEjiMEcxw,How many eyebrow hairs did you lose trying to wash that off?,Manny Mua,MannyMua733
bLNEjiMEcxw,You probably could of put a setting powder or a baby powder on it to get rid of the glossyness of the gel,Manny Mua,MannyMua733
bLNEjiMEcxw,I wonder what it would have looked like if you ran a spooly through it?,Manny Mua,MannyMua733
bLNEjiMEcxw,No GIGGLE??!!!!!???? MCSCUSE ME?!,Manny Mua,MannyMua733
bLNEjiMEcxw,I wonder if it would apply better if u like dipped a little disposable mascara wand in it and did it that way? hmm,Manny Mua,MannyMua733
bLNEjiMEcxw,Where the fuck was the laugh in the beggining......... Iike I missed it.,Manny Mua,MannyMua733
bLNEjiMEcxw,I know this is an old video but I love watching your videos and I feel like you could zoom up a bit more. It's like I am always pinching my screen to seen your brows and detailing.,Manny Mua,MannyMua733
bLNEjiMEcxw,HE DIDNT LAUGH,Manny Mua,MannyMua733
bLNEjiMEcxw,*wheres the giggle*,Manny Mua,MannyMua733
bLNEjiMEcxw,It really looks like you used mascara in your brows.  Total miss.,Manny Mua,MannyMua733
bLNEjiMEcxw,Oh hell no!! Major props to you for trying it out ! I love you!  You make my days brighter. I always laugh till I cry. Muahhh!!,Manny Mua,MannyMua733
bLNEjiMEcxw,I want a shirt that says  "since the day I was a child.",Manny Mua,MannyMua733
bLNEjiMEcxw,Nah wierd,Manny Mua,MannyMua733
bLNEjiMEcxw,That's Japanese product,Manny Mua,MannyMua733
bLNEjiMEcxw,If your brows had a spiff I woulda thought they was Bob Marley.   Dreadlocked eyebrows. New trend!,Manny Mua,MannyMua733
bLNEjiMEcxw,LMAOOOOO THE FUCKING THUMBNAIL,Manny Mua,MannyMua733
bLNEjiMEcxw,Favourite human,Manny Mua,MannyMua733
bLNEjiMEcxw,You can buy this from Mitsuwa or Marukai and not have to pay shipping if anyone really wants it..lol but probably not after seeing this,Manny Mua,MannyMua733
bLNEjiMEcxw,but like how come theres japanese words on it? you said its a korean brand?,Manny Mua,MannyMua733
bLNEjiMEcxw,That would probably work on lashes !,Manny Mua,MannyMua733
bLNEjiMEcxw,EXCUSE ME I WAS WAITING FOR THE GIGGLE AND GOT IT.,Manny Mua,MannyMua733
bLNEjiMEcxw,yeah.... i need this! take her hiking  camping; whaaat??!,Manny Mua,MannyMua733
bLNEjiMEcxw,It's like Charlie Chaplin meets Jersey bro....hmmm no go,Manny Mua,MannyMua733
bLNEjiMEcxw,You are so beautiful!!!!!,Manny Mua,MannyMua733
bLNEjiMEcxw,Thant is Japanese  I can read it,Manny Mua,MannyMua733
bLNEjiMEcxw,I wonder if using a spoolie while the gel (glue) is still wet would help? and then kind of setting with a brow powder so it doesn't look wet? I've never used this product but just want it to work so badly  lmaooo.,Manny Mua,MannyMua733
bLNEjiMEcxw,I have this one  and it's absolutely adorable item fir my brows I have. Your mistake is you put too much gel. I use it only on blank places near my brows to make them thicker.,Manny Mua,MannyMua733
bLNEjiMEcxw,We are number one,Manny Mua,MannyMua733
bLNEjiMEcxw,maybe it'll work for people with no brows it kind of worked on your hand,Manny Mua,MannyMua733
bLNEjiMEcxw,I want your necklace haha,Manny Mua,MannyMua733
bLNEjiMEcxw,feel like this is more for people with like no brows,Manny Mua,MannyMua733
bLNEjiMEcxw,Douche,Manny Mua,MannyMua733
bLNEjiMEcxw,The language on the box is Japanese  I speak it,Manny Mua,MannyMua733
bLNEjiMEcxw,I think they'd look alright if you stood about 30ft away  in a dark room,Manny Mua,MannyMua733
bLNEjiMEcxw,Honestly this product would be great for a prepubescent boy who wants some facial hair lmao,Manny Mua,MannyMua733
bLNEjiMEcxw,SERIOUSLY...your so fuckin adorable!!!! I'd love to send you some products to review for me!!,Manny Mua,MannyMua733
bLNEjiMEcxw,Avon sells something similar but in a pen thing  you twist the end and some jelly stuff comes to the top and you put it on your brows I used it once made mine wet to  and made them look darker,Manny Mua,MannyMua733
bLNEjiMEcxw,Bloopers" mmm pica pica"jajaja I died,Manny Mua,MannyMua733
bLNEjiMEcxw,Manny doesn't even need to do his eyebrows ever.,Manny Mua,MannyMua733
bLNEjiMEcxw,Omg it looks so much like pubes I couldn't lol,Manny Mua,MannyMua733
bLNEjiMEcxw,It's from Korea.... but the stuff on the front is in Japanese lol,Manny Mua,MannyMua733
bLNEjiMEcxw,i actually like it !,Manny Mua,MannyMua733
bLNEjiMEcxw,literally dying watching this video,Manny Mua,MannyMua733
bLNEjiMEcxw,I just wanna know what the removal process was ? Were any eyebrow hairs harmed in the process?,Manny Mua,MannyMua733
bLNEjiMEcxw,Bruh..you need to brush then after it dries,Manny Mua,MannyMua733
bLNEjiMEcxw,Maybe you should retest it but this time just fill them out ABOVE your brows instead of on. Maybe a different outcome?,Manny Mua,MannyMua733
bLNEjiMEcxw,I have just discovered you and your foul mouth! I'm hooked  yo.,Manny Mua,MannyMua733
bLNEjiMEcxw,But is it waterproof or can you remove it with warm water?,Manny Mua,MannyMua733
bLNEjiMEcxw,imagine trying it on your beard LOL,Manny Mua,MannyMua733
bLNEjiMEcxw,I thought that would be something like the unique mascara .. its fiber but its a pasty product just like any regular mascara!,Manny Mua,MannyMua733
bLNEjiMEcxw,This is probably a Japanese product. They do keep their brows in check. Like smaller than baby hair.,Manny Mua,MannyMua733
bLNEjiMEcxw,It doesn't define your brow shape at all...,Manny Mua,MannyMua733
bLNEjiMEcxw,Manny I know your tag line has a swear in it but you have lots of younger viewers no need to swear so much!,Manny Mua,MannyMua733
bLNEjiMEcxw,I think they would work for someone with hairless eyebrows. They can just shade it in. And it would be easier for them,Manny Mua,MannyMua733
bLNEjiMEcxw,Low key was hoping you'd use it to make a mustache haha,Manny Mua,MannyMua733
bLNEjiMEcxw,you should place an amount on your hand  and slowly place the individual hairs on your brows. Maybe it makes it look more natural?,Manny Mua,MannyMua733
bLNEjiMEcxw,I know it's random but u should try a video using baby powder and like house hold objects for a full face,Manny Mua,MannyMua733
bLNEjiMEcxw,nobody is going to mention that several beauty bloggers have the SAME INTRO style? i mean.. c'mon,Manny Mua,MannyMua733
bLNEjiMEcxw,try with a spooly?,Manny Mua,MannyMua733
bLNEjiMEcxw,FLOP! It looks like you moussed your brows. Did you try to comb them out a little??,Manny Mua,MannyMua733
bLNEjiMEcxw,YES QUEEN WORK   *claps hands aggressively*,Manny Mua,MannyMua733
bLNEjiMEcxw,love you and all your videos !!! my friend got the same thing and uses it all the time but she brushes it out maybe that works better,Manny Mua,MannyMua733
t25ETTRULy0,Go up one or two shades,Manny Mua,MannyMua733
t25ETTRULy0,Has a shot everytime Manny says bitch!  Dies from alcohol intake! Biiiiitch,Manny Mua,MannyMua733
t25ETTRULy0,I love you watching you   and I f*cking love it . Haters can go bye b*tches,Manny Mua,MannyMua733
t25ETTRULy0,We love a supportive queen,Manny Mua,MannyMua733
t25ETTRULy0,That is your EXACT shade,Manny Mua,MannyMua733
t25ETTRULy0,I love how soft and romantic that eye look turned out. It screams Aphrodite and Valentine's Day to me.,Manny Mua,MannyMua733
t25ETTRULy0,"Here we are thirsty for water and thirsty for dick" AHAHAHAH mood,Manny Mua,MannyMua733
t25ETTRULy0,i bought the amrezy collab and oml i've never been so in love  it literally looks WET,Manny Mua,MannyMua733
t25ETTRULy0,this look is STUNNING,Manny Mua,MannyMua733
t25ETTRULy0,is it just me or like do you guys ever wonder if they go places after filming  or do they just take it all off and crawl back into bed,Manny Mua,MannyMua733
t25ETTRULy0,"thirsty for water and thirsty for dick" LMFAO bitch,Manny Mua,MannyMua733
t25ETTRULy0,I am LIVING for this look!!!,Manny Mua,MannyMua733
t25ETTRULy0,I love the intro giggles HAHAHAA so funny,Manny Mua,MannyMua733
t25ETTRULy0,oof mikey uses that background music near the end ahh,Manny Mua,MannyMua733
t25ETTRULy0,Yuya the mexican youtuber has an eyerliner in her makeup line,Manny Mua,MannyMua733
t25ETTRULy0,I am living for that cut crease eye look!,Manny Mua,MannyMua733
t25ETTRULy0,Address hence ongoing audience shoot look movement.,Manny Mua,MannyMua733
t25ETTRULy0,But why is your skin so nice??? Like im jealous????,Manny Mua,MannyMua733
t25ETTRULy0,Flashback marry is that u ???? (Joking),Manny Mua,MannyMua733
t25ETTRULy0,Ya know Manny  you're a pretty wonderful person,Manny Mua,MannyMua733
t25ETTRULy0,It's not hooda it's huda,Manny Mua,MannyMua733
t25ETTRULy0,here we are thirty for water and thirsty for d*ck lmfao!!!!!!,Manny Mua,MannyMua733
t25ETTRULy0,Gurrlllll I am obsesed with Avatar the last air bender whose you favorite character mine is katara,Manny Mua,MannyMua733
t25ETTRULy0,YOUR FACE IS SO BEAUTIFUL WITHOUT AND WITH MAKEUP!!!! YOUR SLAYING US ON ALL LEVELS,Manny Mua,MannyMua733
t25ETTRULy0,Died when Manny  showed Shawn's picture,Manny Mua,MannyMua733
t25ETTRULy0,Omfg atla,Manny Mua,MannyMua733
t25ETTRULy0,Flashback Mary who?,Manny Mua,MannyMua733
t25ETTRULy0,For good reason,Manny Mua,MannyMua733
t25ETTRULy0,he talks ssosososooso much omg,Manny Mua,MannyMua733
t25ETTRULy0,wait jeferee and manny are still frnds,Manny Mua,MannyMua733
t25ETTRULy0,Huda beauty did use a man in her bronze sands pics?,Manny Mua,MannyMua733
t25ETTRULy0,good luck with your own makeup products! I love ur videos! :3,Manny Mua,MannyMua733
t25ETTRULy0,You should have done the Carli Bybel x BH palette,Manny Mua,MannyMua733
t25ETTRULy0,Hey u should fly me out and do my makeup,Manny Mua,MannyMua733
t25ETTRULy0,Fenty beauty!!,Manny Mua,MannyMua733
t25ETTRULy0,GIRL I JUST FINISHED AVATAR THE LAST AIRBENDER AND LEGEND OF KORRA YES SLAY MY QUEEN,Manny Mua,MannyMua733
t25ETTRULy0,Awesome video!!,Manny Mua,MannyMua733
t25ETTRULy0,Avatar <3,Manny Mua,MannyMua733
t25ETTRULy0,Thirsty for water and dick ;),Manny Mua,MannyMua733
t25ETTRULy0,Girl   such a pro!,Manny Mua,MannyMua733
t25ETTRULy0,When he brought up avatar the last airbender I CHOKED,Manny Mua,MannyMua733
t25ETTRULy0,One of my favorite looks by you!!,Manny Mua,MannyMua733
t25ETTRULy0,Do u mind doin a liquid liner totourial cuz I need some help with that,Manny Mua,MannyMua733
t25ETTRULy0,Hey you know how people are following makeup videos you should follow a little girl makeup video,Manny Mua,MannyMua733
t25ETTRULy0,I love you dude,Manny Mua,MannyMua733
-ZhCODFyZGw,DO YOU GUYS KNOW OF ANY OTHER RIPPED OFF PRODUCTS?!,Manny Mua,MannyMua733
-ZhCODFyZGw,OMG love it    *ihihih*,Manny Mua,MannyMua733
-ZhCODFyZGw,Ihihih,Manny Mua,MannyMua733
-ZhCODFyZGw,To me i like the "rip off"because its more affordable and to me more pigmented than the original like the bad habits aphrodite pallet is more pigmented than the huda beauty rose gold pallet,Manny Mua,MannyMua733
-ZhCODFyZGw,fuck no  fuck no! Manny you never disappoint.,Manny Mua,MannyMua733
-ZhCODFyZGw,Lol you give me life!!!    IG: cicirodri22,Manny Mua,MannyMua733
-ZhCODFyZGw,I would like to purchase Kat Von D's Shade and Light Eye Palette but because I'm a broke teenager I can't help but buy the cheaper palette :( but I don't find myself using every  shade. Is there anytime in the future where you would be able to find single shadow dupes for the Shade and Light Palette? I know that Coastal Scents sell single shadows for a low price and as of right now(5/3/18) they are on sale for $0.99 each!! I also really love Sonia Kashuk's Eye On Neutral 2 palette but I also don't use all of the shades in that palette either. I do notice that both of the palettes that I've spoken about do have similar shades. If you ever have the time to  please do shade dupes for either Kat Von D's Shade and Light Eye Palette and/or Sonia Kashuk's Eye On Neutral 2 palette!!,Manny Mua,MannyMua733
-ZhCODFyZGw,I feel like 'dupes' are made purposely so people can get what they want for a better price because why pay twice as much when you can get a very similar product for less?     No shade to manny and the brands just how I see it xxx,Manny Mua,MannyMua733
-ZhCODFyZGw,Seriously Manny I have always trusted your opinions about makeup but other channels on YouTube have pretty great things to say about makeup revolution and other inexpensive brands .. it just sounds like you're dead set on not liking the inexpensive brands..,Manny Mua,MannyMua733
-ZhCODFyZGw,insta: haleymilker  Texas  USA,Manny Mua,MannyMua733
-ZhCODFyZGw,Instagram- @memphis_dockens05,Manny Mua,MannyMua733
-ZhCODFyZGw,Instagram- @hollandbankston Texas  US!!!,Manny Mua,MannyMua733
-ZhCODFyZGw,I started watching you a few months now. You are super fun to watch and I learned how to do my makeup by watching you. Thanks for being so fun to watch.,Manny Mua,MannyMua733
-ZhCODFyZGw,Facebook  Little Rock AR,Manny Mua,MannyMua733
-ZhCODFyZGw,I have the Revlon blush things 4 highlight,Manny Mua,MannyMua733
-ZhCODFyZGw,i will still forever get dupes because ya girl is broke af,Manny Mua,MannyMua733
-ZhCODFyZGw,Revolution is known for duping famous pallettes  but a lot of their makeup is really decent  Their setting spray lets me take a shower and still keep my highlight  and eye makeup on,Manny Mua,MannyMua733
-ZhCODFyZGw,Lol. MANNY MUA: were a my tea... ok pretend this it tea.,Manny Mua,MannyMua733
-ZhCODFyZGw,Love u Mannyyyy,Manny Mua,MannyMua733
-ZhCODFyZGw,Naked eyeshadow palettes (original) and W7 In The Buff eyeshadow palettes (duped).,Manny Mua,MannyMua733
-ZhCODFyZGw,makeup revolution redemption pallet in iconic 1 2 3 are dupes for naked pallet 1 2 3  ps: i have tried the makeup revolution one and it's gooood.,Manny Mua,MannyMua733
-ZhCODFyZGw,Love that too faced peachy blush! It is so pretty on.,Manny Mua,MannyMua733
-ZhCODFyZGw,Revolution basically just makes dupes of more expensive products for cheaper prices. Majority of their products are good.,Manny Mua,MannyMua733
-ZhCODFyZGw,my instagram is izzysmiles786 im from Ohio1 I dont even know how to do makeup but I want to learn:(,Manny Mua,MannyMua733
-ZhCODFyZGw,My Instagram is kate_rosee_gold and I'm from Michigan usa,Manny Mua,MannyMua733
-ZhCODFyZGw,extra__unordinary(Tampa Florida),Manny Mua,MannyMua733
-ZhCODFyZGw,Thank you for inspiring me so much.  I have recently found your channel and it's all I watch now.  I love everything about you  thank you for being you. You probably won't see this but I hope you do because you deserve no hate and all the love.,Manny Mua,MannyMua733
-ZhCODFyZGw,diva85_cheshie instagram minnesota,Manny Mua,MannyMua733
-ZhCODFyZGw,Morphe v Lick and Lash Beauty makeup palettes especially the 35C palette,Manny Mua,MannyMua733
-ZhCODFyZGw,Manny due the makeup revolution and the too faced chocolate bar palette,Manny Mua,MannyMua733
-ZhCODFyZGw,I don't mind kickback in a drugstore  palette. Mine is not that bad  well maybe because I don't stab my palette with my brush haha. Mine is pretty pigmented and blends very very well! I love it! Kat Von D is wayy too expensive and it does the same job as a drugstore palette. It's just the name that sells.,Manny Mua,MannyMua733
-ZhCODFyZGw,I know this may be a stupid question but if we skip the ad do they not get paid?,Manny Mua,MannyMua733
-ZhCODFyZGw,You can find me on insta @lauren.gracie and I live in Wisconsin,Manny Mua,MannyMua733
-ZhCODFyZGw,u were a bit to judgie but i love u xx,Manny Mua,MannyMua733
-ZhCODFyZGw,Breath Manny.....Breath... lol,Manny Mua,MannyMua733
-ZhCODFyZGw,Manny Mua pure cosmetics buff collection and naked 3 palette,Manny Mua,MannyMua733
-ZhCODFyZGw,Hi manny! My name is Bente and IM from the netherlands. I recently started watching your videos and you are such a ray of sunshine! You are always so kind and positive! I really love your videos! I really LOVEEEE makeup  but in the Netherlands it's expensive and my mom nags about me spending too much money on makeup.. whoops! You can find me on my twitter: @benteiscoolx   I don't tweet a lot but I follow some people :). I hope I'm entered now and may the odds be in my favour! Love you! Xoxo bent,Manny Mua,MannyMua733
-ZhCODFyZGw,I use the makeup revolution blush as a highlight XD,Manny Mua,MannyMua733
-ZhCODFyZGw,stop. The highlighter always brings out your disgusting bumps.,Manny Mua,MannyMua733
-ZhCODFyZGw,Oh F ME I meant Jaclyn Hill!! Don't tell her!,Manny Mua,MannyMua733
-ZhCODFyZGw,My in stag ram is jenmaymast.....I'm from The Smoky Mtns. TN,Manny Mua,MannyMua733
-ZhCODFyZGw,I love you.  I totally wanna go stalker on you like you did Lauryn Hill.,Manny Mua,MannyMua733
-ZhCODFyZGw,Sorry no,Manny Mua,MannyMua733
-ZhCODFyZGw,-____- he's never seen these types of videos? Either he is lying and a moron for thinking people will believe that or puts no effort into researching video ideas,Manny Mua,MannyMua733
-ZhCODFyZGw,L A U G H  I S  B A C K  Y A A S,Manny Mua,MannyMua733
-ZhCODFyZGw,I don't like how he bashes the dupes. Not everyone has YouTube money /buys makeup for a living. We don't get money out of buying makeup like you do   manny.,Manny Mua,MannyMua733
-ZhCODFyZGw,A lot of makeup revolution palettes are very similar to high end brands for about one third the price I love the brand because I can't afford the more expensive stuff,Manny Mua,MannyMua733
-ZhCODFyZGw,Generic,Manny Mua,MannyMua733
-ZhCODFyZGw,Instagram @saachibhayani from California,Manny Mua,MannyMua733
-ZhCODFyZGw,Can I have a gift card,Manny Mua,MannyMua733
-ZhCODFyZGw,Hmmmmm manny u picked the more expensive ones the whole time just saying,Manny Mua,MannyMua733
-ZhCODFyZGw,Thedancerthatpainted on Ig,Manny Mua,MannyMua733
-ZhCODFyZGw,*Uhuhuh*,Manny Mua,MannyMua733
-ZhCODFyZGw,Omg I with I had $500 PERIOD!!!,Manny Mua,MannyMua733
-ZhCODFyZGw,Hello Manny! Catch me on insta/snap @therandomnat  I am from Novato California!! The worlds most boring city. I work two part time jobs but refuse to spend money at sephora because I hate spending money on myself :/ so all my makeup is from rite aid but best believe my face be on fleeeeeek!,Manny Mua,MannyMua733
-ZhCODFyZGw,Now that I've been watching Jeffree's reviews  I don't trust Manny at all! I feel he is all about the money and will suck up to any expensive designers!,Manny Mua,MannyMua733
-ZhCODFyZGw,Well of course u will choose the expensive ones duhhh,Manny Mua,MannyMua733
-ZhCODFyZGw,I think the reason makeup revolution tends to copy other products or make very similar products to other brands is because they are based out of the U.K. And in the U.K. It is hard to get your hands on a lot of products you can get in the States,Manny Mua,MannyMua733
1Ak4_YhBmdE,WHO ELSE IS OBSESSED WITH TATI!??!!?? LOVE YOU BABES!,Manny Mua,MannyMua733
1Ak4_YhBmdE,I just subbed :) loved this collaboration,Manny Mua,MannyMua733
1Ak4_YhBmdE,Umnwhy havnt you done each other's makeup yet...I am so late watching this video!,Manny Mua,MannyMua733
1Ak4_YhBmdE,OMG when Tati says "don't fucking watch" I died,Manny Mua,MannyMua733
1Ak4_YhBmdE,Are you from Oregon?? Your license peaked thru and looked like an Oregon ID. Just wondering cause that would be awesome:-) or does any other state have similar?,Manny Mua,MannyMua733
1Ak4_YhBmdE,Still waiting for a that collaboration,Manny Mua,MannyMua733
1Ak4_YhBmdE,How is it possible to like Tati even more after watching this video,Manny Mua,MannyMua733
1Ak4_YhBmdE,Manny PLEASEEEE teach her how to say DULCE DE LECHE  she says DOLCE and its so funny.,Manny Mua,MannyMua733
1Ak4_YhBmdE,CHRISTINE IS ONE THICC BICH,Manny Mua,MannyMua733
1Ak4_YhBmdE,Manny matches the vase in the background,Manny Mua,MannyMua733
1Ak4_YhBmdE,Omg you guys are beautiful! I love you both!,Manny Mua,MannyMua733
1Ak4_YhBmdE,I loooove spicy and even I would take a shot of straight hot sauce! that shit (not spicy lmao) doesn't even taste well on its own  deadass pointless suffering,Manny Mua,MannyMua733
1Ak4_YhBmdE,I like ur hair,Manny Mua,MannyMua733
1Ak4_YhBmdE,Do the other collab you mentioned of doing each other's makeup!,Manny Mua,MannyMua733
1Ak4_YhBmdE,what....this was done on my borthday!!!!!!!!!!!,Manny Mua,MannyMua733
1Ak4_YhBmdE,"tati you're so beautiful" "on the inside" whahahhahaah omg :P,Manny Mua,MannyMua733
1Ak4_YhBmdE,Tati looks soooo tan sitting next to manny,Manny Mua,MannyMua733
1Ak4_YhBmdE,When's the next collab guys!!! It's been tooooo longggg!!! Ready for pt 2,Manny Mua,MannyMua733
1Ak4_YhBmdE,LOOOVE This!!! <3 So happy to see you two together!,Manny Mua,MannyMua733
1Ak4_YhBmdE,Waiting for the next one,Manny Mua,MannyMua733
1Ak4_YhBmdE,we all love tati...titties...tati...tati's titties? lol kidding not kidding... no really I love tati and titties,Manny Mua,MannyMua733
1Ak4_YhBmdE,Your energy together is amazing,Manny Mua,MannyMua733
1Ak4_YhBmdE,I fucking love this video why haven't I seen this before lol,Manny Mua,MannyMua733
1Ak4_YhBmdE,There was no chuckle at the begining and its bothering me,Manny Mua,MannyMua733
1Ak4_YhBmdE,Paused the vid and went to the store to get hot cheetos,Manny Mua,MannyMua733
1Ak4_YhBmdE,Who else clicked because of the thumbnail,Manny Mua,MannyMua733
1Ak4_YhBmdE,I love when Tati says on her channel Shit what the f,Manny Mua,MannyMua733
1Ak4_YhBmdE,When you're pretty sure you've seen most of they're vids. And this pops up unseen I feel ASHAMED!.,Manny Mua,MannyMua733
1Ak4_YhBmdE,I know this is an old video but I LOVE y'all!!!! and Laura!!,Manny Mua,MannyMua733
1Ak4_YhBmdE,Who doesn't have a crush on Manny?,Manny Mua,MannyMua733
1Ak4_YhBmdE,I'm so late for this video but I live!,Manny Mua,MannyMua733
1Ak4_YhBmdE,This was cute.,Manny Mua,MannyMua733
1Ak4_YhBmdE,Tati whispering "Don't fucking watch it." just took my adoration for her to another level. HAHAHA Love you both!,Manny Mua,MannyMua733
1Ak4_YhBmdE,omg that lip plumper really works on him. whats the brand?,Manny Mua,MannyMua733
1Ak4_YhBmdE,I love Manny.... I love Tati.... I love Nikki.... I love James.... I love all you guys!!!!,Manny Mua,MannyMua733
1Ak4_YhBmdE,Love them!,Manny Mua,MannyMua733
1Ak4_YhBmdE,Manny are you high in this video,Manny Mua,MannyMua733
1Ak4_YhBmdE,This is my most fav video,Manny Mua,MannyMua733
1Ak4_YhBmdE,WHAT PAIR OF LASHES IS MANNY WEARING OH MY GOD,Manny Mua,MannyMua733
1Ak4_YhBmdE,omg she was BLUSHING the WHOLE time LMAO what a cutieee,Manny Mua,MannyMua733
1Ak4_YhBmdE,There were no truths lol,Manny Mua,MannyMua733
1Ak4_YhBmdE,Love the video and the bloopers!,Manny Mua,MannyMua733
1Ak4_YhBmdE,manny talking with his mouth full sounds like macdoesit when his wisdom teeth got taken out,Manny Mua,MannyMua733
1Ak4_YhBmdE,Jeffery Star is shaking,Manny Mua,MannyMua733
1Ak4_YhBmdE,Tati is literally flawless  And manny I just love you,Manny Mua,MannyMua733
1Ak4_YhBmdE,No shade manny is amazing at makeup but I think his highlight is a smidge too high and it makes him look a little baggy in the under eyes but this is just constructive criticism,Manny Mua,MannyMua733
1Ak4_YhBmdE,This was uploaded on my birthday in 2017,Manny Mua,MannyMua733
1Ak4_YhBmdE,I love how Tati's goofiness really shines on your channel! You two are a great video pair!!!,Manny Mua,MannyMua733
1Ak4_YhBmdE,I love you both so much! I am subscribed to both of your channels.,Manny Mua,MannyMua733
1Ak4_YhBmdE,What brush is manny using to bronze the face? Anyone?,Manny Mua,MannyMua733
1Ak4_YhBmdE,Omg can they please collab again !!!!,Manny Mua,MannyMua733
1Ak4_YhBmdE,*S   O    O            P    I    G    M   E   N   T   E   D*,Manny Mua,MannyMua733
1Ak4_YhBmdE,Yes Tati! Tims!!!,Manny Mua,MannyMua733
1Ak4_YhBmdE,tati reminded me of lorelai gilmore when she had the red liquid lip on woah,Manny Mua,MannyMua733
1Ak4_YhBmdE,Omg!! Manny you did this video on my birthday my 2 favorite youtubers together on my birthday!!!!!!,Manny Mua,MannyMua733
1Ak4_YhBmdE,WHERE IS THE SECOND COLLAB????,Manny Mua,MannyMua733
1Ak4_YhBmdE,You should do more collaborations with Tati,Manny Mua,MannyMua733
1Ak4_YhBmdE,Loved this video!!!,Manny Mua,MannyMua733
1Ak4_YhBmdE,I felt so bad for Laura hahahaha,Manny Mua,MannyMua733
7mfodefLBO8,Which of these are you guys' fav?!,Manny Mua,MannyMua733
7mfodefLBO8,manny testing over hyped makeup... 20 mins later..... Getting over hyped himself love you manny!!!!,Manny Mua,MannyMua733
7mfodefLBO8,I'm sorry Manny but you look just as white as your shirt.,Manny Mua,MannyMua733
7mfodefLBO8,When he calls the SILVER lip gloss HOLOGRAPHIC... and theres no fucking  shifting rainbows which is the definition of holographic *cough* *cough* *cristine*,Manny Mua,MannyMua733
7mfodefLBO8,Died with that ghost ass shade lol,Manny Mua,MannyMua733
7mfodefLBO8,I would add a comment just real quick  if you have sensitive skin and want to try any of the liquid latex lip colours  PLEASE be careful. My personal experience was that it started stinging the second i put it in my lips. I literally had only done a swipe in middle of my bottom lip and KABAM it was like a thousand tiny knives attacked where the product was. Never in my life had i dashed for the makeup remover station in Sephora so FAST. So if you have sensitive skin I'd be a little wary  just wanted to give a little warning.,Manny Mua,MannyMua733
7mfodefLBO8,I LOVE YOUR INTRO ITS SO BOMB,Manny Mua,MannyMua733
7mfodefLBO8,Flashback Mary is quaking,Manny Mua,MannyMua733
7mfodefLBO8,U are my favorite person to watch ur the fucking best,Manny Mua,MannyMua733
7mfodefLBO8,That literally is your shade once you turn the lights down and bronze lol,Manny Mua,MannyMua733
7mfodefLBO8,Shiny AAAnd shook.,Manny Mua,MannyMua733
7mfodefLBO8,Wait... did he say holographic liquid lipstick!?! Excuse me but that is iridescent  not HOLO! I see no rainbows on your lips. Any holosexuals out there?,Manny Mua,MannyMua733
7mfodefLBO8,I love you,Manny Mua,MannyMua733
7mfodefLBO8,You look like a vampire,Manny Mua,MannyMua733
7mfodefLBO8,Vampire!!! Lol,Manny Mua,MannyMua733
7mfodefLBO8,"Winwin winwin" as in nct's winwin ;),Manny Mua,MannyMua733
