videoId,comment,channelId,channelName
hpBLXVqXo5M,Oh and what if we all go vegan and the animals are over populated ?,PETA (People for the Ethical Treatment of Animals),officialpeta
hpBLXVqXo5M,Super cute!!,PETA (People for the Ethical Treatment of Animals),officialpeta
hpBLXVqXo5M,Who's the model?,PETA (People for the Ethical Treatment of Animals),officialpeta
hpBLXVqXo5M,I hate PETA,PETA (People for the Ethical Treatment of Animals),officialpeta
hpBLXVqXo5M,Vegan fashion dafuq is dis.,PETA (People for the Ethical Treatment of Animals),officialpeta
hpBLXVqXo5M,What is the big deal with tasing dead rats?,PETA (People for the Ethical Treatment of Animals),officialpeta
hpBLXVqXo5M,PETA PLEASE PLEASE TAKE A LOOK IN TO THIS LINK https://youtu.be/N1Q9E0rtAQs ITS SHOWS A DOG POND GASSING PUPPYS AND DOGS AND THEN DUMPING THEM IN A GARBAGE TRUCK. NOT CLICK BATE PLEASE PLEASE PLEASE PLEASE PLEASE FINE OUT WHO THEY ARE AND PUT A STOP TO IT,PETA (People for the Ethical Treatment of Animals),officialpeta
hpBLXVqXo5M,I am triggered you guys kill millions of plants they have lives to,PETA (People for the Ethical Treatment of Animals),officialpeta
hpBLXVqXo5M,Peta. The one company that goes mental for some tanuki mario. Wtf man,PETA (People for the Ethical Treatment of Animals),officialpeta
hpBLXVqXo5M,https://www.youtube.com/watch?v=PPFFA3QOoc0&t=3s,PETA (People for the Ethical Treatment of Animals),officialpeta
hpBLXVqXo5M,You see people might be dying in Africa but those boots tho,PETA (People for the Ethical Treatment of Animals),officialpeta
hpBLXVqXo5M,*just walking through with my leather jacket rabbit fur ushanka and leather boots*,PETA (People for the Ethical Treatment of Animals),officialpeta
hpBLXVqXo5M,Susi - Is that suede from animals?,PETA (People for the Ethical Treatment of Animals),officialpeta
hpBLXVqXo5M,Susi - Is that suede from animals?,PETA (People for the Ethical Treatment of Animals),officialpeta
hpBLXVqXo5M,U SUCK,PETA (People for the Ethical Treatment of Animals),officialpeta
hpBLXVqXo5M,Wait a min there are several video which is nothing compared to logan's vid.. they were dead which means they didnt feel any pain.. then what.. i love u guyz but dont do anything wrong..he is already getting backlash and after this he might not be able to get back..,PETA (People for the Ethical Treatment of Animals),officialpeta
hpBLXVqXo5M,I want to be vegan but meat tastes so good,PETA (People for the Ethical Treatment of Animals),officialpeta
hpBLXVqXo5M,What do you guys recommend that has no animal torture in it,PETA (People for the Ethical Treatment of Animals),officialpeta
hpBLXVqXo5M,INSTEAD OF ATTACKING LOGAN PAUL HOW ABOUT YOU ATTACK THE MULTIPLE COMPANIES WHO STILL USE RATS FOR EXPERIMENTATION!!!!,PETA (People for the Ethical Treatment of Animals),officialpeta
hpBLXVqXo5M,Btw the person who made the universe gave us animals to eat and to use them to survive and get stronger from them if that means eating them for protein or wearing there skins for warmth and comfort go right ahead,PETA (People for the Ethical Treatment of Animals),officialpeta
hpBLXVqXo5M,PETA the rad were dead the goldfish was dead so instead of crying that dead rats were tased how about you fix the problem of animals animal not a stupid vlogger who tased 2 dead rats that his dog killed so how about you get mad at the dog and not Logan,PETA (People for the Ethical Treatment of Animals),officialpeta
hpBLXVqXo5M,Goddess...doing great things. :),PETA (People for the Ethical Treatment of Animals),officialpeta
hpBLXVqXo5M,5th,PETA (People for the Ethical Treatment of Animals),officialpeta
hpBLXVqXo5M,Peta is the best hope for fluffy animals,PETA (People for the Ethical Treatment of Animals),officialpeta
hpBLXVqXo5M,Love them!!!!,PETA (People for the Ethical Treatment of Animals),officialpeta
hpBLXVqXo5M,your cause must really suck if you have to resort to using sexy looking girls to win followers. hey guys  let's all join peta  they have sexy girls and sometimes they are nude! forget the naughty sites  they have us covered here! *more like...UNcovered with some of the ladies. *wink  nudge  wink* keep it up and we might lose focus on anything animal  for we will all just be gawking at the girls. for example  doing a demonstration with "don't wear fur"  i walk up  you ask "support non fur trades" i say "what? no  I'm just here for the girls  nothing else". think about it.,PETA (People for the Ethical Treatment of Animals),officialpeta
-MRlMv757Hs,I just watched like 6 peta videos that are basically against owning pets,PETA (People for the Ethical Treatment of Animals),officialpeta
-MRlMv757Hs,Nope!  Don't have room in my life for noisy dogs.,PETA (People for the Ethical Treatment of Animals),officialpeta
-MRlMv757Hs,It's outrageous  it's unfair.,PETA (People for the Ethical Treatment of Animals),officialpeta
tYivrikwYTY,Hey Peta! I'm a huge fan and I wanted to show you a really aspiring video towards animal safety it's really cool it reminded me of all of you! https://youtu.be/qMbF2kA5WAI   https://youtu.be/F8Q-8oCwPi0,PETA (People for the Ethical Treatment of Animals),officialpeta
xdWDhKmcPX4,Wow. NBA and veganism. Two stupid things that have nothing to do with each other  except they're both stupid.,PETA (People for the Ethical Treatment of Animals),officialpeta
xdWDhKmcPX4,Weird that you skipped Damian Lillard  who is an all-star,PETA (People for the Ethical Treatment of Animals),officialpeta
xdWDhKmcPX4,These people are pretty fuckin dumb. The human body needs meat and the nutrition from it. Good luck trying to stay healthy and fit. With out meat you gain no muscle,PETA (People for the Ethical Treatment of Animals),officialpeta
xdWDhKmcPX4,Meh,PETA (People for the Ethical Treatment of Animals),officialpeta
xdWDhKmcPX4,NICE,PETA (People for the Ethical Treatment of Animals),officialpeta
xdWDhKmcPX4,I love when began diets are spotlighted!,PETA (People for the Ethical Treatment of Animals),officialpeta
xdWDhKmcPX4,Where's Shaq?,PETA (People for the Ethical Treatment of Animals),officialpeta
xdWDhKmcPX4,look let be honest here they are good but until some testing is done saying it has a thing to do with diet is kinda devaluing the players and there work,PETA (People for the Ethical Treatment of Animals),officialpeta
xdWDhKmcPX4,1:13 #PATRIARCHY ALERT!!,PETA (People for the Ethical Treatment of Animals),officialpeta
xdWDhKmcPX4,Even though my 2nd favorite player is vegan  that doesn't make me have to be! Eat yo meat! NO HOMO!!,PETA (People for the Ethical Treatment of Animals),officialpeta
xdWDhKmcPX4,That's what I don't like about you guys. You have all my support  but you can't can't say "the bests athletes are going vegan" with just 4 basketball players.  Of course there are a lot of pro athletes that are vegan  but if you compare with the ones that are not  the percentage is quite low. I think many of your adverts are just bulls**t like the happy hen on the egg package.,PETA (People for the Ethical Treatment of Animals),officialpeta
xdWDhKmcPX4,6th,PETA (People for the Ethical Treatment of Animals),officialpeta
xdWDhKmcPX4,Wow! That guys bring me up!,PETA (People for the Ethical Treatment of Animals),officialpeta
xdWDhKmcPX4,"I'm the fookin fewtah." -veganism,PETA (People for the Ethical Treatment of Animals),officialpeta
xdWDhKmcPX4,Love that the cruelty-free diet has brought positivity to people everywhere!,PETA (People for the Ethical Treatment of Animals),officialpeta
xdWDhKmcPX4,Kyrie with the black mask  all Vegan,PETA (People for the Ethical Treatment of Animals),officialpeta
EbVtOVt6rzQ,OK PETA you need to calm your shit down because animals have to be killed for food and I am not going  fucking vegan ok? So calm your shit down like Jesus like what now are you going to sue Muslims for killing sheeps?!,PETA (People for the Ethical Treatment of Animals),officialpeta
EbVtOVt6rzQ,Way to go Peta,PETA (People for the Ethical Treatment of Animals),officialpeta
EbVtOVt6rzQ,Reason why I hate peta,PETA (People for the Ethical Treatment of Animals),officialpeta
EbVtOVt6rzQ,P eople  E ating  T asty  A nimals,PETA (People for the Ethical Treatment of Animals),officialpeta
EbVtOVt6rzQ,PETA  just stop this  you are literally being the most disrespectful company of the world right now.,PETA (People for the Ethical Treatment of Animals),officialpeta
EbVtOVt6rzQ,More like bad news,PETA (People for the Ethical Treatment of Animals),officialpeta
EbVtOVt6rzQ,RIDICULO,PETA (People for the Ethical Treatment of Animals),officialpeta
EbVtOVt6rzQ,I can't wait to eat my delish late night steak and chicken legs. Yummm,PETA (People for the Ethical Treatment of Animals),officialpeta
EbVtOVt6rzQ,I'm not going to be a vegan,PETA (People for the Ethical Treatment of Animals),officialpeta
EbVtOVt6rzQ,You don't need a stick of lipstick if cost lives.,PETA (People for the Ethical Treatment of Animals),officialpeta
EbVtOVt6rzQ,still think they should leave the docters be but the sheep and cosmatics test is pretty fucked,PETA (People for the Ethical Treatment of Animals),officialpeta
EbVtOVt6rzQ,PETA would you kill a mosquito if there was an Ebola crisis or let it go?,PETA (People for the Ethical Treatment of Animals),officialpeta
EbVtOVt6rzQ,Dislike,PETA (People for the Ethical Treatment of Animals),officialpeta
EbVtOVt6rzQ,I'm gonna party *when* TAMU shuts the dog lab down  and *when* Canada Goose either goes vegan or goes out of business,PETA (People for the Ethical Treatment of Animals),officialpeta
EbVtOVt6rzQ,And for #13 PETA simultaneously hurt their own cause and solidified thousands of people's negative opinion of PETA. While attempting to stop important medical research.,PETA (People for the Ethical Treatment of Animals),officialpeta
EbVtOVt6rzQ,PETA; thank you. Just thank you. I want to work with you guys to save animals. More than just signing patitons. I want to save the animals. Please help me do that. I'm really passionate about them and I can even feed wild swans and stray cats out of my hands. I have a way with them. They kbow I wont hurt them. I'm vegan too. I'm only 13 but i work for handds to the rescue and love animals so much.,PETA (People for the Ethical Treatment of Animals),officialpeta
EbVtOVt6rzQ,Speaking of "crushed"  I'm wondering how many perfectly healthy animals PETA has "put down" since January 1st. Or how many family pets they've stolen and killed.,PETA (People for the Ethical Treatment of Animals),officialpeta
EbVtOVt6rzQ,hello i eat meat,PETA (People for the Ethical Treatment of Animals),officialpeta
EbVtOVt6rzQ,Meat is good,PETA (People for the Ethical Treatment of Animals),officialpeta
EbVtOVt6rzQ,Good job,PETA (People for the Ethical Treatment of Animals),officialpeta
EbVtOVt6rzQ,Bacon is delicious,PETA (People for the Ethical Treatment of Animals),officialpeta
EbVtOVt6rzQ,Thank you and Thank you for all the amazing things you do!,PETA (People for the Ethical Treatment of Animals),officialpeta
EbVtOVt6rzQ,Thank you sooo much PETA!!!,PETA (People for the Ethical Treatment of Animals),officialpeta
EbVtOVt6rzQ,~ PETA bless you all for your tireless hard work for our Animals ~ The revolution to stop Animal use is in full swing and we are making progress ~ Thank you ~ mgf,PETA (People for the Ethical Treatment of Animals),officialpeta
EbVtOVt6rzQ,Hearing these kinds of things still going in the world is heartbreaking. I'm pleased to know that there is help for all animals.,PETA (People for the Ethical Treatment of Animals),officialpeta
EbVtOVt6rzQ,God bless you for all the good work you do.   My hear is full of hope for a better future for animals. Please be the voice of many animals  that had been abuse by ignorant and brutally people.,PETA (People for the Ethical Treatment of Animals),officialpeta
EbVtOVt6rzQ,Que lindos  son,PETA (People for the Ethical Treatment of Animals),officialpeta
EbVtOVt6rzQ,Im not vegan but i support u peta,PETA (People for the Ethical Treatment of Animals),officialpeta
EbVtOVt6rzQ,Yesss,PETA (People for the Ethical Treatment of Animals),officialpeta
EbVtOVt6rzQ,Thanks for the good work! I really respect how you keep going despite the hate/controversy coming your way,PETA (People for the Ethical Treatment of Animals),officialpeta
EbVtOVt6rzQ,Except they are still serving the octopuses at those restaurants. Big deal they agreed with you,PETA (People for the Ethical Treatment of Animals),officialpeta
EbVtOVt6rzQ,Hey  let's just inform everyone and do pointless protests that aren't going to do anything instead of actually doing something,PETA (People for the Ethical Treatment of Animals),officialpeta
EbVtOVt6rzQ,Lost all respect to you bc of the logan dead rat video,PETA (People for the Ethical Treatment of Animals),officialpeta
EbVtOVt6rzQ,Found a video of a person beating a dog https://youtu.be/M34OyoBsXUk,PETA (People for the Ethical Treatment of Animals),officialpeta
EbVtOVt6rzQ,This is why PETA should cease to exist. Holy shit  I'm getting goosebumps,PETA (People for the Ethical Treatment of Animals),officialpeta
EbVtOVt6rzQ,Hell yeah peta!,PETA (People for the Ethical Treatment of Animals),officialpeta
EbVtOVt6rzQ,Thanks PETA for ruining a bunch of companies. And no Ill never be vegan,PETA (People for the Ethical Treatment of Animals),officialpeta
EbVtOVt6rzQ,Thank you for saving these sweet innocent creatures,PETA (People for the Ethical Treatment of Animals),officialpeta
EbVtOVt6rzQ,Nice Peta  I love you,PETA (People for the Ethical Treatment of Animals),officialpeta
EbVtOVt6rzQ,Thank you.,PETA (People for the Ethical Treatment of Animals),officialpeta
EbVtOVt6rzQ,Way to go! Keep up the good works. For the animals  for the planet  for our health!,PETA (People for the Ethical Treatment of Animals),officialpeta
EbVtOVt6rzQ,L,PETA (People for the Ethical Treatment of Animals),officialpeta
EbVtOVt6rzQ,Yes! Thank for working hard to stop unnecessary cruelty!,PETA (People for the Ethical Treatment of Animals),officialpeta
0i78UxT_bWs,that has too be tililkum,PETA (People for the Ethical Treatment of Animals),officialpeta
0i78UxT_bWs,Wot happens to poore orcas who get realeesed to wild they wud get killed I lovee seawurld so dont  close it!!!!!!!!,PETA (People for the Ethical Treatment of Animals),officialpeta
0i78UxT_bWs,This hurts so much...,PETA (People for the Ethical Treatment of Animals),officialpeta
0i78UxT_bWs,Cough cough TILIKUM PART TWO,PETA (People for the Ethical Treatment of Animals),officialpeta
0i78UxT_bWs,Say  I never asked. Aside from sea world  what do you think of the other aquariums? (Downtown Texas  shedd  Monterey bay  Seattle  Tennessee  etc)  Edit: start talking mad shit about the shedd  you start talking mad shit about my Chicago pride,PETA (People for the Ethical Treatment of Animals),officialpeta
0i78UxT_bWs,0:26 - and yet PETA still tries to pin his capture on SeaWorld. none of SeaWorlds wild caught orcas (a massive number of 3) where caught by the park. Corky 2 came from Marineland of the Pacific  Katina came from another zoo (i can't remember which.) and Ulises came from the Barcelona Zoo.,PETA (People for the Ethical Treatment of Animals),officialpeta
0i78UxT_bWs,0:16 - oh look. even more Bullshit. female calves will split form their mothers to make "sub pods" once they sexually mature and have a calf. it is normal and completely natural. Bull Males will often split from the main pod to join one of said "sub pods.",PETA (People for the Ethical Treatment of Animals),officialpeta
0i78UxT_bWs,0:11 that's a loud of Bullshit. NAKAI has the tallest dorsal fin.  https://vignette.wikia.nocookie.net/orcapod/images/6/64/Valerie_broesch_edrttgh.jpg/revision/latest?cb=20141119064636 look at that. and PETA says all orcas at SeaWorld have collapsed dorsal fins because they are depressed. news flash  you're wrong. on both statements not all of SeaWorlds orcas have collapsed dorsal fins and dorsal fins do not collapse because of depression.  these guys must be depressed then. https://swimmingfree.files.wordpress.com/2011/11/collapseddorsal.jpg http://h7.alamy.com/comp/ACM9YE/killer-whale-orcinus-orca-monterey-bay-california-wild-male-with-collapsed-ACM9YE.jpg http://www.digitaljournal.com/image/190922 http://wildwhales.org/wp-content/uploads/2014/07/Yuculta-Crop.jpg https://pbs.twimg.com/media/CNgMRQlUcAI_mrn.jpg https://pbs.twimg.com/media/CNgMRa3U8AAc5qN.jpg https://pbs.twimg.com/media/CNgMRa2VEAAWZXf.jpg http://wildwhales.org/wp-content/uploads/2014/07/comparison.png http://wildwhales.org/wp-content/uploads/2014/07/B7s-crop.jpg  look at all these completely wild whales  oh well. they must just be depressed :),PETA (People for the Ethical Treatment of Animals),officialpeta
0i78UxT_bWs,0:06 - actually  Ulises is 40  10 years older than the life expectancy for wild male orcas.,PETA (People for the Ethical Treatment of Animals),officialpeta
0i78UxT_bWs,i love that not all of this footage is even Ulises and they try to make it seem like they still catch orcas from the wild when they haven't been caught in over 30 years. Maybe PETA should focus on their own animals instead of killing thousands and then targeting a place that has rescued and released more animals than you have. Not to mention they educate people instead of harassing and bullying others.,PETA (People for the Ethical Treatment of Animals),officialpeta
0i78UxT_bWs,Seaworld sucks dick,PETA (People for the Ethical Treatment of Animals),officialpeta
0i78UxT_bWs,Orcas deserve freedom #emptythetanks.,PETA (People for the Ethical Treatment of Animals),officialpeta
0i78UxT_bWs,I caught my pb bass yesterday,PETA (People for the Ethical Treatment of Animals),officialpeta
0i78UxT_bWs,https://www.youtube.com/watch?v=8f9m-mt3JZY&t=280s please hate on this innocent wildlife murderer and maybe report him to the animal rescue entre if you can,PETA (People for the Ethical Treatment of Animals),officialpeta
0i78UxT_bWs,This Is why I fucking hate peta,PETA (People for the Ethical Treatment of Animals),officialpeta
0i78UxT_bWs,What about Lolita  and Kshamenk? PETA has failed to raise awareness about these animals who are truly being neglected.,PETA (People for the Ethical Treatment of Animals),officialpeta
0i78UxT_bWs,Get your head out of your ass and stand up for animals that are actually suffering  instead of attacking one of the best zoological facilities in the world.,PETA (People for the Ethical Treatment of Animals),officialpeta
0i78UxT_bWs,0:41 who the heck is that? it's an orca from Loro Parque i think. but it's not freaking Ulises. just like them using footage of Orkid at 1:06. man  PETA really needs to learn how to ID these orcas.,PETA (People for the Ethical Treatment of Animals),officialpeta
0i78UxT_bWs,You you guys,PETA (People for the Ethical Treatment of Animals),officialpeta
0i78UxT_bWs,Why are your videos square,PETA (People for the Ethical Treatment of Animals),officialpeta
0i78UxT_bWs,1:06 in a video about Ulises  why are you using footage of Orkid?,PETA (People for the Ethical Treatment of Animals),officialpeta
0i78UxT_bWs,Oh my god all these fucking emotional vegans crying over animals. We're humans we're fucking superior to them  we are supposed to kill and eat them thats how it fucking works dumbasses. What would you fucking do if you're being mauled by a lion and have a knife? Would you fucking spare him because "animal lives matter" and be killed by it? Also  PETA itself kills animals.,PETA (People for the Ethical Treatment of Animals),officialpeta
0i78UxT_bWs,Because there's "nothing wrong with captivity"...  http://www.mdpi.com/2076-2615/6/8/49/htm  https://www.ncbi.nlm.nih.gov/pmc/articles/PMC3168481/  http://www.slate.com/blogs/wild_things/2014/06/17/seaworld_orca_research_importance_of_captive_killer_whale_studies_was_exaggerated.html?wpisrc=burger_bar,PETA (People for the Ethical Treatment of Animals),officialpeta
0i78UxT_bWs,Atleast he's not being killed by peta like 90% of the other animals in peta killed for no reason  hypocrites.,PETA (People for the Ethical Treatment of Animals),officialpeta
0i78UxT_bWs,PETA: Don't buy a ticket! Empty the tanks!  Also PETA: Has bought over 50 SeaWorld tickets...  Me: Now that is a new kind of stupid,PETA (People for the Ethical Treatment of Animals),officialpeta
0i78UxT_bWs,For everyone in the comments and peta  there is a disgusting  cruel video I want to show you. https://youtu.be/xoY5EgVGtn8 plz dislike  report  and leave a hate comment like "leave innocent creatures alone",PETA (People for the Ethical Treatment of Animals),officialpeta
0i78UxT_bWs,Hahaha dance water boi,PETA (People for the Ethical Treatment of Animals),officialpeta
0i78UxT_bWs,Sure let's fundraise for the sanctuaries,PETA (People for the Ethical Treatment of Animals),officialpeta
0i78UxT_bWs,I can't stand this,PETA (People for the Ethical Treatment of Animals),officialpeta
0i78UxT_bWs,Cough PETA slaughters animals themselves Cough,PETA (People for the Ethical Treatment of Animals),officialpeta
0i78UxT_bWs,#freeulises,PETA (People for the Ethical Treatment of Animals),officialpeta
DGfUU1tuo2A,You're right  the fur/animalmeat industries often abuse animals  and they suffer needlessly. Modern industrial farms are disgusting and any health-conscious person should avoid that food. But do you (vegans) think there's anything wrong with killing a deer  for example  as long as you do so in moderation (only when needed)  respect the animals  and let none of it go to waste? This is how our primitive forebears lived  and survived. How can there be anything wrong with quickly killing your prey  if you respect its life and waste none of it? Killing other animals is not only a human  behavior - all secondary consumers do this. That is to say  it's a fundamental aspect of life. So surely you're not opposed to the fact that animals (including humans) kill other animals  but only to modern industrial farms that make animals suffer  right?,PETA (People for the Ethical Treatment of Animals),officialpeta
DGfUU1tuo2A,I would wear this bitch on my dick!,PETA (People for the Ethical Treatment of Animals),officialpeta
DGfUU1tuo2A,Some animals are invasive though. Where I live  coyotes have killed off most of the other predators and the animals they hunted have overpopulated the area. People hunt coyotes for fur and bring back helpful animals  like wolves.,PETA (People for the Ethical Treatment of Animals),officialpeta
DGfUU1tuo2A,>:( https://youtu.be/4TTyUYOsyCs,PETA (People for the Ethical Treatment of Animals),officialpeta
DGfUU1tuo2A,I wear fake leather jacket,PETA (People for the Ethical Treatment of Animals),officialpeta
DGfUU1tuo2A,El Chapo approves,PETA (People for the Ethical Treatment of Animals),officialpeta
DGfUU1tuo2A,Hmm,PETA (People for the Ethical Treatment of Animals),officialpeta
DGfUU1tuo2A,First comment yaaaaay,PETA (People for the Ethical Treatment of Animals),officialpeta
8cJF8j7OJdA,Dogs  Cats  Humans  etc = MEAT Meat = Food,PETA (People for the Ethical Treatment of Animals),officialpeta
8cJF8j7OJdA,Besides for the dogs,PETA (People for the Ethical Treatment of Animals),officialpeta
8cJF8j7OJdA,All people who are with peta suck,PETA (People for the Ethical Treatment of Animals),officialpeta
8cJF8j7OJdA,If that is bad if I live my dog,PETA (People for the Ethical Treatment of Animals),officialpeta
8cJF8j7OJdA,Going vegan doesn't solve the world's problems. But at least it is doing something. It opens up conversation with many people and encourages me and others to research and actively try to do our part to help the environment and animals. All anyone can do is their best  and that's what I'm trying for.,PETA (People for the Ethical Treatment of Animals),officialpeta
8cJF8j7OJdA,I bet ur probably gonna try to sue me or something stupid like that.,PETA (People for the Ethical Treatment of Animals),officialpeta
8cJF8j7OJdA,Plus u can try to save some of the stray dogs. But most of them get put down.,PETA (People for the Ethical Treatment of Animals),officialpeta
8cJF8j7OJdA,There is plastic garbage patches  deforestation  frogs in rainforests going extinct. And all you have to say is go vegan. Not everybody is going to change people are not perfect.,PETA (People for the Ethical Treatment of Animals),officialpeta
8cJF8j7OJdA,OMG,PETA (People for the Ethical Treatment of Animals),officialpeta
8cJF8j7OJdA,First comment,PETA (People for the Ethical Treatment of Animals),officialpeta
XcQOtC2w7m8,YAY!,PETA (People for the Ethical Treatment of Animals),officialpeta
XcQOtC2w7m8,THANK YOU PETA,PETA (People for the Ethical Treatment of Animals),officialpeta
XcQOtC2w7m8,Hallelujah,PETA (People for the Ethical Treatment of Animals),officialpeta
XcQOtC2w7m8,Peta puts down more animals then it  saves fact,PETA (People for the Ethical Treatment of Animals),officialpeta
XcQOtC2w7m8,Just recently  scientists found out that plants know when they are being eaten         Also they tested a cure for cancer on mice and will soon use it for humans with cancer      I eat ice so I am an ice vegan.,PETA (People for the Ethical Treatment of Animals),officialpeta
XcQOtC2w7m8,Oh  what's this? PETA killed 1 600 animals in this month as well? Ooh juicy  just like my favorite food: cheeseburgers,PETA (People for the Ethical Treatment of Animals),officialpeta
XcQOtC2w7m8,Yes finally,PETA (People for the Ethical Treatment of Animals),officialpeta
XcQOtC2w7m8,Your activist is annoying us. Make sure to grab a weapon to scare them off!,PETA (People for the Ethical Treatment of Animals),officialpeta
XcQOtC2w7m8,Peta is awesome!!!,PETA (People for the Ethical Treatment of Animals),officialpeta
XcQOtC2w7m8,some of this is just you guys not wanting us to have fun. thanks for ruining my dream of seeing the orcas.,PETA (People for the Ethical Treatment of Animals),officialpeta
