videoId,comment,channelId,channelName
s5vrZK83JBw,I love Bob Barker,PETA (People for the Ethical Treatment of Animals),officialpeta
s5vrZK83JBw,Thanks Bob  I hope they listen,PETA (People for the Ethical Treatment of Animals),officialpeta
s5vrZK83JBw,Man  Barker's eyebrows are almost completely gone.,PETA (People for the Ethical Treatment of Animals),officialpeta
s5vrZK83JBw,Looking good Mr Bob :keep up the good work Sir  thanks for being an amazing host on the price is right!!,PETA (People for the Ethical Treatment of Animals),officialpeta
s5vrZK83JBw,Wow I didn't Bob was still alive!,PETA (People for the Ethical Treatment of Animals),officialpeta
s5vrZK83JBw,nice and all but you have offer pay if you want something,PETA (People for the Ethical Treatment of Animals),officialpeta
s5vrZK83JBw,This sounds like what happen to black people 500 years ago?,PETA (People for the Ethical Treatment of Animals),officialpeta
s5vrZK83JBw,Bob will never stop me from eating meat! Stake will forever be in my life... So GO AWAY BOB,PETA (People for the Ethical Treatment of Animals),officialpeta
s5vrZK83JBw,Thank You Maestro Barker!!!,PETA (People for the Ethical Treatment of Animals),officialpeta
s5vrZK83JBw,PETA please do something for dogs in Asian countries.  I have urged you many times. But I don't think so you have done anything for them . please  help because their sorrow suffering is intolerable.,PETA (People for the Ethical Treatment of Animals),officialpeta
s5vrZK83JBw,Right on Bob. You and PETA have done so much to bring awareness to the horrors of captive animals and marine mammals  I am truly grateful for your dedication.,PETA (People for the Ethical Treatment of Animals),officialpeta
s5vrZK83JBw,Lol I had a burger for dinner and damn was it good. Probably struggled to death too.,PETA (People for the Ethical Treatment of Animals),officialpeta
s5vrZK83JBw,Orca meat tastes so good.,PETA (People for the Ethical Treatment of Animals),officialpeta
s5vrZK83JBw,oh god it is peta,PETA (People for the Ethical Treatment of Animals),officialpeta
s5vrZK83JBw,Xxx,PETA (People for the Ethical Treatment of Animals),officialpeta
s5vrZK83JBw,I love you Bob Barker. Everyone should be so dedicated until the point of death to speak for the animals.,PETA (People for the Ethical Treatment of Animals),officialpeta
s5vrZK83JBw,oh my goodness thank you so much Bob Barker!,PETA (People for the Ethical Treatment of Animals),officialpeta
s5vrZK83JBw,You people make me sick.You act like you love animals when really in earlier years you have killed animals just because you can  stolen people's pets,PETA (People for the Ethical Treatment of Animals),officialpeta
s5vrZK83JBw,do something about rattlesnake roundups and expose them please peta,PETA (People for the Ethical Treatment of Animals),officialpeta
s5vrZK83JBw,Meat is the best type of food,PETA (People for the Ethical Treatment of Animals),officialpeta
s5vrZK83JBw,Why do you hate Nintendo?,PETA (People for the Ethical Treatment of Animals),officialpeta
s5vrZK83JBw,It's the least they can do,PETA (People for the Ethical Treatment of Animals),officialpeta
s5vrZK83JBw,How wonderful to see Bob Barker still doing his good work for animals. If Miami Seaquarium wishes to justify its existence and put a good foot forward they need to heed his good and kind advice  NOW!,PETA (People for the Ethical Treatment of Animals),officialpeta
s5vrZK83JBw,The disgusting scumbags will probably decline claiming to be concerned the transition would harm her. It's beyond insane that they can get away with this.,PETA (People for the Ethical Treatment of Animals),officialpeta
_Dmih262i3A,I'm so gonna kill his character Matt in until dawn now,PETA (People for the Ethical Treatment of Animals),officialpeta
_Dmih262i3A,its so adorable and jorden fisher is so nice.you know when you blow candles off a cake on your birthday then make a wish my wish was to meet jorden fisher one day.,PETA (People for the Ethical Treatment of Animals),officialpeta
_Dmih262i3A,Adorable pup,PETA (People for the Ethical Treatment of Animals),officialpeta
_Dmih262i3A,No i have a cockatiel and a cockatoo,PETA (People for the Ethical Treatment of Animals),officialpeta
_Dmih262i3A,I adopted a cockatoo i love him and he loves me we watch the video he is on my sholder,PETA (People for the Ethical Treatment of Animals),officialpeta
_Dmih262i3A,Just when I thought I couldn't have more respect for Jordan he goes and does this. I completely agree. I love animals more than most people. Sora is a handsome guy and I'm so happy he found a forever loving home.,PETA (People for the Ethical Treatment of Animals),officialpeta
_Dmih262i3A,I am so proud of you Jordan,PETA (People for the Ethical Treatment of Animals),officialpeta
_Dmih262i3A,Great video no idea who you are im british lol but what you say is real your pets will listen even if they dont want to hear lol good one you.,PETA (People for the Ethical Treatment of Animals),officialpeta
_Dmih262i3A,I have an adopted Pug  Buster  who is so cute and loves my toddler daughter!,PETA (People for the Ethical Treatment of Animals),officialpeta
_Dmih262i3A,Please help save an innocent dog! they put him down tomorrow~  https://www.change.org/p/cohoes-city-court-save-bane,PETA (People for the Ethical Treatment of Animals),officialpeta
_Dmih262i3A,Please someone read this ASAP !!!!!!! the owner left the dog inside the car for 8 hours ... luckily someone saw and helped the dog ... when the dog owner got to the location ... she even scolded the dog's helper & did not feel guilty  for the owner her dog was used with that. This happen in indonesia.... https://www.facebook.com/tommyprabowo/posts/10212487398312956,PETA (People for the Ethical Treatment of Animals),officialpeta
_Dmih262i3A,First comment,PETA (People for the Ethical Treatment of Animals),officialpeta
z1ISa6e0YbM,I wonder if they have the same compassion for an aborted baby.,PETA (People for the Ethical Treatment of Animals),officialpeta
z1ISa6e0YbM,seaworld is the worst place for orcas,PETA (People for the Ethical Treatment of Animals),officialpeta
z1ISa6e0YbM,leave orcas in the wild,PETA (People for the Ethical Treatment of Animals),officialpeta
z1ISa6e0YbM,help build a whale sanctuary at this link by donating https://whalesanctuaryproject.org/,PETA (People for the Ethical Treatment of Animals),officialpeta
z1ISa6e0YbM,This is bullshit and so is blackfish  my aunt has been a trainer here in San Diego for twenty years. This is frustrating,PETA (People for the Ethical Treatment of Animals),officialpeta
z1ISa6e0YbM,Once again PETA is using nudity to gain the attention of their target audience. "Ok ladies this video is about killer whales so let's take off those clothes". Nothing to do with the subject matter and frankly it's kind of pathetic. #StandWithSeaWorld #BoycottPETA,PETA (People for the Ethical Treatment of Animals),officialpeta
z1ISa6e0YbM,They look gorgeous ....great cause,PETA (People for the Ethical Treatment of Animals),officialpeta
z1ISa6e0YbM,Most of these vegans are pro abortion..,PETA (People for the Ethical Treatment of Animals),officialpeta
z1ISa6e0YbM,So scripted they suck,PETA (People for the Ethical Treatment of Animals),officialpeta
z1ISa6e0YbM,Boring,PETA (People for the Ethical Treatment of Animals),officialpeta
z1ISa6e0YbM,Ok that's great...   But do these women wear Fur ???   Because I can see beautiful women and they all love Fur... So I am wondering...,PETA (People for the Ethical Treatment of Animals),officialpeta
z1ISa6e0YbM,Peta  please  can you talk about Poaching  Deforestation  Global Warming  and Pollution? CAN I JUST ASK ONE OF THESE VIDEOS PLEASE??? I WATCHED YOUR VIDEO AND NONE OF THEM ARE RELATED TO IT!!!,PETA (People for the Ethical Treatment of Animals),officialpeta
z1ISa6e0YbM,The sad thing is I never saw anything PETA until I subscribed to this channel and by then had already gone vegan...I hope they're actually getting across to your average person.,PETA (People for the Ethical Treatment of Animals),officialpeta
z1ISa6e0YbM,They all should be eaten instead,PETA (People for the Ethical Treatment of Animals),officialpeta
z1ISa6e0YbM,PETA  u kill animals. Kys PETA,PETA (People for the Ethical Treatment of Animals),officialpeta
z1ISa6e0YbM,My last resort to getting nudes.......,PETA (People for the Ethical Treatment of Animals),officialpeta
z1ISa6e0YbM,I have a Vegan boner... =),PETA (People for the Ethical Treatment of Animals),officialpeta
z1ISa6e0YbM,Cease your faggotry.,PETA (People for the Ethical Treatment of Animals),officialpeta
z1ISa6e0YbM,i support Seaworld,PETA (People for the Ethical Treatment of Animals),officialpeta
z1ISa6e0YbM,Why do they find a passion and appear to be "experts" after watching a 90 minute "documentary"?,PETA (People for the Ethical Treatment of Animals),officialpeta
z1ISa6e0YbM,Wtf!?  they are not vegan or care about any animals there handbags are made out of animals !  They eat animals and fish! There make up is tested on Animals.,PETA (People for the Ethical Treatment of Animals),officialpeta
z1ISa6e0YbM,Hey peta  do you hate humans?,PETA (People for the Ethical Treatment of Animals),officialpeta
z1ISa6e0YbM,I hope their fans listen.,PETA (People for the Ethical Treatment of Animals),officialpeta
z1ISa6e0YbM,We all need too speak out I'm a voice are you?,PETA (People for the Ethical Treatment of Animals),officialpeta
z1ISa6e0YbM,I'm with you,PETA (People for the Ethical Treatment of Animals),officialpeta
z1ISa6e0YbM,Scheana is my favorite  but they're all hot!!! BOYCOTT SEAWORLD,PETA (People for the Ethical Treatment of Animals),officialpeta
z1ISa6e0YbM,Great message. Seaworld sucks.,PETA (People for the Ethical Treatment of Animals),officialpeta
z1ISa6e0YbM,=> GO VEGAN ACTIVIST & ZERO WASTE !,PETA (People for the Ethical Treatment of Animals),officialpeta
z1ISa6e0YbM,This is so beautiful Standing up for Orca wise and standing up for peen wise,PETA (People for the Ethical Treatment of Animals),officialpeta
z1ISa6e0YbM,Sea World Sucks!!!!,PETA (People for the Ethical Treatment of Animals),officialpeta
xsBxlZwS5Qg,China very bad to animals.,PETA (People for the Ethical Treatment of Animals),officialpeta
xsBxlZwS5Qg,The Chinese are Trogolodytes  sub-human ignorant monsters.,PETA (People for the Ethical Treatment of Animals),officialpeta
xsBxlZwS5Qg,Can I please stick your ugly ass in a cage and do this to you?,PETA (People for the Ethical Treatment of Animals),officialpeta
xsBxlZwS5Qg,They eat dogs so not that big of a deal,PETA (People for the Ethical Treatment of Animals),officialpeta
xsBxlZwS5Qg,Calm your tits its just a fucking movie,PETA (People for the Ethical Treatment of Animals),officialpeta
xsBxlZwS5Qg,WHAT KIND OF SICK BARBARIC EVIL INHUMAN DEMONS CHINAS ARE =REAL DEVIL AND FUCKED UP !!!BOYCOTT CHINA TOTALY !!!,PETA (People for the Ethical Treatment of Animals),officialpeta
xsBxlZwS5Qg,Chinese bastards,PETA (People for the Ethical Treatment of Animals),officialpeta
xsBxlZwS5Qg,"dropped into a frigid river" dafuq? That's animal abuse,PETA (People for the Ethical Treatment of Animals),officialpeta
xsBxlZwS5Qg,Thank you PETA,PETA (People for the Ethical Treatment of Animals),officialpeta
xsBxlZwS5Qg,way more sources of you taking dogs of porches,PETA (People for the Ethical Treatment of Animals),officialpeta
xsBxlZwS5Qg,Should I not go to China?,PETA (People for the Ethical Treatment of Animals),officialpeta
xsBxlZwS5Qg,People should picket the movie for the abuse of the German Shepherd.,PETA (People for the Ethical Treatment of Animals),officialpeta
xsBxlZwS5Qg,Terrible country.,PETA (People for the Ethical Treatment of Animals),officialpeta
xsBxlZwS5Qg,Slanty eyed subhumans over there should be tied up and tortured to fucking death slowly!!!!!,PETA (People for the Ethical Treatment of Animals),officialpeta
xsBxlZwS5Qg,PETA is just a bunch of dumb fuckers. They steal people's pets and kill them.,PETA (People for the Ethical Treatment of Animals),officialpeta
xsBxlZwS5Qg,It was a fake dog,PETA (People for the Ethical Treatment of Animals),officialpeta
xsBxlZwS5Qg,I ain't arguing about killing dog but bieng vegan is like bieng d heads,PETA (People for the Ethical Treatment of Animals),officialpeta
xsBxlZwS5Qg,Fucking disgusting pricks,PETA (People for the Ethical Treatment of Animals),officialpeta
xsBxlZwS5Qg,Boycott the movie!  Pieces of shit cowards.,PETA (People for the Ethical Treatment of Animals),officialpeta
xsBxlZwS5Qg,Get this director and put him through the grater. Him and his piece of shit producers.,PETA (People for the Ethical Treatment of Animals),officialpeta
xsBxlZwS5Qg,What is wrong with using a dog to make a movie!,PETA (People for the Ethical Treatment of Animals),officialpeta
xsBxlZwS5Qg,Did they eat it after,PETA (People for the Ethical Treatment of Animals),officialpeta
xsBxlZwS5Qg,Save that dog please,PETA (People for the Ethical Treatment of Animals),officialpeta
xsBxlZwS5Qg,NO,PETA (People for the Ethical Treatment of Animals),officialpeta
xsBxlZwS5Qg,so they can eat it but they can`t make films with them   white people logic,PETA (People for the Ethical Treatment of Animals),officialpeta
xsBxlZwS5Qg,China has long way to go  especially when it comes to animal rights  the cruelty towards dogs but also other animals is a very common thing in China.,PETA (People for the Ethical Treatment of Animals),officialpeta
xsBxlZwS5Qg,ABSOLUTE.FUCKING.BASTARDS.,PETA (People for the Ethical Treatment of Animals),officialpeta
xsBxlZwS5Qg,Stop down voting the video. All it does it get the video hidden.,PETA (People for the Ethical Treatment of Animals),officialpeta
xsBxlZwS5Qg,Lets do this to the people who did this and see how they like it!,PETA (People for the Ethical Treatment of Animals),officialpeta
xsBxlZwS5Qg,What with powdered Rhino horn ... Dog meat festivals And now this .. come on China the world hates this shit  :'(,PETA (People for the Ethical Treatment of Animals),officialpeta
xsBxlZwS5Qg,Fuck,PETA (People for the Ethical Treatment of Animals),officialpeta
xsBxlZwS5Qg,Why are you guys so surprised this happens a lot so if you think that making videos about it is going to help at all you are just a bunch of lazy bums.,PETA (People for the Ethical Treatment of Animals),officialpeta
xsBxlZwS5Qg,IF I WERE TO SHARE MY FEELINGS RIGHT NOW THIS COMMENT WOULD BE 18 PARAGRAPHS LONG. SO LETS KEEP IT SHORT..... WHY DO PEOPLE DO THIS ITS NOT RIGHT WHAT IF YOU WERE A DOG OR ANY ANIMAL THATS IS GETTING ABUSED OR NEGLECTED YOU WOULD IT WOULD CHANGE YOUR PERSPECTIVE IMMEDIATELY THESE PEOPLE JUST MAKE ME SICK HAVENT YOU HEARD OF A GREEN SCREEN?!?!,PETA (People for the Ethical Treatment of Animals),officialpeta
xsBxlZwS5Qg,Mother fckers director,PETA (People for the Ethical Treatment of Animals),officialpeta
xsBxlZwS5Qg,Did the dog survive this abuse!,PETA (People for the Ethical Treatment of Animals),officialpeta
xsBxlZwS5Qg,No! Poor Doggo!,PETA (People for the Ethical Treatment of Animals),officialpeta
xsBxlZwS5Qg,Oh and hunting season open up in my town me and my father are planing on going hunting so take that and kiss my ass,PETA (People for the Ethical Treatment of Animals),officialpeta
xsBxlZwS5Qg,This is a picnic compared what they do to Dogs and Cats in china!   Absolutely sickening!   Google appalling "Lychee and Dog Meat Festival" in China.,PETA (People for the Ethical Treatment of Animals),officialpeta
xsBxlZwS5Qg,Jellyfish killed 100k+ salmon in the coasts of Ireland.,PETA (People for the Ethical Treatment of Animals),officialpeta
xsBxlZwS5Qg,That shit's not cool. Fucking China. Figures they eat dogs too.,PETA (People for the Ethical Treatment of Animals),officialpeta
xsBxlZwS5Qg,I hate how whenever there is not a white person in the video people hurl out 'labels'  'tags' that they force upon individuals. And insult people for how they were born. You Humans are sad. *Shakes head* It's so ironically funny how we can't even treat each other with respect. Not a surprise that many of use mistreat the very rock we live on and everything on it. And you expect better? Be better then. All of you. My God.,PETA (People for the Ethical Treatment of Animals),officialpeta
xsBxlZwS5Qg,did the dog live???????,PETA (People for the Ethical Treatment of Animals),officialpeta
xsBxlZwS5Qg,Peta UK see pets at home so see if it's non cruel,PETA (People for the Ethical Treatment of Animals),officialpeta
xsBxlZwS5Qg,Sick,PETA (People for the Ethical Treatment of Animals),officialpeta
xsBxlZwS5Qg,To all the people denigrating the Chinese  please don't be so bigoted. There's a huge backlash in China to this. Historically  they have people alive today who managed to lived through famine with tens of millions starving to death. America had slavery and  until just after the second world war  segregation of people of colour. So  please stop with the sweeping bigotry and blame just those involved  and not a nation. China is for sure changing as it modernises from a very complex and damaging history  and it has a long way to go  but there's no need to be slanderous about a whole nation.,PETA (People for the Ethical Treatment of Animals),officialpeta
xsBxlZwS5Qg,SICKENING!!!,PETA (People for the Ethical Treatment of Animals),officialpeta
xsBxlZwS5Qg,Fucking chinese guys doesn't even care  because they eat dog meat,PETA (People for the Ethical Treatment of Animals),officialpeta
xsBxlZwS5Qg,Disgusting vile people,PETA (People for the Ethical Treatment of Animals),officialpeta
xsBxlZwS5Qg,what the hell is wrong with these people they're just sick. I feel so bad for that poor dog,PETA (People for the Ethical Treatment of Animals),officialpeta
xsBxlZwS5Qg,Why?,PETA (People for the Ethical Treatment of Animals),officialpeta
xsBxlZwS5Qg,Gooks. What do we expect? I'm surprised the dog wasn't fed to the crew at catering after shooting wrapped.  Or... was it?,PETA (People for the Ethical Treatment of Animals),officialpeta
xsBxlZwS5Qg,SICK EVIL SUBHUMAN IDIOTS.,PETA (People for the Ethical Treatment of Animals),officialpeta
xsBxlZwS5Qg,PETA listen to me      Not every fucking person is like this and the people who do this are brain dead,PETA (People for the Ethical Treatment of Animals),officialpeta
xsBxlZwS5Qg,All of these people can choke as far as I'm concerned. Repulsive.,PETA (People for the Ethical Treatment of Animals),officialpeta
xsBxlZwS5Qg,*Stupid movie! They torture dogs!*,PETA (People for the Ethical Treatment of Animals),officialpeta
xsBxlZwS5Qg,Ok Peta! I have an idea for a video!!!! You should make a video about Paintbrushes! Like brushes made from the hair from animals. Like if you want peta to make a video about hair paintbrushes!!!!!,PETA (People for the Ethical Treatment of Animals),officialpeta
xsBxlZwS5Qg,That's brutal act and same people should be put in same crate and dropped 1000 feet down to know how the dog might have felt.,PETA (People for the Ethical Treatment of Animals),officialpeta
xsBxlZwS5Qg,Karma needs to kick their asses NOW!  so sick of animal abuse. A curse on these scum.,PETA (People for the Ethical Treatment of Animals),officialpeta
xsBxlZwS5Qg,Nice work PETA!,PETA (People for the Ethical Treatment of Animals),officialpeta
xsBxlZwS5Qg,You're talking about a nation that used anti-aircraft guns on unarmed protesters in Tiananmen Square so yeah  lucky dog is still alive,PETA (People for the Ethical Treatment of Animals),officialpeta
xsBxlZwS5Qg,How sickening! Will NEVER watch this shithole movie!,PETA (People for the Ethical Treatment of Animals),officialpeta
xsBxlZwS5Qg,34th comment,PETA (People for the Ethical Treatment of Animals),officialpeta
xsBxlZwS5Qg,Fucking humans thoes Chinese motherfuckers I wanna kill em all,PETA (People for the Ethical Treatment of Animals),officialpeta
xsBxlZwS5Qg,Poor baby!,PETA (People for the Ethical Treatment of Animals),officialpeta
xsBxlZwS5Qg,*They are carnists and also probably eat dogs  as if they care about dogs or animals in general.*,PETA (People for the Ethical Treatment of Animals),officialpeta
xsBxlZwS5Qg,is anything being done ?? i want to know !,PETA (People for the Ethical Treatment of Animals),officialpeta
xsBxlZwS5Qg,I'm not trying to say this is alright  but they're Chinese they don't really give a shit about dogs.,PETA (People for the Ethical Treatment of Animals),officialpeta
xsBxlZwS5Qg,so wrong poor dog,PETA (People for the Ethical Treatment of Animals),officialpeta
xsBxlZwS5Qg,What are they even doing?,PETA (People for the Ethical Treatment of Animals),officialpeta
xsBxlZwS5Qg,This is disgusting,PETA (People for the Ethical Treatment of Animals),officialpeta
xsBxlZwS5Qg,Poor dog,PETA (People for the Ethical Treatment of Animals),officialpeta
4xpYBqN6FCs,How dare you...,PETA (People for the Ethical Treatment of Animals),officialpeta
4xpYBqN6FCs,https://www.youtube.com/watch?v=YWOyhfgCppY,PETA (People for the Ethical Treatment of Animals),officialpeta
4xpYBqN6FCs,PETA sucks  but I'd listen to James Cromwell read the phonebook  so I hesitate to downvote this...  (Seriously  guys  if you want to help animals  please donate to your local shelters and farm sanctuaries; they always need the money).,PETA (People for the Ethical Treatment of Animals),officialpeta
4xpYBqN6FCs,Sociopaths you all are,PETA (People for the Ethical Treatment of Animals),officialpeta
4xpYBqN6FCs,i eat meat k the end,PETA (People for the Ethical Treatment of Animals),officialpeta
4xpYBqN6FCs,I confess  this commercial is brilliant !!! What would a Catholic omnivore say now?,PETA (People for the Ethical Treatment of Animals),officialpeta
4xpYBqN6FCs,non-human animals are God's creatures are they not? Why would God give them nervous systems and the ability to feel pain fear and emotions  so they would feel pain and suffering and terror when humans exploit them? And the fact we do it for money is even more anti-Jesus. Funny how the right wing American "Christians" who make lots of money  sometimes out of abusing god's animals forget all of the above  isn't it?,PETA (People for the Ethical Treatment of Animals),officialpeta
4xpYBqN6FCs,Great!!!,PETA (People for the Ethical Treatment of Animals),officialpeta
4xpYBqN6FCs,I love it.,PETA (People for the Ethical Treatment of Animals),officialpeta
4xpYBqN6FCs,Evil PETA,PETA (People for the Ethical Treatment of Animals),officialpeta
4xpYBqN6FCs,Hey I agree that animals taste better when not beaten before they die.,PETA (People for the Ethical Treatment of Animals),officialpeta
4xpYBqN6FCs,Why u kill vegetables,PETA (People for the Ethical Treatment of Animals),officialpeta
4xpYBqN6FCs,Very Good...,PETA (People for the Ethical Treatment of Animals),officialpeta
4xpYBqN6FCs,wow  just so much hate in this video.  shame on them :(  just shame,PETA (People for the Ethical Treatment of Animals),officialpeta
4xpYBqN6FCs,yep PETA saves-- not 1800 pets in their care  https://arr.va-vdacs.com/PublicReports/ViewReport?SysFacNo=157&Calendar_Year=2017,PETA (People for the Ethical Treatment of Animals),officialpeta
4xpYBqN6FCs,15 million $ of Vegans donations were paid for this AD)))  Unforgiving vegan priest who didn't read the Bible   @Every moving thing that lives shall be food for you.@ Genesis 9:3-4   Totally worth it LOL)),PETA (People for the Ethical Treatment of Animals),officialpeta
4xpYBqN6FCs,"GET UP  PETER. KILL  AND EAT!",PETA (People for the Ethical Treatment of Animals),officialpeta
4xpYBqN6FCs,I know theres trolls  and I know theres people who are offended or laughing....... but I feel so empowered after watching this commercial. The torture that these animals go through is so pointless. Vegans have proven time and time again that there is no health benefit to eating animals. There's an urgency to go vegan  and billions of lives are at stake. We do have to draw the line somewhere... Go vegan!,PETA (People for the Ethical Treatment of Animals),officialpeta
4xpYBqN6FCs,As usual you have meat eaters acting like petulant children in response to a plea for compassion for nonhuman animals. Pathetic losers. All day long Arby's tells them what to do but when it's vegan they whine "don't tell me what to do". Selfish morons plain and simple.,PETA (People for the Ethical Treatment of Animals),officialpeta
4xpYBqN6FCs,meat eaters leaving comments like they're so afraid somebody is going to take their meat away along with their guns ;),PETA (People for the Ethical Treatment of Animals),officialpeta
4xpYBqN6FCs,It's no wonder why many vegan kids are now getting mineral and vitamin depletion. One can always tell a vegan: sunk in eyes  yellowish skin  lethargy  trouble with comprehension  blurred vision  all as a result of severe mineral and vitamin depletion from not eating a proper diet of meat. Vegan's never look healthy. Perhaps that is why the American Indian was a meat eater.,PETA (People for the Ethical Treatment of Animals),officialpeta
4xpYBqN6FCs,Man I'm starving who's up for some steak or better yet free range chicken which is actually a thing (suprise face!),PETA (People for the Ethical Treatment of Animals),officialpeta
4xpYBqN6FCs,This commercial has really inspired me... I'm going out tonight and buy 10 KFC Buckets of Chicken and then promptly discard them in the trash... oh... the... humanity... 20 chickens just died solely because of this commercial!,PETA (People for the Ethical Treatment of Animals),officialpeta
4xpYBqN6FCs,Wait?! Didn't this guy have a trained pig that led countless sheep to slaughter??! "Att'll do pig  Att'll do !? Now pass the Christmas Roast Duck  Esme! I'm starvin!",PETA (People for the Ethical Treatment of Animals),officialpeta
4xpYBqN6FCs,I thought it was a great ad (Yahoo and their nonstop censorship and propaganda not so much) and I love eating meat too. If God did not want us to eat meat he would have made cows run faster. You never see anyong eating a cheetah. Think about that :-),PETA (People for the Ethical Treatment of Animals),officialpeta
