videoId,comment,channelId,channelName
uC7Nn8fWeEI,What pisses me off about this story is that later she was like "we were just friends" or whatever but BITCH  we girls CAN TELL when a guy likes us. Even more when it's such a sweet guy like Shane. So i can't help but feel like she knew she would hurt him and did nothing to stop it.,shane,shane
uC7Nn8fWeEI,YAS WHEN PINK WALL VID U KNOW ITS GONNA BE GOOD,shane,shane
uC7Nn8fWeEI,omg i freaked out for a sec thinking Shane was cheating on Ryland..,shane,shane
uC7Nn8fWeEI,I already read the book part and now I'm seeing uhh,shane,shane
uC7Nn8fWeEI,Relatable in a way.,shane,shane
uC7Nn8fWeEI,I don't usually comment but I just want to say that I really like what you're doing with this. It takes a lot to open up about past hurt and trauma  more so on the internet. Thank you Shane  for sharing your life with us.,shane,shane
uC7Nn8fWeEI,6:42 fuck god I LOVE YOU <3 I wish I could do the same >.<,shane,shane
uC7Nn8fWeEI,don't feel stupid because you guys didn't do anything. i relate. theres this guy who makes me feel like you felt about her.it felt good. but we didn't do anything  but like you...things happened and i thought things and blah blah. but this video made me feel like I'm not alone for what i feel for this person. love you shane <3,shane,shane
uC7Nn8fWeEI,Shane is me when I have a crush LOL,shane,shane
a8nfrkBIKW0,Lol,shane,shane
a8nfrkBIKW0,Shane be my daddy but not sexually,shane,shane
a8nfrkBIKW0,Y'all will be great parents I wanna go to your house so bad.,shane,shane
a8nfrkBIKW0,OMG HE LOOKS LIKE MORGAN AND SHANE HAD A BABY,shane,shane
a8nfrkBIKW0,Ok so im for garrett with the beard! love it,shane,shane
a8nfrkBIKW0,*A D O P T        H I M*,shane,shane
a8nfrkBIKW0,yes Ryland COME THRU WITH THEM FACES!!! for the photoshoot!,shane,shane
a8nfrkBIKW0,I want them to be parents,shane,shane
a8nfrkBIKW0,Garret: "Oh i found it. right there" shane: "It's a him" looooool that was so funny,shane,shane
a8nfrkBIKW0,aw I can see shane as a dad,shane,shane
a8nfrkBIKW0,MAKE NEW VIDEOS EVERYDAY??? THEN WHERE IS PART FUCKIN 4 OF THE NEW SERIES?!,shane,shane
a8nfrkBIKW0,ADOPTTTTTTTT MEEEEEE PLEASEEEEEE,shane,shane
a8nfrkBIKW0,ADOPT MEEEEEEEEEEEEEEEEEE PLEASSEEEEE I RELATEEE,shane,shane
a8nfrkBIKW0,You guys should adopt me,shane,shane
a8nfrkBIKW0,At 2:53 Shane made me laugh so hard and my dad had to come up and tell me to be quiet,shane,shane
a8nfrkBIKW0,That has to be his kid,shane,shane
a8nfrkBIKW0,wtf?,shane,shane
a8nfrkBIKW0,Adopt me pls,shane,shane
a8nfrkBIKW0,But I'm in line.,shane,shane
a8nfrkBIKW0,I love you and Christoper :""")))))))) I love this video!,shane,shane
a8nfrkBIKW0,Those babies are gonna haunt u lol,shane,shane
a8nfrkBIKW0,chris:why dont we burn one of those shane:witg the kid on it hell yeah,shane,shane
a8nfrkBIKW0,A minute in and she knows it a prank how sad,shane,shane
a8nfrkBIKW0,4:50 Ummm... CONSPIRACY THEORY,shane,shane
a8nfrkBIKW0,Died at goop gun,shane,shane
a8nfrkBIKW0,RIP TOYS R US,shane,shane
a8nfrkBIKW0,Isnt he the kid from lost in space on netflix?,shane,shane
a8nfrkBIKW0,3:30 bring shanayany BAKCKCKDJD,shane,shane
a8nfrkBIKW0,shane needs to adopt me.... i swear to god i love him so much,shane,shane
a8nfrkBIKW0,0:59 Shane Atwood,shane,shane
a8nfrkBIKW0,I wish Shane would adopt me for a day  we have a lot in common but i'm not male... Plus i'm not that much older than Chris,shane,shane
a8nfrkBIKW0,i love shanes mom shes so nice,shane,shane
a8nfrkBIKW0,Is he your real son?,shane,shane
a8nfrkBIKW0,AWEEEEE IM GONNA CRY,shane,shane
a8nfrkBIKW0,Shane and Ryland are such perfect parents. I actually cried at the end!!   I love you guys Xxxx,shane,shane
a8nfrkBIKW0,pink! pink! *SPARKLE SPARKLE* "now imagine her screaming.",shane,shane
a8nfrkBIKW0,I love you Shane Dawson,shane,shane
a8nfrkBIKW0,That kid is awesome lol he's not shy at all,shane,shane
a8nfrkBIKW0,Wait so your gay? No offense or anything,shane,shane
a8nfrkBIKW0,I really wish you guys would foster. You both would be such wonderful parents,shane,shane
a8nfrkBIKW0,I wish I could spend all day with you and ryland and garret and burn stuff with you,shane,shane
a8nfrkBIKW0,10:52 when your feed up with his negativity and bullshit,shane,shane
a8nfrkBIKW0,"Let's blowtorch it" He's definitely Shane's,shane,shane
a8nfrkBIKW0,Where is your son's YouTube? It's not tagged,shane,shane
a8nfrkBIKW0,You should adopt a 12 year old girl *cough* me *cough* and see how it goes!,shane,shane
a8nfrkBIKW0,0:30 you can hear Andrew,shane,shane
a8nfrkBIKW0,*micksy mouse is evil becaus ehe scares people  eats their food ( shane's )  and likes to bite their ass',shane,shane
a8nfrkBIKW0,*daddy duties*,shane,shane
a8nfrkBIKW0,Shane:on a scale 1-10 Child:infinity Shane:do you really think im a good dad Child:maybe,shane,shane
a8nfrkBIKW0,OMG I LOVE THIS!! I'm an up and coming actress myself and I can't even imagine how amazing it would be if Shane Dawson emailed my agency and wanted me for a prank!?!?! I'd literally die. I love pranks and I love shane!,shane,shane
a8nfrkBIKW0,ok I love this child,shane,shane
a8nfrkBIKW0,This is making me question how I will be able to raise a human thing.,shane,shane
a8nfrkBIKW0,The kid Is kinda a jerk  No offense,shane,shane
a8nfrkBIKW0,They NEED children,shane,shane
a8nfrkBIKW0,8:31 WHO FHE FCK IS SAYING THAT,shane,shane
a8nfrkBIKW0,3:05ohmy ohmy ohmygod its ask paris hilton,shane,shane
a8nfrkBIKW0,Why not a girl,shane,shane
a8nfrkBIKW0,The coffen for/from burying ourselves alive video xD,shane,shane
a8nfrkBIKW0,Fake son? Oh I actually believed it,shane,shane
a8nfrkBIKW0,We need more videos with Christopher !! Love him,shane,shane
a8nfrkBIKW0,If Ryland and Shane ever break up my world will end.,shane,shane
a8nfrkBIKW0,Shane: were not filming dead bodies   Logan paul: hold my beer   2018 found dead body in Japan suicide forest,shane,shane
a8nfrkBIKW0,I want to come to your house we can trick your mom together im a 9 year old you can say any bad word cuz i can say bad words.,shane,shane
a8nfrkBIKW0,Now that I think about it I wish Shane was my dad,shane,shane
_95NxbsbMF4,She's sexy. Is she single,shane,shane
_95NxbsbMF4,This is fucking bullshit. I feel so bad for Shane bro. I fucking hate when girls do shit like this. They play with guy's hearts like they are fucking toys. And shut the fuck up if you are saying she doesn't remember all the touching and shit. She fucked up and did not want to assume it. Fucking hoes  bro.,shane,shane
_95NxbsbMF4,Why is she trying to deny shit... ugh stupid bitches,shane,shane
_95NxbsbMF4,Unrelated but what happened with him and shanna malcolm?,shane,shane
_95NxbsbMF4,I feel shane is different around her hehhehe and she looks him like a girlfriend does hehehe,shane,shane
_95NxbsbMF4,ive never seen shane eat salad,shane,shane
_95NxbsbMF4,Aahhh so cuteee,shane,shane
_95NxbsbMF4,Do you guys even think Shane has hung out with her since this....... I'm not saying he's fake but  wouldn't he want to hang out with her more or colab????,shane,shane
_95NxbsbMF4,The ULTIMATE friend zone,shane,shane
_95NxbsbMF4,I forgot about Blair highkey,shane,shane
_95NxbsbMF4,NADINE???????,shane,shane
_95NxbsbMF4,Why am I crying 4 minutes in,shane,shane
_95NxbsbMF4,I know Shane's eyes are blue..but to me they sometimes seem green. Especially when he's talking in the car when it was night time at the end of the video. Does his eyes change colors?,shane,shane
_95NxbsbMF4,Basic af xD Stay with Ryland!,shane,shane
_95NxbsbMF4,F R I E N D Z O N E D,shane,shane
_95NxbsbMF4,WHY DON'T WE SEE MORE OF HER?????? ARE YOU GUYS STILL TALKING AND HANGING OUT???,shane,shane
_95NxbsbMF4,Make a TV show called *reconnect*,shane,shane
_95NxbsbMF4,the ultimate friendzone.,shane,shane
_95NxbsbMF4,She is so cute... Literally saw the little girl in her when she asked him to hang out,shane,shane
_95NxbsbMF4,That was so cute <3<3 when she asked about if you two want to hang out that was so genuine!,shane,shane
_95NxbsbMF4,Her voice is so annoying,shane,shane
_95NxbsbMF4,17:48 I feel like when he said he didn't like the cookies  she looked disappointed but also willing to make up any excuse to hang out with him more. I kinda like their friendship it's cute,shane,shane
_95NxbsbMF4,THATS WHY SHE LOOKS FAMILIAR! I LIVE IN TN AND SHE USED TO! OML...IVE SEEN HER!,shane,shane
_95NxbsbMF4,I live in Tennessee,shane,shane
_95NxbsbMF4,Love can be platonic. Romantic attractions isn't the only thing out there. This whole situation has me a little peeved at Shane.,shane,shane
_95NxbsbMF4,*sighs* youre so brave shane..just WOW..i wished i was beave like you  confronting people that has huge meaning to your life lol (english is not my first language so sorry lol) i cant even say HI or Hello to my old ex best friends even tho were ok now :(( i wish someday and hope* that we can have closure and confonting stuffs,shane,shane
_95NxbsbMF4,*We're gunna fuck?*,shane,shane
_95NxbsbMF4,oh my god they're really cute friends,shane,shane
_95NxbsbMF4,*She did in fact lead him on and knew fully well what she was doing. She's one of those people who love being wanted  you know the ones that get off on receiving praise & attention! I'm glad Shane recorded this reunion so he could rewatch her being just as manipulative today as she probably was back in the day. She's fully aware that your not supposed to send out signals that you love someone  flirt with them and then pretend to not know why you feel like she wants to be with you. If you don't want to date someone then why act so interested & attached to them? She remembered every little detail. LOL She claims you were just a friend but even now comes across as extremely needy. Shane run don't walk away from this girl  she's unnecessarily manipulative!*,shane,shane
_95NxbsbMF4,He still likes her.,shane,shane
_95NxbsbMF4,i ship them..like i know that he is with ryand fo like 2 years now...and..idk i just ship them k bye,shane,shane
_95NxbsbMF4,1 like = every time he said oh my god,shane,shane
_95NxbsbMF4,She a hoe,shane,shane
_95NxbsbMF4,17:55 cute af,shane,shane
_95NxbsbMF4,*I'm actually shook*,shane,shane
_95NxbsbMF4,She obviously really loves his presence and friendship. And is really nice and sweet . She didnt lead him on she just treasured their bond and didnt think they needed boundaries. SOOOOOOOOOOO many girls will understand this.,shane,shane
_95NxbsbMF4,2:30 to 2:44 is me on my period,shane,shane
_95NxbsbMF4,So is he bi or what?,shane,shane
_95NxbsbMF4,8:28 omg the way he said fuck,shane,shane
_95NxbsbMF4,Her nose job came in clutch,shane,shane
_95NxbsbMF4,16:23 I DoNt KnOw,shane,shane
_95NxbsbMF4,i am screaming the whole videooooooooeoeooo,shane,shane
_95NxbsbMF4,This is weird... My first love's last name was Fowler and I just came here from your conspiracy theory playlist and I'm low-key freaking out...,shane,shane
_95NxbsbMF4,Bit dumb,shane,shane
_95NxbsbMF4,DO MORE,shane,shane
_95NxbsbMF4,shane is a cute bean and i wanna be his gf,shane,shane
_95NxbsbMF4,I need an update on this,shane,shane
_95NxbsbMF4,Where did this bish get a nose job  need her surgeons number,shane,shane
_95NxbsbMF4,Her voice is adorable,shane,shane
_95NxbsbMF4,10:13 TENNESSEE?? I LIVE THEIR CURRENTLY xD,shane,shane
_95NxbsbMF4,I truly almost cried,shane,shane
_95NxbsbMF4,7:04 I was literally drinking chocolate milk and I literally spat it out all over my floor.,shane,shane
_95NxbsbMF4,I'm crying they're both so cute and I love her!,shane,shane
_95NxbsbMF4,Okay this was actually really cute tho. I mean despite her leading him on a little (or a lot idk)  they both seem to genuinely care about each other. I mean they both ate those dino chicken nuggets for each other because they thought the other liked it. And also the part where he won't leave her alone because she got locked out of her apartment even though he literally just got his entire heart shattered to pieces.,shane,shane
_95NxbsbMF4,Shane drinking water????!???,shane,shane
_95NxbsbMF4,this made me so unbelievably happy,shane,shane
_95NxbsbMF4,rephrase: this is exactly the same situation that I've had in my life  but we haven't reconnected.,shane,shane
_95NxbsbMF4,I have had such a similar   situation in my life,shane,shane
_95NxbsbMF4,Why do i ship them.....,shane,shane
_95NxbsbMF4,Her laugh is annoying,shane,shane
_95NxbsbMF4,Blair has one of those sweet faces that are easy to fall for,shane,shane
_95NxbsbMF4,The ending with the cookies is so cute.,shane,shane
_95NxbsbMF4,She was genuinely scared at the end,shane,shane
_95NxbsbMF4,this is still one of my favorite videos shane has ever made because i feel like i have so many people in my life like this that i want to reconnect with that we had a falling out with for a dumb reason and its just so nice to see these two people crying seeing one another ugh,shane,shane
_95NxbsbMF4,she's leading you on it's what straight girls do (no jk) also thanks alot shane I can't stop staring at her eyes when she looks at you now,shane,shane
_95NxbsbMF4,I came to watch this after reading the chapter in his book,shane,shane
_95NxbsbMF4,4:11 would have been the perfect thumbnail,shane,shane
_95NxbsbMF4,I loved the look on his face after she asked him to hang out,shane,shane
_95NxbsbMF4,Do a lie detector test with her!!,shane,shane
_95NxbsbMF4,THE ENDING WAS THE CUTEST SHIT EVER I SHIP WTF,shane,shane
_95NxbsbMF4,I lurv when shane is Shook,shane,shane
_95NxbsbMF4,I'm #SHOOK,shane,shane
_95NxbsbMF4,i thought his first ex wasnt gonna be a youtuber but mmmkayyy,shane,shane
_95NxbsbMF4,He wore a different shirt for her...,shane,shane
_95NxbsbMF4,Oh shit Shane got friend zoned.,shane,shane
_95NxbsbMF4,The ending hahahhaahhha,shane,shane
wP-TGGggOXw,It's just weird that it even showed that he lied about liking and using shane and he was still on the show for a bit,shane,shane
wP-TGGggOXw,Every one acting sus in the comments bout bobby  he's not a sociopath  he's not going to tare the group apart. He's just depressed. https://youtu.be/l42yMJpC32o,shane,shane
wP-TGGggOXw,aBHAHAHAH THIS IS WHAT EVERYONE IS UP IN ARMS ABOUT? GET OVER YOURSELVES,shane,shane
wP-TGGggOXw,Can you do a lie detector with cheeto,shane,shane
wP-TGGggOXw,"Are you using my boyfriend?" Petty,shane,shane
wP-TGGggOXw,I hate bobby,shane,shane
wP-TGGggOXw,guy: Do you think you're more attractive then Shane? other dude: no guy: Lie Me: AAAAAAAAAAAAAK *DiEz*,shane,shane
wP-TGGggOXw,remember when shane got a reading and they said he will get a toxic friend that will use him for his fame? I think it's bobby.,shane,shane
wP-TGGggOXw,if I'm being completely honest.....I don't like bobby. I think shane is too good for him. ALSO I love how whenever Garrett says something....Garrett shane just sighs in disappointment and is like ''why am I friends with this (adorablecuteamazingpuresweetpumpkinthatiadore) shithead'' <3,shane,shane
wP-TGGggOXw,How? Jajaja the best answer ever  at least Bobby was honest on that.,shane,shane
wP-TGGggOXw,Ryan tried so hard to expose him.,shane,shane
wP-TGGggOXw,Stop at 00:20 I can't stop laughing,shane,shane
wP-TGGggOXw,FUCK BOBBY,shane,shane
wP-TGGggOXw,kayyyy time to cut bobby,shane,shane
wP-TGGggOXw,Pls get Danielle on ur channel,shane,shane
wP-TGGggOXw,There was an illuminati Taco Bell commercial on right before the video. If that ain't you,shane,shane
wP-TGGggOXw,Guys https://youtu.be/nDbbozYEp54 it explains everything about bobby,shane,shane
wP-TGGggOXw,there was an eror with quidd?,shane,shane
wP-TGGggOXw,I Love this video,shane,shane
wP-TGGggOXw,I love Ryland! That new kid better watch out,shane,shane
wP-TGGggOXw,Lie detectors are not accurate  it's impossible to actual detect someone lying. Police still use this equipment because it can pressure someone into a confession. Fluctuations in heart  perspiration  etc are due to nerves  not honesty  and I for one would be very nervous,shane,shane
wP-TGGggOXw,I'm not fond of bobby. He seems nice but Shane is getting used,shane,shane
wP-TGGggOXw,Is it just me or does Bobby look like a boy version of kristen Stewart?lol,shane,shane
wP-TGGggOXw,Me: so children what did we learn? Children: That bobby is lair.. Me: very good children.,shane,shane
wP-TGGggOXw,omg this is such good content and fuck bobby,shane,shane
wP-TGGggOXw,THAT WAS SO CUTE WHEN SHE ASKED IF HE WANTED TO GET MARRIED AND THEY SMILED DKSKSJ,shane,shane
wP-TGGggOXw,I dont like that ryland didnt like that bobbys girlfriend is older than him but yet again drag him ryland he doesnt deserve to be on the squad,shane,shane
wP-TGGggOXw,I hate Bobby.,shane,shane
wP-TGGggOXw,i had a a heartattack all the time,shane,shane
wP-TGGggOXw,Bobby is so hot,shane,shane
wP-TGGggOXw,I love Shane so much !!!,shane,shane
wP-TGGggOXw,"He's a LIER" LOL,shane,shane
wP-TGGggOXw,Are they best friends now?,shane,shane
wP-TGGggOXw,Ryland hates Bobby hahaha,shane,shane
wP-TGGggOXw,Omg Bobby looks like has trying so hard to deny he wants to kill shane,shane,shane
wP-TGGggOXw,why does bobby look like he hasnt slept in 3 days  he looks so bad here. I dont know him but i noticed watching this.,shane,shane
wP-TGGggOXw,Honestly bobby doesnt deserve Shane.,shane,shane
wP-TGGggOXw,fuck you bobby. i hate you so much. you fake ass bitch. you're just using shane for views and money. you don't deserve that car.,shane,shane
wP-TGGggOXw,Shane is so shook,shane,shane
wP-TGGggOXw,why don't they have jordyn do it and see if he is just using her boyfriend for money ect "conspiracy theories" :D,shane,shane
wP-TGGggOXw,11:34  FOR REAL THO SHANE IS TRIGGERED,shane,shane
wP-TGGggOXw,Oh my god                          GARETT LIKES POWER PUFF GIRLS,shane,shane
wP-TGGggOXw,Ryland is a Taurus sooo you already knowWww,shane,shane
wP-TGGggOXw,Ryland can be kinda angry!,shane,shane
wP-TGGggOXw,LMFAOO SHANE SAID NO HAIR WHIPS,shane,shane
wP-TGGggOXw,ew bobby,shane,shane
wP-TGGggOXw,Is it me or does bobby look like a discount chucky?,shane,shane
wP-TGGggOXw,I see a lot of people who struggle with anxiety problems saying that they'd probably fail the test too  but I struggle from anxiety and I don't feel that way at all. Yeah I might be nervous a little bit beforehand and it would be a little scary  but in all  if I'm not truly lying  I wouldn't be anxious. Most people I know with anxiety have a method they use to calm themselves down enough to where they would be able to take a test like this with no issues at all. The way Bobby answered these questions  in correspondence to how he acts around shane and his friends  is almost scarily too accurate. Notice how Bobby failed almost all of the questions about Shane  but was able to answer the ones about Shane's friends and his girlfriend truthfully. When Bobby made that video about Shane critizing his content and calling it "terrible" that's the type of content Bobby had been producing for a while. He based his channel off of nit-picking and prodding at bigger YouTube celebrities  trying to sell to people the fact that these "big celebrites" were just trying to mootch off of their fanbases. Shane  seeing this  obviously went in with a big heart because Shane always tries to see other points of view and always tries to understand where another person is coming from. Shane is a very generous person when it comes to helping people on the internet. Bobby saw this opportunity as a way to make it big  not to create a friendship. He makes it very clear in the way he portrays himself to Shane when they first meet. He starts to say things he knows Shane wants to hear. He also does this when he meets Garrett  Ryland  and Shane's mom. Saying things like "I've been a big fan of you for a while now" and "I think you make really good content" even though  a couple days before  Bobby was just bashing Shane's content. The only reason why Bobby would even consider Shane a "friend" is because he's his ticket to fame. Bobby is power-hungry and you can tell by the way he acts around everyone that that is definitely his intentions. I used to trust Bobby  and I did for quite a while  but when I started to notice sketchy vibes I started to re-think my opinion.,shane,shane
wP-TGGggOXw,so bobby got fired?,shane,shane
wP-TGGggOXw,I mean hes probably using him for connections a bit  like all YouTube collaborators pretty much do  but he does seem to genuinely like him  so it's not necessarily a bad thing.,shane,shane
wP-TGGggOXw,Will u kill me   Yes He likes my dogs it's ok,shane,shane
wP-TGGggOXw,I dont trust this guy,shane,shane
wP-TGGggOXw,bobby doesnt even need a lie detector to look like hes lying  Like you can just tell LOL . If his mom and ryland didnt feel like smth was SO OFF about him they wouldnt ask that. You dont just ask anyone if they secretly want to kill somebody. I ALWAYS THOUGHT HE SECRETLY HATES SHANE..  i hope shane keeps his circle clean im genuinely SCARED for him,shane,shane
wP-TGGggOXw,Bobby for sure irks me but it definitely seemed like he was overplaying the drama on some of the questions which made the detector say he was lying.. you have to be very still and focused for the detector to work (at its best at least),shane,shane
wP-TGGggOXw,Bobby is lowkey really shady and Ryland doesn't like him and neither do I.  Shane is too pure and deserved to be loved,shane,shane
wP-TGGggOXw,Poor john he sounds so unethusiastic.,shane,shane
wP-TGGggOXw,Bobby is the epitome of a... bitch,shane,shane
wP-TGGggOXw,I love this,shane,shane
wP-TGGggOXw,I think he was just genuinely nervous,shane,shane
wP-TGGggOXw,you guys know lie detector is all bs lol?,shane,shane
wP-TGGggOXw,I love shane so much and I like him BEC he is *truthful*,shane,shane
wP-TGGggOXw,Ryland was getting so protective over shane OMG I LOVE IT!! Ps. Probably shouldn't trust someone who wants to kill you to hang out in your home LMAO! He failed to many questions for comfort haha,shane,shane
wP-TGGggOXw,I don't trust Bobby,shane,shane
wP-TGGggOXw,Do a goats hunting video with bobby,shane,shane
wP-TGGggOXw,WE all hated Bobby and now he is CANCLED yay,shane,shane
wP-TGGggOXw,Bye bye Bobby,shane,shane
wP-TGGggOXw,What ever happened to drew???,shane,shane
wP-TGGggOXw,I have a bad feeling about bobby,shane,shane
o08t04SJeqU,Wow the pentagrans in there arent for the devil they are wiccan there for elements and used for spells,shane,shane
o08t04SJeqU,omg your in texas?!?!!?!?! thats where i live omg omg omg omg omg omg im having a panic attack,shane,shane
o08t04SJeqU,PLEASE TELL ME HOW MY FUCKING QUEEN WAS IN HTX WHERE I LIVE AND I DIDNT FUCKING KNOW?????,shane,shane
o08t04SJeqU,I live in Texas,shane,shane
o08t04SJeqU,I was there like 2 hours after he was! I bought  a book that was spells for people to die! OMG I'm shook! I breathed the same air as Shane Dawson!,shane,shane
o08t04SJeqU,THE VIEW LEGIT IS SHOWING WHERE MY MOM WORKS AND AROUND THE TIME SHE IS LEAVINGGG IM DYINNNGGGG,shane,shane
o08t04SJeqU,I know Garret is gay...bur Moret would be amazing,shane,shane
o08t04SJeqU,IM FROM HOUSTON,shane,shane
o08t04SJeqU,Can we please talk about how shane has literally been spoiling his boyfriend and his sister like....so much...and i think its so sweet that thats literally just how shane is but like literally shane deserves so much for all of the hard work and amazing content hes been putting out lately and like well we all know what happened with bobby...hes like obviously not posting anymore on this channel for like a reason ya know....I just feel like shane should seriously w a t c h o u t...idk maybe its just me but like lets be honest morgan is only blowing up because of ryland and ryland because of shane...and um yeah their relatable...because their lazy and hungry all the time who isnt ya know but shane is relatable because hes genuinely been through so much shit and hes so open and so aware and hes not afraid to tell it how it is knowing hes gonna get beef for whatever it is like...we know who really deserves these views and the being spoiled...,shane,shane
o08t04SJeqU,Shane and the MIT beginning,shane,shane
o08t04SJeqU,I agree with the comment I saw last video  "Andrews laugh could cure cancer.",shane,shane
o08t04SJeqU,I live in Conroe  Texas!! Please come to my house :o,shane,shane
o08t04SJeqU,shanes face after he says he wants to sacrifice them xD,shane,shane
o08t04SJeqU,How in the actual fuck 8:59,shane,shane
o08t04SJeqU,Man if they were in Houston a few months before then they could have gone to the Houston Livestock and Rodeo.,shane,shane
o08t04SJeqU,i ship morgan and garrett so hard,shane,shane
o08t04SJeqU,Whoo boy did i get bothered when they were joking about the witch shop (im a witch). Its a wicca/pagan shop for the pagan religion.,shane,shane
o08t04SJeqU,i resonate SO much with bunny omfg like how nervous she was about meeting you guys and then when she started talking about what was going on i cried almost the whole way through but im really happy that youre doing this with her <3,shane,shane
o08t04SJeqU,Does anyone know what happened to Drew?,shane,shane
o08t04SJeqU,HoLy SmOkEs,shane,shane
o08t04SJeqU,Y'all neeed to lay off ryland. Its an act.,shane,shane
o08t04SJeqU,Does anyone know the song they used at 0:28,shane,shane
o08t04SJeqU,Hey Guys....Does anyone else miss Drew?,shane,shane
o08t04SJeqU,Garrett reminds me of the guy from the mummy who lost his glasses,shane,shane
o08t04SJeqU,4:59 yes get that cameo andrewww,shane,shane
o08t04SJeqU,Holy fuckkkkkkkk,shane,shane
o08t04SJeqU,Should have came to AUSTIN SHANE!! Lol wayyyyyy better,shane,shane
o08t04SJeqU,Is Shane gay no hate,shane,shane
o08t04SJeqU,TRACTOR TRACTOR TRACTOR,shane,shane
o08t04SJeqU,IM IN CLASS AND THEY WENT INTO THE MAGICK CAULDRON AND IVE BEEN THERE IM SHOOK I LIVE IN TEXAS,shane,shane
o08t04SJeqU,*holy cow I would have nightmares*,shane,shane
o08t04SJeqU,IM DYING WHEN GARRETT SAID HEY WHATS UP U GUYS ABOUT THE CHEEZE IT,shane,shane
o08t04SJeqU,nobody going to mention the fact that Shane called Morgan his sister??? *FaMiLy GoAlS*,shane,shane
