videoId,comment,channelId,channelName
pvRcnTFTTgE,What a stupid fucking nurse. I would have ripped that bitch to pieces,shane,shane
Ul1nFub6164,Inappropriate. He's basically stalking a child not cool,shane,shane
Ul1nFub6164,HE IS SHOOK!!!,shane,shane
Ul1nFub6164,Shane you have a good heart! I love the direction your career is heading.,shane,shane
Ul1nFub6164,My queen is Selena Quintanilla,shane,shane
Ul1nFub6164,"Cheeto I have a have to go" "I broke him",shane,shane
Ul1nFub6164,yeet,shane,shane
Ul1nFub6164,I i I i..?!?!       *can't even*,shane,shane
Ul1nFub6164,Shane makes dreams come true,shane,shane
Ul1nFub6164,were  shook,shane,shane
Ul1nFub6164,ok  just saw the hamilton video and i am quacking,shane,shane
Ul1nFub6164,OMGOMGOMGOMGOMGOMGOMGOMGOMGOMG SHE DID A DUCKING HAMILTON COVER,shane,shane
Ul1nFub6164,I JUST WAS WATCHING THIS AND HEARD HAMILTON AND HAD A SEIZURE,shane,shane
Ul1nFub6164,Literally me when Taylor swift does anything,shane,shane
Ul1nFub6164,4:14 The neighbours,shane,shane
Ul1nFub6164,YOU NEED TO MAKE ONE WHERE SOPHIE AND CHRISTIFER GET REUNITED,shane,shane
Ul1nFub6164,looks like the parents are trying to make money off her go figure,shane,shane
Ul1nFub6164,Its so cute when shane cries it makes it emotional,shane,shane
Ul1nFub6164,yo its tessa brooks the compition is shok,shane,shane
Ul1nFub6164,you have 2 sons and 1 daughter,shane,shane
Ul1nFub6164,Scooter Braun discovered Justin on YouTube silly Shane  he was introduced to usher through scooter,shane,shane
Ul1nFub6164,*hears beliver from imagine dragons* *SUBSCRIBES TO HER AS FAST AS SOUND*,shane,shane
Ul1nFub6164,Shane you walked down the stairs not run,shane,shane
Ul1nFub6164,I have fucking chills,shane,shane
Ul1nFub6164,i love that shane always try to help New youtuber   not like the pauls who all they do is Make joke of people ( even if its suicide person ),shane,shane
Ul1nFub6164,Jacob Saggytitties,shane,shane
Ul1nFub6164,WHERE. IS. MY. FUCKING. APPLE. TV... *REMOTE!!!*,shane,shane
Ul1nFub6164,OMG i've seen her before. I watching someone spill the tea and there was a video like why does hi bitch have more views than that girl. I am shook,shane,shane
Ul1nFub6164,Kesha is shook by this girl,shane,shane
Ul1nFub6164,l,shane,shane
Ul1nFub6164,omg i love (1) one dramatic but soft bitch shane,shane,shane
Ul1nFub6164,*where is my fucking apple TV remote*,shane,shane
Ul1nFub6164,"THE NEXT TAYLOR SWIFT AVRIL LAVIGNE TESSA BROOKS" I'M CRYING,shane,shane
Ul1nFub6164,#hamfam,shane,shane
Ul1nFub6164,4:04-4:05 when she said "he opens his mouth and does not say anything "it is  shane.shane opened his mouth and did not say anything,shane,shane
Ul1nFub6164,HER VOICE,shane,shane
Ul1nFub6164,SHANE STOP MAKING ME CRY DJSHHDAKHD,shane,shane
Ul1nFub6164,ALEXANDER HAMILTIOOON!!,shane,shane
Ul1nFub6164,She's so talented omg,shane,shane
Ul1nFub6164,Me,shane,shane
Ul1nFub6164,Her just needs a good manager & stylist and she is GOLD!!!!,shane,shane
Ul1nFub6164,Omg she sings so good!!!!,shane,shane
Ul1nFub6164,IM CRYINGG,shane,shane
Ul1nFub6164,Lost in the sea of comments.....,shane,shane
Ul1nFub6164,She covered Hamilton  I immediately love this girl,shane,shane
Ul1nFub6164,ME NEXT ME NEXT,shane,shane
Ul1nFub6164,when shane was crying i was crying to,shane,shane
Ul1nFub6164,I love her she's adorable and so talented,shane,shane
Ul1nFub6164,My favorite video on the internet,shane,shane
Ul1nFub6164,She reminds me so much of K. Flay,shane,shane
Ul1nFub6164,I was literally shook when he shed a single tear  oh my god,shane,shane
Ul1nFub6164,HAMILTONNNNNNNN!!!!!!!!!!!!!!!!,shane,shane
Ul1nFub6164,I'm SHOOK!,shane,shane
Ul1nFub6164,*"WHERE IS MA APPLE T.V REMOTE"*,shane,shane
Ul1nFub6164,WHERE IS DREWWW,shane,shane
Ul1nFub6164,SHE SOUNDS LIKE MATTY B !! LITTERLY THERE TWINS!(well In voice),shane,shane
Ul1nFub6164,Your catchphrase should be SHOOK,shane,shane
Ul1nFub6164,this is the definition of SHOOK,shane,shane
Ul1nFub6164,DAMN SOMEBODY GIVE HER A RECORD DEAL NOW,shane,shane
Ul1nFub6164,this whole video is such a mood omg,shane,shane
Ul1nFub6164,1:47 Billie Eilish?,shane,shane
Ul1nFub6164,6:42 my favoroute part of this video,shane,shane
Ul1nFub6164,SHANE I FEEL WHAT YOUR FEELING HE INSPARATION THE JEJSKSHSHSJFBEM SHES RIGHT WE NEED HER IM CryInG I have a feeling abOUt hEr,shane,shane
Ul1nFub6164,CHEETO LOOKED AT HIM WHEN HE SAID IM LEAVING THEN HE SAID WERE LEAVING CHEETO LOOKED DOWN LOL LIKE IF U NOTICED,shane,shane
Ul1nFub6164,omg she reminds me of meeee is she my real sister11111 i am quaking so much,shane,shane
Ul1nFub6164,why doesnt garrots channel exist?????,shane,shane
Ul1nFub6164,oh my gosh adopt her!,shane,shane
Ul1nFub6164,omg.. I want to be her oof,shane,shane
Ul1nFub6164,Yeasssss,shane,shane
Ul1nFub6164,*where is my APPLE.TV.REMOTE*,shane,shane
Ul1nFub6164,IM FUCKIN SHOOK!!,shane,shane
Ul1nFub6164,we don't compare queens to ed sheeran,shane,shane
Ul1nFub6164,Shane is the Ellen of YouTube!,shane,shane
Ul1nFub6164,<3,shane,shane
zK9FkwQSzkg,Coffin is so pretty I agree with Shane,shane,shane
zK9FkwQSzkg,oh hey I have that same knife.,shane,shane
zK9FkwQSzkg,6;41 scarist part of the video,shane,shane
zK9FkwQSzkg,6:35 that went from almost cool to a car full of gays screaming about nothing,shane,shane
zK9FkwQSzkg,click bait they just go in a coffin,shane,shane
zK9FkwQSzkg,What happened to drew? He is not in any of the new vids,shane,shane
zK9FkwQSzkg,Heyyy queen,shane,shane
zK9FkwQSzkg,Drew is my favorite person ever,shane,shane
zK9FkwQSzkg,i miss the spooky boys  love u drew ):,shane,shane
zK9FkwQSzkg,And crash,shane,shane
zK9FkwQSzkg,"you finally found a boyfriend " "yeah... " *hold the skeleton*  me,shane,shane
zK9FkwQSzkg,Actually Drew someone told me that you have some type bacteria inside you that are just waiting for you to die. And when you die they start to eat you.,shane,shane
zK9FkwQSzkg,Garret is too adorable to die,shane,shane
zK9FkwQSzkg,Cheeto was like finally and I didn't even have to do it he ate himself to death. I'm jk lol 3:10,shane,shane
zK9FkwQSzkg,garett is really attractive especially at 7:28 HAIRCUTS on him is a YES from me,shane,shane
zK9FkwQSzkg,Ill be garrets boyfriend x'D,shane,shane
zK9FkwQSzkg,Bye Bye Bi        -Shane Dawson      2018-2008,shane,shane
zK9FkwQSzkg,Be careful guys,shane,shane
zK9FkwQSzkg,Shane: I am *SHOOKITH* Me: *NO  I am SHOOKITH  AND QUAKING* I hate my life **smiles**,shane,shane
zK9FkwQSzkg,"the air is getting hot and its getting thicc",shane,shane
zK9FkwQSzkg,Garret is SO me,shane,shane
zK9FkwQSzkg,"I know I joke about it but I'm happy to be alive" *ssssaaaame*,shane,shane
zK9FkwQSzkg,VERONICA AND VANESSA REFERENCE,shane,shane
zK9FkwQSzkg,Shane should've also written "Amazon.com/Shane" on his grave,shane,shane
zK9FkwQSzkg,A DAMN FURRY OH SHIT IN DYING YES !!   ((I is furry)),shane,shane
zK9FkwQSzkg,3:34 - 3:46 I died by fangirling YAOI!!,shane,shane
zK9FkwQSzkg,14:51 awww,shane,shane
zK9FkwQSzkg,I need to meet Shane because he is the best person in the world not kidding,shane,shane
zK9FkwQSzkg,Immediately checks the comments for the jeffy cat piano,shane,shane
zK9FkwQSzkg,*"a body with no breath in it"*,shane,shane
zK9FkwQSzkg,When they said they can f*ck in the casket this video instantly turned into the music video for Eternally Yours by Motionless in White *Amazing song*,shane,shane
zK9FkwQSzkg,Poor Garret.,shane,shane
zK9FkwQSzkg,5:45,shane,shane
zK9FkwQSzkg,Ryland wants to be CREAM-ated,shane,shane
zK9FkwQSzkg,"It doesn't smell like dead",shane,shane
zK9FkwQSzkg,3:49 my life in a second,shane,shane
zK9FkwQSzkg,Garrett is SO. DANG. CUTE.,shane,shane
zK9FkwQSzkg,I love how shane never tells ryland whats going on,shane,shane
zK9FkwQSzkg,Ugh I HATE the kitty piano thing!!!,shane,shane
zK9FkwQSzkg,6:36 got too lit,shane,shane
zK9FkwQSzkg,6:22 me so damn dead when i see jeffys cat piano,shane,shane
zK9FkwQSzkg,garrechts haircut awww,shane,shane
zK9FkwQSzkg,lol 14:49 byee,shane,shane
zK9FkwQSzkg,6:54 sometimes i wonder why i stan y'all,shane,shane
zK9FkwQSzkg,BEING BURIED ALIVE IS ACTUALLY MY BIGGEST FEAR AND WILL ALWAYS BE OMG THIS IS ACTUALLY SO SCARY,shane,shane
zK9FkwQSzkg,Amazing,shane,shane
zK9FkwQSzkg,You're not too big  and i know usually you hate being 'fat' You aren't  but  At somr angles you look th i CC,shane,shane
zK9FkwQSzkg,I thought James Charles was gonna be in the casket as Flashback Mary and scream  " HI SISTERS".,shane,shane
zK9FkwQSzkg,"Relaxing" lmfao,shane,shane
zK9FkwQSzkg,Title: WE BURIED OURSELVES ALIVE irl: we layed in a closed coffin for 5mins,shane,shane
zK9FkwQSzkg,Omg im crying and kinda having a panic attack just from watching help,shane,shane
zK9FkwQSzkg,love garretts family!,shane,shane
zK9FkwQSzkg,Drew is the BESTTTTT and FUNNY,shane,shane
zK9FkwQSzkg,*so i held my pee so long that it spilled a lil bit at **12:07** omfg... why is drew so whitty n funny!!!!! gahhdddddddd no pueddoo!*,shane,shane
zK9FkwQSzkg,6:19 jeffy cat piano SML and 6:54,shane,shane
zK9FkwQSzkg,Omg  so want to be Garret's bf. Tell him he can stop looking!,shane,shane
zK9FkwQSzkg,I miss drew,shane,shane
zK9FkwQSzkg,What happened to Drew?,shane,shane
zK9FkwQSzkg,What happened to Drew recently? I miss him in the videos :(,shane,shane
zK9FkwQSzkg,Drew: ohmygod arts and crafts time!  Shane: what would yours say?  Drew: uhm probably he wanted this....,shane,shane
zK9FkwQSzkg,when shane wrote "bye bye bi" I felt that,shane,shane
zK9FkwQSzkg,Watching you guys doing all this stuff is both hilarious and scary. It reminds me of all my childhood friends and just all the scary games we would play. We didn't have a casket (obvi) but I remember all the games and scary pranks. It was some of the best memories I have. Thanks for making these! I hope you do more like this in the future but these are totally rewatchable and hilarious!!,shane,shane
zK9FkwQSzkg,Why does Garrett look so good in this video,shane,shane
zK9FkwQSzkg,WHYS THERE A CAT PIANO?!,shane,shane
zK9FkwQSzkg,i would care if you died shane love you,shane,shane
zK9FkwQSzkg,this IS the Click bait,shane,shane
zK9FkwQSzkg,14:51 that sweet bye,shane,shane
zK9FkwQSzkg,I love how what each of them did in the coffin reflects their personality so well Shane - freaks out  thinks about life  but is funny at the same time Drew - quietly contemplating death  random thoughts  + a nap Ryland - inspects the lighting for Instagram and makes a vlog (??) Garret - has a dance party complete with snacks and music,shane,shane
XdENbPIp1EI,2:40 me looking at my life,shane,shane
XdENbPIp1EI,you like boyyyyyyyyyyyyyyyyyyyyyyyyyyyyyyyy,shane,shane
XdENbPIp1EI,Is that lazy town in the song,shane,shane
XdENbPIp1EI,MOUTH FULL OF MARBLES,shane,shane
XdENbPIp1EI,MOUTH FULL OF MARBLES   IM SCREAMING,shane,shane
XdENbPIp1EI,0:46  :o.       Whatttttt,shane,shane
XdENbPIp1EI,The "he likes boys" song is LITERALLY MORGAN'S (Ryland's sister) SONG,shane,shane
XdENbPIp1EI,2:39 when I discover my grade from math,shane,shane
XdENbPIp1EI,DID ANYBODY ELSE RELISE THAT MEMORIES BY PANIC! AT THE DISCO WAS PLAYED IN THE BACK OF ONE OF THE SHISA VIDEOS,shane,shane
XdENbPIp1EI,10:51 is literally probably what Morgan says to Ryland after she breaks up with someone,shane,shane
XdENbPIp1EI,THEN HE MAKES THIS GRINCH SOUNDS,shane,shane
XdENbPIp1EI,STOP AT 7:24 ASAP AND LOOK AT SHANE IN DISCUST,shane,shane
XdENbPIp1EI,5:16 lmao I saw that coming,shane,shane
XdENbPIp1EI,Shane: Does it ever get better!!???? Me: It Gets Worse,shane,shane
XdENbPIp1EI,you DID glow up are you kidding youre so pretty,shane,shane
XdENbPIp1EI,Me: about to check my makeup after a long day Me:walks in to the bathroom  *looks in the mirror  Me: 7:33,shane,shane
XdENbPIp1EI,OOOOoOooooOOooOoo hey what's up you guys,shane,shane
XdENbPIp1EI,THIS WAS AMAZINGGGGGG!!,shane,shane
XdENbPIp1EI,Aw I love Shane,shane,shane
XdENbPIp1EI,4:00,shane,shane
XdENbPIp1EI,IM WEAKKKKK!!!!!!!!! YOU SAID IN THE LAST VIDEO THAT YOU WILL STOP WITH THE HEY WHATS UP YOU GUYS  YES! But I guess it stayed! Not hating by the way. love you!!!!!,shane,shane
XdENbPIp1EI,7:56     *iCoNiC*,shane,shane
XdENbPIp1EI,7:56      *IcOnIc*,shane,shane
XdENbPIp1EI,Bih u made me spit up my dp put of laughter.,shane,shane
XdENbPIp1EI,You are hot,shane,shane
XdENbPIp1EI,Can someone explain shesa and their relationship I'm confused about what happened,shane,shane
XdENbPIp1EI,If Shane and Lisa would've had a kid  that kid would've had the most gorgeous smile in the world.,shane,shane
XdENbPIp1EI,In 2010 you looked like your "hater" looks now.,shane,shane
XdENbPIp1EI,I love this,shane,shane
XdENbPIp1EI,Shane burping in reverse is scary,shane,shane
XdENbPIp1EI,@10:21 I'm SCREECHING,shane,shane
XdENbPIp1EI,7:32 YOU LOOK LIKE YOUR HATER LMAO,shane,shane
XdENbPIp1EI,shut up,shane,shane
XdENbPIp1EI,Sorry but i like Ryland better !!,shane,shane
XdENbPIp1EI,7:31-7:35 omg ha!,shane,shane
XdENbPIp1EI,Honestly you were hot back than but i dont now what happend with your face,shane,shane
XdENbPIp1EI,3:47 Selena Gomez omg,shane,shane
XdENbPIp1EI,Cringe. I like Ryland better.,shane,shane
XdENbPIp1EI,OLULULULULU! WHAT'S CRACKIN' YOU GUYS?,shane,shane
XdENbPIp1EI,2010 Shane looks like Bobby Burns. Conspiracy.,shane,shane
XdENbPIp1EI,Someone should make a compilation of how many times Shane says something should be played at his funeral,shane,shane
XdENbPIp1EI,SHANE YOU CHEATED ON RYLAND !!!!!!!!!! WHY !!!?? OMG ...,shane,shane
XdENbPIp1EI,5:15 IMM DEADDDDD,shane,shane
XdENbPIp1EI,1:45 song??,shane,shane
XdENbPIp1EI,5:53 I JUST GOT BACK FRON WATCHING THAT EXACT VIDIO HOLLY SHIT,shane,shane
XdENbPIp1EI,Mouth full of marbles,shane,shane
XdENbPIp1EI,1:39 SHANE IS PANIC!NG,shane,shane
XdENbPIp1EI,I like your hair 2014 haircut,shane,shane
XdENbPIp1EI,JB is SHOOK,shane,shane
XdENbPIp1EI,If you watched teens react to shane dawnson shane is like the kid that keep saying he wasnt funny,shane,shane
XdENbPIp1EI,Omg the burping one had me dying,shane,shane
XdENbPIp1EI,Why no shane and jenna collab ughhhhhhh,shane,shane
XdENbPIp1EI,6:07-Chris Pratt  7:41-Josh Peck  7:47-Drake Bell,shane,shane
XdENbPIp1EI,What was the name of the song in 1:30,shane,shane
XdENbPIp1EI,im weak,shane,shane
XdENbPIp1EI,In the hair cut shit bishhh please i would of snatched you up you look good asf Shane dont dragg it,shane,shane
XdENbPIp1EI,IDK about anyone else but I've always found Shane attractive. Makes me sad that he doesn't think so.,shane,shane
XdENbPIp1EI,when the old shane was on the video i actually started fucking coughing,shane,shane
XdENbPIp1EI,When people make compilations of you  you know you have made it!!,shane,shane
F6c36eiPhvo,24:56 The Grinch who stole Christmas,shane,shane
F6c36eiPhvo,blicky got the stiffy uh,shane,shane
F6c36eiPhvo,the end has me screaming,shane,shane
F6c36eiPhvo,Wait you wear a wig!?!?!?!?,shane,shane
F6c36eiPhvo,ITS MAY AND THEY STIL DONT HAVE A NAME!!!!LOL,shane,shane
F6c36eiPhvo,You should name your adorable dog queen,shane,shane
F6c36eiPhvo,The old Garrett can't come to the phone right now   Why?  Oh because he's dead!,shane,shane
F6c36eiPhvo,SHANE LOOKS LIKE MATTHEW SANTORO OMFG,shane,shane
F6c36eiPhvo,shane : "EW EW EW WHAT'S IN THE POCKETS"  garret : "GUMMYWORMS",shane,shane
F6c36eiPhvo,matthew santoro who?,shane,shane
F6c36eiPhvo,soyrizo chick was kind of a buzzkill in this video (not because shes vegan lol) idk like she didn't smile a single time and just let him have the clip dude,shane,shane
F6c36eiPhvo,Does anyone wanna talk about how garrett is dead  yet he still has his glasses on and theyre fine.....?,shane,shane
F6c36eiPhvo,21:54 PAUSE AND LOOK AT SHANES FACE  THEN PLAY IT AND LISTEN TO SHANES LAUGH...THANK ME LATER,shane,shane
F6c36eiPhvo,I'm late  but name her Ladybug,shane,shane
F6c36eiPhvo,dog names:drama queen honey donut a&w Rolex  triggered  Drew jr omg  pizza  Grease those are good oo or food.,shane,shane
F6c36eiPhvo,dog names:drama queen honey donut a&w Rolex  triggered  Drew jr omg  pizza  Grease those are good oo or food.,shane,shane
F6c36eiPhvo,dog names:drama queen honey donut a&w Rolex  triggered  Drew jr omg  pizza  Grease those are good oo or food.,shane,shane
F6c36eiPhvo,dog names:drama queen honey donut a&w Rolex  triggered  Drew jr omg  pizza  Grease,shane,shane
F6c36eiPhvo,You should name your dog lucy I like that name,shane,shane
F6c36eiPhvo,a hairs clips,shane,shane
F6c36eiPhvo,1:11 awwwww random cat tail in the background,shane,shane
F6c36eiPhvo,R.i.p gummy worm,shane,shane
F6c36eiPhvo,THEY SHOULD NAME THE DOG TIZZY OR TISSY. YASS.,shane,shane
F6c36eiPhvo,the bald look actually suits him,shane,shane
F6c36eiPhvo,Name the dog bell for taco bell,shane,shane
F6c36eiPhvo,22:53 HAHAhHAHAHahauhdhshfhsah,shane,shane
F6c36eiPhvo,Shane doesn't look that bad bald,shane,shane
F6c36eiPhvo,0:49 is literally Cady talking to Regina in Mean Girls,shane,shane
F6c36eiPhvo,He actually looks kinda hot in 14:52,shane,shane
F6c36eiPhvo,21:58 Was so funny,shane,shane
F6c36eiPhvo,I LoVE rupauls drag race it AMAZING,shane,shane
F6c36eiPhvo,Yeah I now how Shane feels because my sister and brother are super skinny and am thiccc /fat,shane,shane
F6c36eiPhvo,Shane your not fat,shane,shane
F6c36eiPhvo,Before I say this in no way am I hating on Shane and saying that he should stop complaining but I'm just saying I'm ssuuuppeerrr tiny and skinny for my age which also makes it hard to fit in clothes and I'm not trying to complain like it's not a serious issue buecause lots of people have worse body issues  but I'm just going to put it out there we are all beautiful no matter what we look like.,shane,shane
F6c36eiPhvo,Name your dog crepe or pancakes like so Shane can see  Edit: I liked my own comment because no one else will,shane,shane
F6c36eiPhvo,I love andrews laugh,shane,shane
F6c36eiPhvo,16:31 Why did Garret remind me of that one bear guy? I dont remember his name but you all know what im talking about.,shane,shane
F6c36eiPhvo,BALD! FAT! DEAD!  TEAM INSECURITY!!!,shane,shane
F6c36eiPhvo,"How are you feeling?" "Okay" "What's that like?"  me lmfaooo,shane,shane
F6c36eiPhvo,Omg they are all Shane at different stages in life,shane,shane
F6c36eiPhvo,00:35 is me talking to my mom,shane,shane
F6c36eiPhvo,Garrett being dead is sooo funny,shane,shane
F6c36eiPhvo,3:37 omg,shane,shane
F6c36eiPhvo,Name the dog go strawberry,shane,shane
F6c36eiPhvo,22:23 yo those candies are like 8 dollars a box,shane,shane
F6c36eiPhvo,I hate that you calls your self fat because your perfect,shane,shane
F6c36eiPhvo,Pls,shane,shane
F6c36eiPhvo,Name the dog honeycomb,shane,shane
F6c36eiPhvo,:-),shane,shane
F6c36eiPhvo,Well if the dog got a human name it wouldn't be the first animal to. I named my cat Larry. I was 2 okay?,shane,shane
F6c36eiPhvo,Why is this vid called the truth,shane,shane
F6c36eiPhvo,The sad thing is that I would join your cult,shane,shane
F6c36eiPhvo,Kween  Name her kween Kween.,shane,shane
F6c36eiPhvo,shanes cheat day is every day,shane,shane
F6c36eiPhvo,When he wore that jacket it looked like he was wearing a skirt,shane,shane
F6c36eiPhvo,my fav moment ever start at 17:03 awwwww,shane,shane
F6c36eiPhvo,I have to wear extra small ;-;,shane,shane
F6c36eiPhvo,I was so tired but I could not stop laughing so I couldn't yawn,shane,shane
F6c36eiPhvo,Plz tell Garrett he is super super funny,shane,shane
F6c36eiPhvo,Sister the dog or shister,shane,shane
F6c36eiPhvo,I wear big moon moos,shane,shane
F6c36eiPhvo,"You look like a big gay dead bird!",shane,shane
F6c36eiPhvo,I thought shane had been wearing a wig lol but because i know he has a lot of them and the thumbnail looked too real. They did a crazy good job with the makeup.,shane,shane
F6c36eiPhvo,the tall Gummiworm Dood is the cutest human being I have ever seen.,shane,shane
F6c36eiPhvo,THE LAUGH TRACK  IM FUCKING LIVING,shane,shane
F6c36eiPhvo,You're not FAT Shane stop thinking that please,shane,shane
F6c36eiPhvo,Best people to watch are you three,shane,shane
F6c36eiPhvo,garret is honestly such a cutie i wish i could cure his body issues !!,shane,shane
F6c36eiPhvo,YASS NAME HER LINDA,shane,shane
F6c36eiPhvo,I need ScottySire and Shane Dawson to do a video about death lol,shane,shane
F6c36eiPhvo,Ryland: that gets dark,shane,shane
F6c36eiPhvo,20:57 Well  was he not a gay evil genius before he was bald?,shane,shane
F6c36eiPhvo,Name the dog Toto!,shane,shane
PsazPeKrPzU,when sis is serving you the good tea SHIT  OVER IT,shane,shane
PsazPeKrPzU,*sHAaaAnNeE*,shane,shane
PsazPeKrPzU,Garrett looks fucking cool with the makeover,shane,shane
PsazPeKrPzU,I miss the new Shane!!!,shane,shane
PsazPeKrPzU,Just realized he mentioned jack and mark omg fangirling,shane,shane
PsazPeKrPzU,Rectumpie lol,shane,shane
PsazPeKrPzU,I love the queen character.,shane,shane
PsazPeKrPzU,This is the best thing that ive ever watched,shane,shane
PsazPeKrPzU,I love the Queen!,shane,shane
PsazPeKrPzU,Markihammer!!! Jackrectumpie!!! OMG IM WHEEZING XD,shane,shane
PsazPeKrPzU,Why's his mustache so red?,shane,shane
PsazPeKrPzU,This video is a masterpiece.,shane,shane
PsazPeKrPzU,**Shane The Fucking Queen**,shane,shane
PsazPeKrPzU,"what is string beans",shane,shane
PsazPeKrPzU,"and that's why it's the first",shane,shane
PsazPeKrPzU,Him getting up from the bathtub is actually my life in a nutshell,shane,shane
PsazPeKrPzU,Queen Shane is everything,shane,shane
PsazPeKrPzU,Me:Shane can't come to the phone right now  You:why  Me:cause he's taking a shit  You:oh ew,shane,shane
PsazPeKrPzU,#RectumPie     I die XD,shane,shane
PsazPeKrPzU,He never existed.,shane,shane
PsazPeKrPzU,UAHHH FUCK,shane,shane
PsazPeKrPzU,TOM,shane,shane
PsazPeKrPzU,6:50 MOODDDD OMG       *ALL THE NICE COMMETS I GET ABOUT MY BOODDYY*,shane,shane
PsazPeKrPzU,'Markihammer....Jackrectumpie i'm coming for you' their reaction 'i think were gonna be fine',shane,shane
PsazPeKrPzU,"Jack" "Rectum" "Pie"  I'M DEAD,shane,shane
PsazPeKrPzU,I want "oh thats a boppity bop" on a shirt. I'm waiting XD,shane,shane
PsazPeKrPzU,did u ever post the second  part of this vid?,shane,shane
PsazPeKrPzU,When shane screamed aw...fuck i shit myself laughing,shane,shane
PsazPeKrPzU,Jackrectumpie,shane,shane
PsazPeKrPzU,Oh that's a bobbity bop,shane,shane
PsazPeKrPzU,*the queen will never die out*,shane,shane
PsazPeKrPzU,*GIANT* *TACO* *WAFFLE* *BANANAS*,shane,shane
PsazPeKrPzU,Can you make more queen Shane videos,shane,shane
PsazPeKrPzU,13 million,shane,shane
PsazPeKrPzU,When you LITTERALY are Taylor Swift.,shane,shane
PsazPeKrPzU,can queen shane be a series pls,shane,shane
PsazPeKrPzU,HEY NOVEMBER 9 IS MY BDAY,shane,shane
PsazPeKrPzU,I like how Shane just assumes I have friends to buy his merch for,shane,shane
PsazPeKrPzU,love u,shane,shane
PsazPeKrPzU,He is on 13M now!!!!,shane,shane
PsazPeKrPzU,I love Shane Queen,shane,shane
PsazPeKrPzU,So this was an office tour.,shane,shane
PsazPeKrPzU,*Where's perry ?*,shane,shane
PsazPeKrPzU,You know I'm actually a kid been watching your videos for one year,shane,shane
PsazPeKrPzU,Do you ship your merch to uk,shane,shane
PsazPeKrPzU,"I haven't had this poison in years." MEEEEEE,shane,shane
PsazPeKrPzU,5:10  MARKIHAMMER  JACKRECTUMPIE HE DID NOT JUST,shane,shane
PsazPeKrPzU,5:10 OH HE DID NOT JUST INSULT MARK AND JACK,shane,shane
PsazPeKrPzU,This is legit one of the best videos on this website,shane,shane
PsazPeKrPzU,Queen Shane: what is this? BESIDES MY SPIRIT ANIMAL!   Me: YAAAAAAAASSSS QUEEN MEEEEEEEEEE,shane,shane
PsazPeKrPzU,Let's be real for a second  who actually thought he add some big needs to say... I mean seriously  he's the actual Clickbate Queen,shane,shane
PsazPeKrPzU,I'm living for Ryland' s outfit,shane,shane
PsazPeKrPzU,Shane is my spirit animal!,shane,shane
PsazPeKrPzU,1:28 I actually screen shotted that,shane,shane
PsazPeKrPzU,ARGH FUCK,shane,shane
PsazPeKrPzU,The old Shane can't come to the phone right now Why?!? Oh  'cause he's dead,shane,shane
PsazPeKrPzU,gmm ear biscuit was the same time as what queen shane was watching          1 hour 17 minutes and 29 seconds,shane,shane
PsazPeKrPzU,Every day I watch Shane's videos it always makes my day,shane,shane
PsazPeKrPzU,MARKIPLIER IS SHOOOKK,shane,shane
PsazPeKrPzU,Actually the place they were at is bigger than team10 house theirs has only 7 and Shane's has 9 or 10.,shane,shane
PsazPeKrPzU,I'm HUNGRY!,shane,shane
PsazPeKrPzU,#Shanedawson,shane,shane
PsazPeKrPzU,She said look at him,shane,shane
PsazPeKrPzU,How did she know were her dog is when she was talking to her mom after driving?,shane,shane
PsazPeKrPzU,CAN YOU PLEASE SHIP TO ENGLAND,shane,shane
PsazPeKrPzU,No now 12 million and counting...,shane,shane
PsazPeKrPzU,you should do a video trying Giant taco waffle bananas,shane,shane
PsazPeKrPzU,Swear down I replayed 6:49 - 7:00 dozens of times,shane,shane
PsazPeKrPzU,*WhErEsPeRrY*,shane,shane
PsazPeKrPzU,But the real thing that we want is the queen to have a gaming channel,shane,shane
w2EQ-JkvHqc,when he gets up to yell at ryland for not getting the smoke machine IM DEAD,shane,shane
w2EQ-JkvHqc,shane is 100 times better than any youtuber. he deserves ALL the subscribers,shane,shane
w2EQ-JkvHqc,this was hilarious,shane,shane
w2EQ-JkvHqc,Oh god I am peeing myself this is making me laugh to to to to much,shane,shane
w2EQ-JkvHqc,*you have 100 000 sCuMbAg*,shane,shane
w2EQ-JkvHqc,Garrett's laugh is everything,shane,shane
w2EQ-JkvHqc,YOu'rE LUcky I'm trRAsh,shane,shane
w2EQ-JkvHqc,this is my 3rd time watching this and this is because I haven't  laughed in 4 days..........thanks Shane for the help........,shane,shane
w2EQ-JkvHqc,I laughed so hard this video,shane,shane
w2EQ-JkvHqc,I Hate jess,shane,shane
w2EQ-JkvHqc,*Shane being a literal kween for 14 minutes straight*,shane,shane
w2EQ-JkvHqc,Was this the birth of the queen?,shane,shane
w2EQ-JkvHqc,this video is a mood,shane,shane
w2EQ-JkvHqc,...,shane,shane
w2EQ-JkvHqc,im drnking lemon juice straight from the bottle,shane,shane
w2EQ-JkvHqc,U have more subbed than danandphill,shane,shane
w2EQ-JkvHqc,It's been 6 months and he has 3 more million,shane,shane
w2EQ-JkvHqc,I've never laughed so hard,shane,shane
