videoId,comment,channelId,channelName
FCPDcIQstr8,at 19:50 ish watch the entrance straight ahead  on the right theres a black object that disapears around the corner,shane,shane
FCPDcIQstr8,15:06 "wait dont go in there its third class" LMAO So many funny moments in this and part 1,shane,shane
FCPDcIQstr8,I saw a gohst! non of you did,shane,shane
FCPDcIQstr8,Ewe spookiest video series by far,shane,shane
FCPDcIQstr8,the best part of this video is when shane saw the bunk was breaking and got scared and grabbed ryland and brought him down and no one can tell me different bye,shane,shane
FCPDcIQstr8,Why am i seeing this before bed?,shane,shane
FCPDcIQstr8,Honestly the picture of Garrett at the end is scary enough,shane,shane
FCPDcIQstr8,Garrett  the ghosthunter:D,shane,shane
FCPDcIQstr8,Imagine having that room next to shane  and friends ...wall opens up as your asleep and in  creeps Shane Dawson LOL.,shane,shane
FCPDcIQstr8,I would be dead already just watching this am so scared,shane,shane
FCPDcIQstr8,You can see the tour guide 1:21,shane,shane
FCPDcIQstr8,idk if I'm just going crazy or if i just watch too much ghost adventures but at 21:14 when Garret took that photo if you pause it in the hallway there is a shadow you can make out two legs an arm and a shoulder.,shane,shane
FCPDcIQstr8,the wabbely  noise was her singing or trying to talk and those orbs that were ariund shane were his grandma,shane,shane
FCPDcIQstr8,The part where Shane is in the isolation ward and hears all that moving and footsteps and NO ONE OUTSIDE THE ROOM WAS MOVING FUCKED ME UP,shane,shane
FCPDcIQstr8,Doesn't like to be on camera*sees man in frame**,shane,shane
FCPDcIQstr8,My dad got married here,shane,shane
FCPDcIQstr8,On the video that they were watching on the top u can see a black shadow,shane,shane
FCPDcIQstr8,Rylands sister is cute,shane,shane
FCPDcIQstr8,TURN ON CAPTION,shane,shane
FCPDcIQstr8,why did I watch this before bed rip,shane,shane
FCPDcIQstr8,And I gotta say Garrett is my fave out of the gang! The shit he says cracks me up so much :),shane,shane
FCPDcIQstr8,*ew*,shane,shane
FCPDcIQstr8,I was tryin to drink my water but then I heard that camera noise and almost spilled it everywhere,shane,shane
FCPDcIQstr8,When shane was below the door that crushed the men  or whatever  all the way at the back was a shadow person. It doesn't seem to be evil  however  they probably should've gotten out of there as soon as possible. Edit: If a shadow person has no eyes  it means it is probably kind. If it has green  blue or red eyes  you have to start running ASAP. And probs get a priest to do an exorcism. Red is the worst to come upon.,shane,shane
FCPDcIQstr8,When she said "say something." after a couple seconds if you look at the top left corner you can see a shadow that kinda looks like it's waving!! Does anyone else see that?? AHHHH CREEPY!!!,shane,shane
FCPDcIQstr8,Shane-I wanna fart I wanna fart I just farted,shane,shane
FCPDcIQstr8,Go back to the ship in a year on the exact date and record and take pictures just like this and go to the same exact places and more,shane,shane
FCPDcIQstr8,There were the old people.,shane,shane
FCPDcIQstr8,behind shane top left 5:11,shane,shane
FCPDcIQstr8,morgan holding the baby the whole time hahahahahaha,shane,shane
FCPDcIQstr8,Start:I wanna fall in love up here End: get the f*** out of here,shane,shane
FCPDcIQstr8,omg imagine an american harry story season about this and shane and the squad was in it omggg,shane,shane
FCPDcIQstr8,Why are they saying ew ?,shane,shane
FCPDcIQstr8,Ew,shane,shane
FCPDcIQstr8,Garret comes out of a little hidden passage   Shane.   OH MY GOD  Garret.    Hahahahahaha,shane,shane
FCPDcIQstr8,Why would they let Ryland go to sleep on this thing?,shane,shane
_y5so--EOMc,You didn't glow up and you look like throw up  you got a flaky ass face and your hair is always dirty  your still on youtube even though your almost 30,shane,shane
_y5so--EOMc,omg dylan's so hot but also this video is everything #dyingoflaughter,shane,shane
_y5so--EOMc,12:51 beaming on RYAN,shane,shane
_y5so--EOMc,Shane is fully a great singer. SHOOK,shane,shane
_y5so--EOMc,Yo ..... I just listened to Shane's song on Spotify and I'm literally dying ..... but living .,shane,shane
_y5so--EOMc,Maybe this Christmas was the first Shane video I watched,shane,shane
_y5so--EOMc,WHEN SHANE ACTUALLY TRIED SINGING I WAS QUAKING BECAUSE HES SO GOOOOD,shane,shane
_y5so--EOMc,HEY YOU DUM BITCH!! Oh burn!! What was that?!,shane,shane
_y5so--EOMc,Shane should be a singer,shane,shane
_y5so--EOMc,You make better videos than Rayland,shane,shane
_y5so--EOMc,HERES TO NEVER GLOWING UP WE'D BE RUNNING DOWN THE STREET YELLING KISS MY ASS,shane,shane
_y5so--EOMc,Crunch rap supreme better become your new outro,shane,shane
_y5so--EOMc,Is anyone gonna talk about the fact that Shane is actually a fairly decent singer? I mean  he's no Beyonce but he's also no Tana,shane,shane
_y5so--EOMc,I love how you embarrassed your self and didn't care,shane,shane
_y5so--EOMc,Shane can sing I'm shocked  Ryland has a different story No offense sorry,shane,shane
_y5so--EOMc,Oh my god all the pop-stars and rappers are quaking,shane,shane
_y5so--EOMc,what beat programme is he using?!,shane,shane
_y5so--EOMc,I thought your favorite singer was Britney spears,shane,shane
_y5so--EOMc,"As long as it's almond milk" LMAOO,shane,shane
_y5so--EOMc,1:30 lol,shane,shane
_y5so--EOMc,why is Ryland singing literally me!!!!!!!,shane,shane
_y5so--EOMc,I love the avril Lavigne reference ;),shane,shane
_y5so--EOMc,6:12 Why does the that smile remind me of Garret,shane,shane
_y5so--EOMc,Can I get these songs on Spotify,shane,shane
_y5so--EOMc,9:38 PENNYWISE IS QUAKING AT HIS TWIN,shane,shane
_y5so--EOMc,I had chest pains for when I heard ryland sing. (No joke),shane,shane
_y5so--EOMc,I got the references Shane,shane,shane
_y5so--EOMc,Shane yours sucked dicks and RYLANDS WAS THE SHIT OF A LIFE TIME,shane,shane
_y5so--EOMc,"this song goes out to my future ex-boyfriend...pack yo shit" I LITERALLY SCREAMED ASDKJJKSD,shane,shane
_y5so--EOMc,Why is ryland me when I try to sing,shane,shane
_y5so--EOMc,When Shane literally said "you pick your nose" I WAS FUCKING PICKING MY NOSEHAHAHAHAHAHAHAH.,shane,shane
_y5so--EOMc,5:09 lmao Shane that note was amazing you chose the wrong career,shane,shane
_y5so--EOMc,5:56 that's so mee,shane,shane
_y5so--EOMc,3:08 that is the greatest thing ever.,shane,shane
_y5so--EOMc,I just realized how much Ryland looks like penneywise!!!!!!!!!!!!!,shane,shane
_y5so--EOMc,I do like to pick my ass,shane,shane
_y5so--EOMc,I do like to pick ass,shane,shane
_y5so--EOMc,His fav singer looks like a 12 year old,shane,shane
_y5so--EOMc,Is this shit on Spotify,shane,shane
_y5so--EOMc,I can watch this vid everyday & not get tired of it.,shane,shane
_y5so--EOMc,I think Shane's song is better,shane,shane
_y5so--EOMc,Did he call him Ryan lol,shane,shane
_y5so--EOMc,"what was that" straight. it was straight. xD,shane,shane
_y5so--EOMc,Omg Shane 5:47,shane,shane
_y5so--EOMc,Im shook wow,shane,shane
_y5so--EOMc,#ShanesWasBetter,shane,shane
_y5so--EOMc,omg shanes voice is amazing,shane,shane
_y5so--EOMc,Omg! You got the duck and he's got the flamingo!,shane,shane
_y5so--EOMc,Shane's was fireeeee,shane,shane
_y5so--EOMc,3:56 sounded like This Town by Niall Horan,shane,shane
_y5so--EOMc,And that what my sis told me,shane,shane
_y5so--EOMc,I meant bad,shane,shane
_y5so--EOMc,He helped him cause his was kinda nad,shane,shane
_y5so--EOMc,At 7:24 pause on subtitles when shane says Eva it says piggy,shane,shane
_y5so--EOMc,I'm quaking,shane,shane
_y5so--EOMc,Yeah Shawn. Stop quaking,shane,shane
_y5so--EOMc,Later in the video  When Ryland sneezed  i sneezed at the exact same time lol.,shane,shane
_y5so--EOMc,I really want them to do more videos with dylan!!,shane,shane
_y5so--EOMc,literally Ryland is soooo pissed! lol,shane,shane
_y5so--EOMc,Ryland is so Into his I love it,shane,shane
_y5so--EOMc,@ 12:50 he said this is going to be like music video single light beams down on RYAN   Me: Spites me tea out form quaking,shane,shane
_y5so--EOMc,his laugh at 0:19 is so cute,shane,shane
_y5so--EOMc,8:43 I laughed so hard I almost died,shane,shane
_y5so--EOMc,Why is Shane actually really good at singing lmao I'm shook,shane,shane
_y5so--EOMc,Subtitles gone wrong:  Real: Drag him by his old weave Subtitle: Drag him by his old weesh  Real: Tell him that he sweats so much Subtitle: Tell him that he's snorting to much  Real: Layerin that cake! Subtitles: Layerin the kook  Real: I'm quaking Subtitles: I'm quite gay XDDD,shane,shane
_y5so--EOMc,Darn. He didn't get to the ass picking! XD,shane,shane
_y5so--EOMc,shane has a nice voice thoooooo,shane,shane
_y5so--EOMc,Ur such a queen,shane,shane
_y5so--EOMc,Wow Dylan has so much talent  I've tried making songs and it's impossible for me  so much respect for him! Also watching the diss tracks and then watching this is better than watching the diss tracks first,shane,shane
_y5so--EOMc,Couple therapy goals,shane,shane
_y5so--EOMc,what the everloving fuck shane is such a good singer kill me,shane,shane
_y5so--EOMc,11:38   LOL,shane,shane
_y5so--EOMc,Ryland is MEEEEEEE,shane,shane
_y5so--EOMc,Is it just me or every beat his friend did on his guitar sounded familiar? Like they are in other songs? Is that what they were going for?,shane,shane
GeKhtw8ZZSg,I love watching your little family grow!,shane,shane
GeKhtw8ZZSg,More videos please please I want to see what she turns out to be what her name will bee and lots of updates with her and Chido please,shane,shane
GeKhtw8ZZSg,Name her dose  ( like after 1 in spanish),shane,shane
GeKhtw8ZZSg,Lol 10:10,shane,shane
GeKhtw8ZZSg,Why don't u name no name layla,shane,shane
GeKhtw8ZZSg,I love the Name Queen,shane,shane
GeKhtw8ZZSg,You should name your dog Gucci.,shane,shane
GeKhtw8ZZSg,Soooo cute!!!!!!!!!!!!!!!!!!!!!!!!! Keep her,shane,shane
GeKhtw8ZZSg,This was posted after my birthday but that day is my parents anniversary,shane,shane
GeKhtw8ZZSg,OMG NAME HER DOS CUZ UNO DOS,shane,shane
GeKhtw8ZZSg,Does anyone know the music playing at 9:03 and at 10:05? Ps  adore this vid and am proud to be an animal lover,shane,shane
GeKhtw8ZZSg,They should name her JoJo,shane,shane
GeKhtw8ZZSg,Shane: so theyre getting along?? Ryland: yea Shane: are they gonna have sex??,shane,shane
GeKhtw8ZZSg,Pues,shane,shane
GeKhtw8ZZSg,Name the dog root,shane,shane
GeKhtw8ZZSg,Name her Bee,shane,shane
GeKhtw8ZZSg,I gave the barkbox to my friend Syndey's dog then they came to the house and her dog Gracie had one of the toys and a littel crown:),shane,shane
GeKhtw8ZZSg,MY NAME IS TRINITY  YESSS,shane,shane
GeKhtw8ZZSg,Still haven't decided on a name yet? I love to  see her named Ellie <3,shane,shane
GeKhtw8ZZSg,How much does Jill look like Kristin Bauer.,shane,shane
GeKhtw8ZZSg,Aw,shane,shane
GeKhtw8ZZSg,honey is sooooo cute!!!!,shane,shane
GeKhtw8ZZSg,BELLE,shane,shane
GeKhtw8ZZSg,Honey!!!!,shane,shane
GeKhtw8ZZSg,Name it tyra,shane,shane
GeKhtw8ZZSg,KEEP HER NAME AS LADY!,shane,shane
GeKhtw8ZZSg,Shane you wore that shirt last time lololol xx,shane,shane
GeKhtw8ZZSg,Honey,shane,shane
GeKhtw8ZZSg,GARETTS HAIR IS STYLED IM S H O O K,shane,shane
GeKhtw8ZZSg,love this video! such a beautiful video,shane,shane
GeKhtw8ZZSg,jojo SEE-WAA,shane,shane
GeKhtw8ZZSg,omg the danielle bregoilli picture scared me,shane,shane
GeKhtw8ZZSg,LOVE THE MUSIC FOR CHERTOS ENTRANCE,shane,shane
GeKhtw8ZZSg,name idea:Rainey,shane,shane
GeKhtw8ZZSg,hes wearing the same shirt he did when he made the vid saying he adopted uno,shane,shane
GeKhtw8ZZSg,umm. Frost is a good name,shane,shane
GeKhtw8ZZSg,I love u shane,shane,shane
GeKhtw8ZZSg,You should of named her dos because you've got uno xx,shane,shane
GeKhtw8ZZSg,shane  has anyone ever told you how amazing and sweet of a person you are!! you helped an organization when you didn't have too. you went out of your way to make dreams come true. you're amazing.,shane,shane
GeKhtw8ZZSg,Ahhhhhh I want Herr so much,shane,shane
GeKhtw8ZZSg,10:10 scared the living Brigoli out of me,shane,shane
GeKhtw8ZZSg,Uno  you should name her *dos* for Uno  Dos and Cheeto,shane,shane
GeKhtw8ZZSg,The shirt shane is wearing is the same shirt he wore when he introduced Uno :3,shane,shane
GeKhtw8ZZSg,I agree Garrett  Chris Pine is dream,shane,shane
GeKhtw8ZZSg,Here's a little lesson kids  when looking for pictures of Honey (Shane's new dog)   do NOT search on google images 'Honey Dawson'....I learned the hard way.,shane,shane
GeKhtw8ZZSg,1:53 OMG LOL,shane,shane
GeKhtw8ZZSg,You should call her wendy (williams)  tiffany  diana 4 garrett holly nina bella boo alyssia rhys camilla dos (uno  dos) shelly Bey or beyonce queen,shane,shane
GeKhtw8ZZSg,@shanedawson I like Alaska,shane,shane
GeKhtw8ZZSg,SHANE THAT IS THE SAME SHIRT YOU WORE IN THE VIDEO WERE YOU SHOULD US UNO WHEN YOU GOT HIM IN THAT VIDEO,shane,shane
GeKhtw8ZZSg,You should name her belle for taco  bell or poppy for mouth pop and plus she only responds from mouth pops like duh,shane,shane
GeKhtw8ZZSg,He looks inshane!! Hahha get it! Insane  inshane!!!,shane,shane
GeKhtw8ZZSg,Btw dogs lick their lips (or nose) if they are healthy,shane,shane
GeKhtw8ZZSg,Lady was licking her chomps when Cheeto came out lol,shane,shane
GeKhtw8ZZSg,How about you name her star Burt's,shane,shane
GeKhtw8ZZSg,My boyfriend is hating on Shane Dawson so hard. What do I do?,shane,shane
GeKhtw8ZZSg,Awww~ Shane looked like a Dad,shane,shane
GeKhtw8ZZSg,Shane boyfriend is cute,shane,shane
GeKhtw8ZZSg,Now get a bunny and a small dog then you will have the animals i have just look different,shane,shane
GeKhtw8ZZSg,You guys will make great dads,shane,shane
GeKhtw8ZZSg,Ellie,shane,shane
GeKhtw8ZZSg,"Shane  dogs can't have chocolate" " I know but pigs can RHEEEE",shane,shane
GeKhtw8ZZSg,I just realized that Shane wore the same shirt when he posted the video wear he announced uno,shane,shane
GeKhtw8ZZSg,Athena or xena,shane,shane
GeKhtw8ZZSg,HONEY IS PERFECT TEAM HONEY,shane,shane
GeKhtw8ZZSg,Queen buishy,shane,shane
GeKhtw8ZZSg,2 months later you get another dog,shane,shane
GeKhtw8ZZSg,name suggestions  Baylie or Riley,shane,shane
GeKhtw8ZZSg,Well you've got uno so maybe duos or tre,shane,shane
GeKhtw8ZZSg,Juno or honey,shane,shane
GeKhtw8ZZSg,OMG NAME HER LADY GAGA OR DOES,shane,shane
GeKhtw8ZZSg,(Binge watching) but what about bailey?,shane,shane
GeKhtw8ZZSg,OMG THE Catular romantic music,shane,shane
GeKhtw8ZZSg,Honey bee,shane,shane
xpFh9KHMYwA,This is why I love shane,shane,shane
xpFh9KHMYwA,XDXDXDXDXDXDXD,shane,shane
xpFh9KHMYwA,*THAT GIRL IS SO TALENTED!*,shane,shane
xpFh9KHMYwA,Lilly is my faveee,shane,shane
xpFh9KHMYwA,8:18 the face of a true..... killer,shane,shane
xpFh9KHMYwA,I've never laughed so much!!,shane,shane
xpFh9KHMYwA,The mother may as well have said "She's seen someone killed on tv  it's ok to kill someone in front of her" haha  Well  it makes as much sense as what she actually said....,shane,shane
xpFh9KHMYwA,Drew looks like jaspal from Derek Gerard's channel. If you don't know who that is then please search him up and tell me if you agree,shane,shane
xpFh9KHMYwA,Why was their rap all together so good  & why am I Inlove with Garrett,shane,shane
xpFh9KHMYwA,When she started raping I was so shocked I'm like girl your awesome girl,shane,shane
xpFh9KHMYwA,Shane looks like Russell brand with the black wig !,shane,shane
xpFh9KHMYwA,The whole time Shane was either quaking or shook,shane,shane
xpFh9KHMYwA,Did Drew leave YouTube again?,shane,shane
xpFh9KHMYwA,"I don't kill my children"  Same fam,shane,shane
xpFh9KHMYwA,I feel like Sophie is one of those white girls who rap depressing raps and depressed people repost it on instagran,shane,shane
xpFh9KHMYwA,Shane can cure depression,shane,shane
xpFh9KHMYwA,How has anyone even down thumbed this?,shane,shane
xpFh9KHMYwA,She's amazing!!!!!!,shane,shane
xpFh9KHMYwA,Keep rewinding at 5:50 LOL,shane,shane
xpFh9KHMYwA,OMG HAVE YOU SEEN THE BROTHER  FUCKING YES ME FUCK ME UP,shane,shane
xpFh9KHMYwA,2:00 killls me ahahaha DREW,shane,shane
xpFh9KHMYwA,I made my own rap sang and I'm only 11 and my name is faith,shane,shane
xpFh9KHMYwA,OMG WHEN SHE RAPS RAP GOD MY SMILE BROKE MY FACE,shane,shane
xpFh9KHMYwA,*smoke alarms go off* Shane- "WE HAVE A BEAT",shane,shane
xpFh9KHMYwA,When she sang I'll stand by you I seriously got chills AAAHHHH,shane,shane
xpFh9KHMYwA,Her brother is cute,shane,shane
xpFh9KHMYwA,I am writing a story about Sophie pecora and a little about you,shane,shane
xpFh9KHMYwA,What happened to her?,shane,shane
xpFh9KHMYwA,When Garret & Drew sang Somewhere Over the Rainbow  I lost it!!,shane,shane
xpFh9KHMYwA,When she sang Alexander Hamilton.,shane,shane
xpFh9KHMYwA,dude yes,shane,shane
xpFh9KHMYwA,SHE IS SO GOOD I AM STILL SHOOK,shane,shane
xpFh9KHMYwA,That new bop was so in-shane. Hello my name is Liza Koshy. #Puns,shane,shane
xpFh9KHMYwA,I wish I could join you guys! It looks super fun,shane,shane
xpFh9KHMYwA,I'm goodness she is so beautiful inside and out I hope she will be a star but a star without autotune!!!! GO live a great life sophie,shane,shane
xpFh9KHMYwA,Omg i love how shane calls garrett baby / babe XD,shane,shane
xpFh9KHMYwA,Garret: Christopher was too old... hahaha,shane,shane
xpFh9KHMYwA,Her voice is so prettyyy : ),shane,shane
xpFh9KHMYwA,Ok so you know that person that cries and when you look at them you cry too?thats literally shanes mom,shane,shane
xpFh9KHMYwA,She has to be some how related to Drew,shane,shane
xpFh9KHMYwA,Anyone else started crying when Shanes mom started crying? I love their relationship,shane,shane
xpFh9KHMYwA,Her brothers face the entire time was "why the f are we in some 30 year old man's house?" Lol,shane,shane
xpFh9KHMYwA,I DONT KNOW THESE PEOPLE AND IM BAWLING!!!!,shane,shane
xpFh9KHMYwA,She is so so so amazing!!!,shane,shane
xpFh9KHMYwA,I WISH SHE WAS MY SISTER,shane,shane
xpFh9KHMYwA,Did she meet her brother?,shane,shane
xpFh9KHMYwA,This made me cry more than Infinity War tho wow,shane,shane
xpFh9KHMYwA,No offence but Shanes part of the rap was the best.,shane,shane
xpFh9KHMYwA,I love when you make videos with random people  it makes me cringe.. in a good way though  I swear.,shane,shane
xpFh9KHMYwA,BEST PART AT 19:08,shane,shane
xpFh9KHMYwA,I watched her Alexander Hamilton video,shane,shane
xpFh9KHMYwA,sophie: what's your name man? me: ALEXANDER HAMILTON,shane,shane
xpFh9KHMYwA,drews freestyle rap was me,shane,shane
xpFh9KHMYwA,y am i crying in the club rn.,shane,shane
xpFh9KHMYwA,Awww mama Dawson outfit is so cute,shane,shane
xpFh9KHMYwA,I effin love Garrett!!!,shane,shane
xpFh9KHMYwA,What a talented  down to earth girl and family!  Love that Shane had her on and she got so many more subscribers! Keep on being real Sophie! :),shane,shane
xpFh9KHMYwA,So.    Sweet.    For.   Your.     Mom,shane,shane
xpFh9KHMYwA,She kinda looks like hermini from Harry Potter,shane,shane
xpFh9KHMYwA,FUCKING KEY CHANGE!!!!!!!!!,shane,shane
xpFh9KHMYwA,"Oh my god she's here"  *realized it was Drew*  "Oh that's Drew",shane,shane
xpFh9KHMYwA,this was such a joy to watch!!,shane,shane
xpFh9KHMYwA,when she stopped rapping and shane spread his legs...... i fUTZING LOST IT AJDKSJKS it took me forever to get over it to stop laughing (and choking bc i was laughing too much),shane,shane
xpFh9KHMYwA,CRYING AT SHANE AND HIS MOM OMG,shane,shane
xpFh9KHMYwA,When Shane said your so gay I was like calm down Shane your gay to,shane,shane
xpFh9KHMYwA,I like her good song send me some videos of her.,shane,shane
xpFh9KHMYwA,OH SHIT SHE HAMILTONED THAT FUCKING SHIT,shane,shane
xpFh9KHMYwA,i loved this and glad that shanes mom was happy,shane,shane
x7wTjSU0eQM,I love them aaaaaaall! :D,shane,shane
x7wTjSU0eQM,It was his lost for not giving his number to GARRETT!!,shane,shane
x7wTjSU0eQM,15:26-15:30 Yeah me too,shane,shane
x7wTjSU0eQM,0:42 ME,shane,shane
x7wTjSU0eQM,Is no one gonna mention that that shirt looks great on Shane?,shane,shane
x7wTjSU0eQM,this is the cutest shit ever y'all are actually gonna be such good dads. garrett is so adorable i stan,shane,shane
x7wTjSU0eQM,"I kNoW bOut bAbY JeSuS" me when I go to my CATHOLIC school and I get asked what I know about Christmas and the story behind it,shane,shane
x7wTjSU0eQM,YAY LISA,shane,shane
x7wTjSU0eQM,7:49   .,shane,shane
x7wTjSU0eQM,Wait drew has a mustache?,shane,shane
x7wTjSU0eQM,Can someone put me up for adoption because I have a bad family that abuses me,shane,shane
x7wTjSU0eQM,HAHA GARRET SAYING SHANE EVERYTIME HAS ME CRYING,shane,shane
x7wTjSU0eQM,Kyrie is the best hottest and real uncle drew,shane,shane
x7wTjSU0eQM,Shane do you need a 21 year old daughter? Cause I will volunteer,shane,shane
x7wTjSU0eQM,what happened to drew,shane,shane
x7wTjSU0eQM,*_i wanna be shanes daughter_*,shane,shane
x7wTjSU0eQM,This kid has thr most uncles in the world,shane,shane
x7wTjSU0eQM,Me too Drew  me too.  9:50,shane,shane
x7wTjSU0eQM,The background music is the the music from The vowel song by anthony padilla. XD,shane,shane
x7wTjSU0eQM,13:06 is everything,shane,shane
x7wTjSU0eQM,Wait Shane is gay?,shane,shane
x7wTjSU0eQM,#fishmas,shane,shane
x7wTjSU0eQM,mall? a MALLLLLLLLLLLLLLLLLLLLLLLLLLLLLLLLLLLLL????? what is dis foreign language?? You mean a shooping center??,shane,shane
x7wTjSU0eQM,Please make video with Chris again i love it~,shane,shane
x7wTjSU0eQM,Is that lolli and pops because I love that place,shane,shane
x7wTjSU0eQM,Why am I crying for garret when he got rejected?,shane,shane
x7wTjSU0eQM,5:10 thanksgiving be like lol,shane,shane
x7wTjSU0eQM,awh poor garrett,shane,shane
x7wTjSU0eQM,Is he actually your son if your joking I will be so msd,shane,shane
x7wTjSU0eQM,Cool so lucky,shane,shane
x7wTjSU0eQM,Cool u adopt a child,shane,shane
x7wTjSU0eQM,Rf,shane,shane
x7wTjSU0eQM,WHY WILL NO ONE DATE GARRETT I DONT GET IT IT MAKES ME VERY UPSET,shane,shane
x7wTjSU0eQM,Tony is hot lol,shane,shane
x7wTjSU0eQM,Ryland is so precious,shane,shane
x7wTjSU0eQM,Christopher:"Its ok Uncle Garret",shane,shane
x7wTjSU0eQM,Poor poor garrett,shane,shane
x7wTjSU0eQM,Even Cristopher is super gay,shane,shane
x7wTjSU0eQM,Shane would have beautifull children xD SHANE MAKE FACKING CHILDREN,shane,shane
x7wTjSU0eQM,Jesus died on chrismas,shane,shane
x7wTjSU0eQM,When Garett got rejected! Awwww,shane,shane
x7wTjSU0eQM,Nice,shane,shane
x7wTjSU0eQM,Nooooo Garrett!,shane,shane
x7wTjSU0eQM,I mean if you want to adopt me for a day I live in glendora la is not far just comment on one of my posts,shane,shane
x7wTjSU0eQM,Omg i skipped to the part where they were punching Lisa in her pregnant belly and i thought she actually was pregnant cause i dont keep up with youtubers. I was like waahhhh,shane,shane
x7wTjSU0eQM,The body rolls omg,shane,shane
x7wTjSU0eQM,When they got the m&ms candy I was eating them,shane,shane
x7wTjSU0eQM,Shane I think I'm going to cry!!!!!!!!!!!!!!,shane,shane
x7wTjSU0eQM,Whyyy did u adopt a child????????????????,shane,shane
x7wTjSU0eQM,*"gayness"*  im yelling,shane,shane
x7wTjSU0eQM,1120 to 1130 is me on a date,shane,shane
x7wTjSU0eQM,But I have separation enxiaty so that means I would have to visit my actual family every day some times,shane,shane
x7wTjSU0eQM,Can you adopt me,shane,shane
x7wTjSU0eQM,14:33 through 14:46 AHHAHAHAH,shane,shane
x7wTjSU0eQM,11:28 GARRETT NOOO,shane,shane
x7wTjSU0eQM,All their faces when Garrett said he got rejected,shane,shane
x7wTjSU0eQM,Chris is so cute omg ahahah,shane,shane
x7wTjSU0eQM,when santa tried to be funny i died. Like 100% i'm dead,shane,shane
x7wTjSU0eQM,Chris: Hi daddy Dylan's Me: *cries*,shane,shane
x7wTjSU0eQM,Shes very slow so I left her in my dust...,shane,shane
x7wTjSU0eQM,uploaded dec.12 ..... cHRISTMAS NIGhT,shane,shane
x7wTjSU0eQM,When Garrett got rejected i actually cried for my Hufflepuff buddy,shane,shane
x7wTjSU0eQM,Awe that was so sad when Garett got rejected awe i wanna hug him,shane,shane
x7wTjSU0eQM,I am literally so happy to see Drew,shane,shane
x7wTjSU0eQM,What are your doing?    Shane: *giving myself a headache*,shane,shane
x7wTjSU0eQM,I have a big aaa..... Bottom,shane,shane
x7wTjSU0eQM,Image a big aaa...... Bottom,shane,shane
9oGVCzP4xnc,Shane.do one on the scariest monsters from the past. PLEASE!,shane,shane
9oGVCzP4xnc,Danm I live in the keys,shane,shane
9oGVCzP4xnc,14:34 if they faked it  they could have used like an air compressor to target like hard stream of air idk,shane,shane
9oGVCzP4xnc,The boiler is in  MY  room that I SLEEP in,shane,shane
9oGVCzP4xnc,so my boiler is in my kitchen... like 15/20 inches away from me :),shane,shane
9oGVCzP4xnc,OMG when I was like 8  my mum  sister and I were at our swimming centre. We (not my mum thankfully) were changing in one of the changing rooms when my mum saw a camera peeking under the wall. So my mum quickly gave us a towel and knocked on the door next to us. There was a man hiding a camera under a cloth. She asked to see what he filmed and he ran. Then the police caught him.,shane,shane
9oGVCzP4xnc,Anybody here from Ireland ps there called secondary schools aswell,shane,shane
9oGVCzP4xnc,If I saw the guy in the road I would just back up or run the cones over,shane,shane
9oGVCzP4xnc,i love how the demon was like "FUCK your wet floor sign",shane,shane
9oGVCzP4xnc,Help. I want to go out but im afraid of hidden cameras but i dont want to stay in my house,shane,shane
9oGVCzP4xnc,Whelp....my anxiety is worse.....thanks Shane.....anyway love ya,shane,shane
9oGVCzP4xnc,Shane. YOUR EYES ARE FUCKING CREEPY!,shane,shane
9oGVCzP4xnc,Its too late for this shit. Stop fueling my nightmares  Shane,shane,shane
9oGVCzP4xnc,Yeahh............... im not sleeping tonight,shane,shane
9oGVCzP4xnc,00:10-00:18 Me to my school,shane,shane
9oGVCzP4xnc,Fuuuck my house is p old and in scared,shane,shane
9oGVCzP4xnc,*hears about there could be a bomb under the bed*   JUMPS OFF BED IN FEAR,shane,shane
9oGVCzP4xnc,Omg I change in a locker room everyday Lordy,shane,shane
